date,source,title,link,description
2026-04-13,네이버뉴스,"삼표그룹·현대건설, 0℃서도 48시간 내 굳는 간절기 콘크리트 개발",https://weekly.hankooki.com/news/articleView.html?idxno=7159620,사진=삼표그룹  삼표그룹 계열사 삼표산업은 현대건설과 공동 연구를 통해 기온 보정 강도 적용 절차 없이도 계획된 품질을 확보할 수 있는 '간절기 특수 콘크리트'를 개발하고 현장 적용에 성공했다고 13일 밝혔다. 이번에... 
2026-04-13,네이버뉴스,공공이 먼저 풀고 민간 재건축도 본격 착공,http://www.fnnews.com/news/202604131442599466,"이도주공 2·3단지는 현대건설이 맡아 오는 8월 착공이 예정돼 있다. 인제아파트는 대보건설, 노형세기 1차는 HJ중공업이 각각 연말 착공을 목표로 하고 있다. 2027년에는 이도주공 1단지도 착공에 들어갈 예정이다.... "
2026-04-13,네이버뉴스,영광 해상풍력협의회 출범…11GW '에너지 대전환' 시동,https://www.newsis.com/view/NISX20260413_0003588981,"협의회에는 안마해상풍력㈜를 비롯해 한화오션, 현대건설, EDF 파워솔루션, 낙월블루하트, 대한그린에너지 등 주요 사업자가 참여하고 있다. 영광군은 이번 협의회 출범을 계기로 총 11기가와트(GW) 규모의 해상풍력 단지... "
2026-04-13,네이버뉴스,"대우건설, 데이터센터 전담 조직 신설…전문성 강화 [건설·분양오늘]",https://www.sisaon.co.kr/news/articleView.html?idxno=200189,"삼표그룹, 현대건설과 간절기 특수 콘크리트 개발 삼표그룹은 삼표산업이 현대건설과 공동 연구를 통해 간절기에도 계획된 품질을 확보할 수 있는 '간절기 특수 콘크리트'를 개발하고 현장 적용까지 마쳤다고 13일... "
2026-04-13,네이버뉴스,"[데일리 산업 단신] 삼표그룹, 현대건설과 0℃에도 굳는 ‘간절기 콘크...",https://biz.newdaily.co.kr/site/data/html/2026/04/13/2026041300242.html,"뉴데일리 이보현 기자 = ◆삼표그룹, 현대건설과 0℃에도 굳는 ‘간절기 콘크리트’ 개발 삼표그룹 계열사 삼표산업은 현대건설과 기온 보정 강도 적용 절차 없이도 품질을 확보할 수 있는 ‘간절기 특수 콘크리트’를... "
2026-04-13,네이버뉴스,"삼표그룹·현대건설, 일교차 극복 '간절기 콘크리트' 개발",http://www.newslock.co.kr/news/articleView.html?idxno=128533,삼표산업이 현대건설과 공동 연구를 통해 기온 보정 강도 적용 절차 없이도 계획된 품질을 낼 수 있는 '간절기 특수 콘크리트'를 개발해 현장 도입에 성공했다고 13일 밝혔다. 이번 신규 자재의 가장 큰 특징은 기존에 쓰이던... 
2026-04-13,네이버뉴스,"한국중부발전, 신안우이 해상풍력 PF 금융약정 체결",http://www.knpnews.com/news/articleView.html?idxno=33621,"전략적 투자자로서 발전공기업인 한국중부발전과 함께 한화오션, SK이터닉스, 현대건설이 참여하며, 하부 구조물 등 주요 기자재 공급의 전반을 국내 기업이 담당한다. 특히 이번 사업을 위해 국내 최초로 건조되는... "
2026-04-13,네이버뉴스,"대우건설, '데이터센터 TFT' 신설…기획·시공·운영 아우르는 디벨로퍼...",https://www.newsinside.kr/news/articleView.html?idxno=4589177,"생성형 AI 트렌드와 클라우드 전환 가속화로 데이터센터 수요가 폭발적으로 늘어나면서, 현대건설과 GS건설, SK에코플랜트 등 주요 대형 건설사들 역시 앞다퉈 단순 시공을 넘어 지분 투자와 자체 운영까지 도맡는... "
2026-04-13,네이버뉴스,"0℃에서도 강도 확보…삼표·현대건설, 간절기 콘크리트로 공기·품질 동...",https://www.e-science.co.kr/news/articleView.html?idxno=129154,건설기초소재 전문기업 삼표그룹은 계열사 삼표산업이 현대건설과 공동 연구를 통해 '간절기 특수 콘크리트'를 개발하고 현장 적용에 성공했다. 이번 기술의 핵심은 기존 콘크리트 시공에서 필수적으로 적용되던 '기온... 
2026-04-13,네이버뉴스,"“피하는게 상책”…압구정, 목동 재건축 수주전 시들",https://www.asiatime.co.kr/article/20260413500230,압구정3구역 재건축 수주 결의 모습.(사진=현대건설) 13일 정비업계에 따르면 서울 강남구 압구정3구역 재건축 정비사업 조합이 지난 10일 시공사 선정을 위한 1차 입찰을 마감한 결과 현대건설이 단독으로 응찰해... 
2026-04-13,네이버뉴스,"현대건설, 핀란드 '저탄소 솔루션' 맞손…북유럽 및 글로벌 에너지 시장...",http://www.sisacast.kr/news/articleView.html?idxno=94974,"사진=현대건설  현대건설은 지난 10일 서울 종로구에 위치한 계동 본사에서 빌레 타비오(Ville Tavio) 핀란드 외교통상개발부 장관을 비롯한 핀란드 대표단과 면담을 갖고, 차세대 에너지 분야 협력을 모색했다고 13일... "
2026-04-13,네이버뉴스,"DL이앤씨, 압구정5구역 '도촬 논란' 공식 사과…""입찰 무효 사유 아냐""",https://www.newspim.com/news/view/20260413000606,"현대건설과 DL이앤씨가 최종 서류를 제출한 가운데, 확인 과정에서 DL이앤씨 직원이 현장을 몰래 촬영하다 적발됐다. 이후 해당 절차는 즉시 중단됐으며 조합은 긴급 이사회 개최에 나섰다. DL이앤씨 관계자는 ""상호 제출... "
2026-04-13,네이버뉴스,[특징주] GS건설 4% 안팎 약세…미·이란 종전 협상 결렬에 건설주 동반...,https://www.tokenpost.kr/news/economy/348676,"현대건설도 2%대 약세를 보였고, 삼성물산과 DL이앤씨도 나란히 내림세를 나타냈다. 이는 미국과 이란이 파키스탄 이슬라마바드에서 진행한 1박 2일간의 종전 협상에서 합의에 이르지 못한 영향으로 풀이된다. JD 밴드... "
2026-04-13,네이버뉴스,삼표그룹·현대건설 '간절기 콘크리트' 개발,http://www.inews24.com/view/1959521,삼표그룹이 현대건설과 손잡고 기온 변화가 큰 간절기에도 안정적인 강도를 발현하는 특수 콘크리트를 개발했다. 삼표그룹 계열의 삼표산업은 현대건설과 공동 연구를 통해 기온 보정 강도 적용 절차 없이도 계획된... 
2026-04-13,네이버뉴스,"현대건설, 핀란드와 차세대 에너지 분야 협력키로",https://weekly.cnbnews.com/news/article.html?no=211813,"▲ 현대건설,이한우,핀란드,에너지,히트펌프 지난 10일 현대건설 사옥을 방문한 빌레 타비오 핀란드 외교통상개발부 장관이 현대건설 이한우 대표(왼쪽)와 기념사진을 찍고 있다. 사진=현대건설 현대건설이 지난 10일 서울... "
2026-04-13,네이버뉴스,"[특징주] 건설株, 종전 협상 결렬로 약세…GS건설 4%대 하락",https://www.ajunews.com/view/20260413133519579,"같은시각 현대건설도 전일 대비 2.52% 하락한 17만5000원에 거래 중이다. 이 밖에 삼성물산(-4.79%), DL이앤씨(-1.27%) 등이 약세다. 미국과 이란은 지난 11일부터 파키스탄 이슬라마바드에서 1박 2일간 종전 협상을... "
2026-04-13,네이버뉴스,"여서동 현대건설아파트 주민들, 민덕희 여수시의원에게 감사 인사 전달",http://www.netongs.com/news/articleView.html?idxno=332268,"▲여서동 현대건설아파트 입주민들로 부터 감사의 뜻을 전달 받았다. ⓒ여수시의회 여수시의회 민덕희 의원(더불어민주당, 여서·문수·광림)이 대표 발의한 「여수시 건축 조례 일부개정 조례」가 현장에서 실질적인... "
2026-04-13,네이버뉴스,"신현송 한은 총재 후보자, '고려대 편입·이중 학적' 논란...정치권 ""경...",https://www.thepublic.kr/news/articleView.html?idxno=300851,"신 후보자의 부친은 현대건설 부사장과 현대종합상사 사장을 지낸 인물로, 고려대 상과(현 경영대학) 출신이다. 다만 신 후보자의 고려대 재학 기간은 길지 않았다. 신 후보자는 고려대에서 약 1년간 수학한 뒤 1979년 8월... "
2026-04-13,네이버뉴스,"삼표그룹-현대건설, '0℃'서도 굳는 간절기 특수 콘크리트 개발",https://www.shinailbo.co.kr/news/articleView.html?idxno=5010582,삼표그룹이 현대건설과 손잡고 기온 변화가 큰 간절기에도 안정적인 강도를 발현하는 특수 콘크리트를 개발했다. 삼표그룹의 계열사 삼표산업은 현대건설과 공동연구를 통해 기온 보정 강도 적용 절차 없이도 계획된... 
2026-04-13,네이버뉴스,"수원특례시, 스포츠, 문화예술 연계 축제 지역경제 효자 '톡톡'",https://www.joongdo.co.kr/web/view.php?key=20260413010003800,"시는 KT 위즈, 수원삼성블루윙즈, 수원FC, 한국전력 빅스톰, 현대건설 힐스테이트, KT 소닉붐 등 4대 프로스포츠 구단을 기반으로 연중 지속적인 관람 수요를 확보하고, 특정 시즌에 의존하지 않는 안정적인 소비 유입... "
2026-04-13,네이버뉴스,"건설사, ‘짓고 파는’ 데서 보유·운영까지…수익구조 다변화 움직임",https://www.mediapen.com/news/view/1092941,"대표적으로 현대건설은 지난 2월 한국해외인프라도시개발지원공사(KIND), 한국투자리얼에셋자산운용과 글로벌 도시개발사업 경쟁력 강화를 위한 포괄적 업무협약을 체결했다. 협약 범위에는 공동 투자와 개발은 물론 주택... "
2026-04-13,네이버뉴스,[굿모닝! 13일 건설업계 소식] HDC그룹·대우건설·현대건설·삼성물산,https://www.goodkyung.com/news/articleView.html?idxno=285777,"현대건설은 핀란드와 정부 및 에너지 기업들과 손잡고 차세대 열에너지 인프라 협력에 나섰다. 이를 위해 빌레 타비오 핀란드 외교통상개발부 장관 등 핀란드 대표단과 만나 소형모듈원전(SMR), 히트펌프, 열에너지... "
2026-04-13,네이버뉴스,"삼표그룹·현대건설, 간절기 강도 잡은 특수 콘크리트 개발...""품질·공...",https://www.joongangenews.com/news/articleView.html?idxno=511132,"|중앙이코노미뉴스 송태원 기자|삼표그룹, 현대건설과 '0℃에서도 굳는' 간절기 특수 콘크리트 개발.[사진=삼표그룹]  삼표그룹이 현대건설과 협력해 기온 변화가 큰 간절기에도 안정적인 강도를 발현하는 특수 콘크리트를... "
2026-04-13,네이버뉴스,"삼표산업, 현대건설과 간절기 특수 콘크리트 개발",https://www.ceoscoredaily.com/page/view/2026041310260070634,삼표산업이 현대건설과 공동으로 간절기 특수 콘크리트를 개발했다고 13일 밝혔다. 회사 측은 이번 개발로 영하에 가까운 외기온도(0℃)에서도 48시간 이내에 5MPa(메가파스칼) 이상의 강도를 확보할 수 있게 됐다고... 
2026-04-13,네이버뉴스,압구정도 예외 없다…달라진 정비사업 수주전략,http://www.hansbiz.co.kr/news/articleView.html?idxno=832435,"압구정5구역과 신반포19·25차 재건축 사업은 각각 현대건설과 DL이앤씨, 삼성물산과 포스코이앤씨가 맞붙으며 경쟁입찰이 성립됐다. 특히 압구정5구역은 지난 2020년 한남3구역 재개발사업 이후 양사가 6년 만에 다시... "
2026-04-13,네이버뉴스,"현대건설, 핀란드와 차세대 에너지 협력",https://www.naeil.com/news/read/585049?ref=naver,현대건설이 핀란드와 차세대 에너지 협력을 강화한다. 현대건설은 10일 서울 종로구 계동 본사에서 빌레 타비오 핀란드 외교통상개발부 장관을 비롯한 핀란드 대표단과 면담을 갖고 차세대 에너지 분야 협력을... 
2026-04-13,네이버뉴스,중동 불안에 발목 잡힌 해외건설…수주 감소세 뚜렷,https://www.kukinews.com/article/view/kuk202604130073,"현재 중동에 진출한 주요 건설사로는 현대건설, 삼성물산 건설부문, 대우건설 등이 있다. 이 가운데 현대건설은 사우디아라비아에서 자푸라 가스처리시설과 태양광 발전 연계 380㎸ 송전선로 건설 프로젝트를 진행... "
2026-04-13,네이버뉴스,"현대건설-핀란드, 에너지 인프라 공략 맞손",http://www.lawissue.co.kr/view.php?ud=20260413122745872767191f6c6e_12,현대건설이 신규 대형 원전에 이어 핀란드와의 에너지 협력을 이어간다. 현대건설은 지난 10일 서울 종로구에 위치한 계동 본사에서 빌레 타비오(Ville Tavio) 핀란드 외교통상개발부 장관을 비롯한 핀란드 대표단과... 
2026-04-13,네이버뉴스,"현대건설, 핀란드 에너지 대표단과 차세대 에너지 협력 방안 모색",https://www.nextdaily.co.kr/news/articleView.html?idxno=248422,현대건설이 핀란드 정부 및 에너지 기업 대표단과 만나 차세대 에너지 분야 협력 방안을 모색했다. 현대건설은 지난 10일 서울 종로구 계동 본사에서 빌레 타비오(Ville Tavio) 핀란드 외교통상개발부 장관을 비롯한... 
2026-04-13,네이버뉴스,"관망장 속 '똘똘한 한 채'…힐스테이트 양주옥정 파티오포레, 84㎡ 9억대...",https://www.thebilliards.kr/news/articleView.html?idxno=30468,경기도 양주 옥정신도시에 들어선 현대건설의 블록형 단독주택 '힐스테이트 양주옥정 파티오포레'가 부동산 시장 전반의 관망세 속에서도 '똘똘한 한 채'로 주목받고 있다. 국토교통부 실거래가 공개시스템에 따르면... 
2026-04-13,네이버뉴스,"압구정3구역, 이달 20일 시공자 2차 현설… 현대가 눈독",https://www.arunews.com/news/articleView.html?idxno=61528,시공권 확보를 향한 현대건설의 높은 관심 속에 수주 향방에 업계의 관심이 모아지고 있다. 압구정3구역 재건축조합(조합장 안중근)은 지난 10일 시공자 선정을 위한 재입찰공고를 냈다. 앞서 지난 2월... 
2026-04-13,네이버뉴스,"[산업소식] 기아 디 올 뉴 셀토스, 소형 SUV 시장 1위 등극",http://www.4th.kr/news/articleView.html?idxno=2110359,"삼표그룹과 현대건설 관계자들이 공동 개발한 '간절기 특수 콘크리트'의 현장 검증을 마친 후 기념촬영을 하고 있다.  2026.4.13./사진=삼표그룹 삼표그룹, 현대건설과 간절기 특수 콘크리트 개발 삼표그룹은... "
2026-04-13,네이버뉴스,"제주, 공공 건설투자 확대...민간 재건축 아파트 공사 연내 본격화",https://www.headlinejeju.co.kr/news/articleView.html?idxno=590581,"재건축 사업 현황을 보면, 이도주공 2·3단지(867세대, 시행사 현대건설)는 오는 8월 착공할 예정이다. 인제아파트(106세대, 시행사 대보건설)와 노형세기 1차(108세대, 시행사 HJ중공업)는 올 연말쯤 착공할 것으로... "
2026-04-13,네이버뉴스,"AI 데이터센터 '골드러시'…건설업계, 시공 넘어 개발·운영까지",http://www.4th.kr/news/articleView.html?idxno=2110358,지난해 서울 금천구 '케이스퀘어데이터센터 가산'을 준공한 현대건설은 데이터센터 개발부터 운영까지 업역을 확장하고 일본을 시작으로 해외까지 보폭을 넓힌다는 계획이다. GS건설도 최근 하나금융과 손잡고 AI... 
2026-04-13,네이버뉴스,[건설업계 동향] 현대건설ㆍ삼성물산(4.13),http://www.weeklytoday.com/news/articleView.html?idxno=770599,"■ 현대건설-핀란드, 차세대 에너지 인프라 협력 강화…SMR·열에너지 솔루션 논의 - 빌레 타비오 핀란드 외교통상장관 방한…스테디 에너지 등 혁신기업 동참 - 전력 넘어 산업·지역난방 탈탄소 공략…북유럽 에너지... "
2026-04-13,네이버뉴스,0도에도 굳는 간절기 특수 콘크리트 개발 및 현장 적용돼,https://www.safetynews.co.kr/news/articleView.html?idxno=247579,"13일 업계에 따르면 삼표그룹 계열사 삼표산업, 현대건설은 공동 연구를 통해 기온 보정 강도 적용 절차 없이도 계획된 품질을 확보할 수 있는 간절기 특수 콘크리트를 개발, 현장 적용에 성공했다. 이번에 개발된... "
2026-04-13,네이버뉴스,"현대건설, 1분기 실적 ‘부진’…하반기 믹스 개선에 반등 기대",https://www.m-economynews.com/news/article.html?no=66386,"LS증권, “숫자로 증명할 한 해...목표주가 21만원” 제시 현대건설이 올해 1분기 다소 부진한 실적을 기록할 전망이다. 다만 저마진 현장 종료와 신규 프로젝트 반영에 따른 수익성 개선이 하반기부터 본격화될 것으로... "
2026-04-13,네이버뉴스,"종전 기대 식었다...유가 뛰고 재건 멀어져, 뼈 아픈 항공·건설주",https://www.mt.co.kr/stock/2026/04/14/2026041311211298311,"GS건설은 5%대, DL이앤씨는 4%대, 삼성E&A는 3%대, 현대건설은 2%대 하락률을 기록하고 있다. 지난주 주가반등 기대감을 고조시킨 미국·이란의 첫 종전협상이 주말새 무위로 돌아가며 매도세를 자극했다. 양국... "
2026-04-13,네이버뉴스,"삼표그룹 - 현대건설, '0℃에서도 굳는' 간절기 특수 콘크리트 개발",http://www.worktoday.co.kr/news/articleView.html?idxno=83683,삼표그룹과 현대건설 관계자들이 공동 개발한 '간절기 특수 콘크리트'의 현장 검증을 마친 후 기념촬영을 하고 있다. (사진 제공=삼표그룹) 삼표그룹이 현대건설과 기온 변화가 큰 간절기에도 안정적인 강도를 확보하는... 
2026-04-13,네이버뉴스,"삼표-현대건설, '날씨 무관' 간절기 특수 콘크리트 상용화…공기 단축 ...",https://www.thefairnews.co.kr/news/articleView.html?idxno=74196,삼표그룹이 현대건설과 함께 일교차가 큰 간절기에도 안정적인 강도를 발현하는 '간절기 특수 콘크리트'를 개발하고 실제 건설 현장에 적용하는 데 성공했다고 13일 밝혔다. 이번 기술은 기온 변화에 따른 품질 변동을... 
2026-04-13,네이버뉴스,"삼표·현대건설, '영하 콘크리트' 개발…간절기 시공 혁신",https://www.straightnews.co.kr/news/articleView.html?idxno=300006,삼표산업이 현대건설과 공동 연구를 통해 '간절기 특수 콘크리트'를 개발하고 실제 건설 현장에 적용했다고 13일 밝혔다. [사진=삼표그룹] 삼표그룹이 현대건설과 공동으로 간절기에도 안정적인 강도를 확보할 수 있는 특수... 
2026-04-13,네이버뉴스,"美-이란 협상 결렬에 주가 희비 교차…LIG넥스원 52주 신고가, 건설은 상...",http://www.newsworker.co.kr/news/articleView.html?idxno=421671,"DL이앤씨는 4.02%, 현대건설은 2.28%, IPARK현대산업개발은 3.96% 각각 하락했다. 태영건설과 동부건설도 같은 시각 각각 1.93%, 2.05% 떨어졌다. 건설주의 하락은 최근 급등 과정에서 쌓인 상승분을 일부 반납하는... "
2026-04-13,네이버뉴스,"삼표그룹, 현대건설과 '0℃에서도 굳는' 특수 콘크리트 개발",http://www.efnews.co.kr/news/articleView.html?idxno=129019,삼표그룹과 현대건설 관계자들이 공동 개발한 '간절기 특수 콘크리트'의 현장 검증을 마친 후 기념촬영을 하고 있다. /사진=삼표그룹 건설기초소재 전문기업 삼표그룹의 계열사 삼표산업은 현대건설과 공동 연구를 통해... 
2026-04-13,네이버뉴스,[#부동산 나들이] 삼표-현대 '간절기 콘크리트 개발'·대우 '데이터센터...,https://www.newsworks.co.kr/news/articleView.html?idxno=837551,삼표산업이 현대건설과 0도에서도 안정적으로 굳는 간절기 특수 콘크리트를 개발했고 대우건설이 '데이터센터 TF'를 신설했다. 삼성물산건설부문이 전력거래소와 업무협약(MOU)을 체결했고 월급쟁이부자들이 부동산... 
2026-04-13,네이버뉴스,"건설업계, 안전보건 교육 현장 선정 등 시장 요구 대응 위해 앞장선다",https://www.cstimes.com/news/articleView.html?idxno=701728,삼표그룹과 현대건설 관계자들이 공동 개발한 '간절기 특수 콘크리트'의 현장 검증을 마친 후 기념촬영을 하고 있다. 건설기초소재 전문기업 삼표그룹의 계열사 삼표산업은 현대건설과 공동 연구를 통해 '간절기 특수... 
2026-04-13,네이버뉴스,1~2월 제주 건설수주액 396% 증가...공공 사업 집중 투입,https://www.jejusori.net/news/articleView.html?idxno=501589,"대표적으로 ▲이도주공 2·3단지(867세대, 현대건설, 8월 착공 예정) ▲인제아파트(106세대, 대보건설, 연말) ▲노형세기 1차(108세대, HJ중공업, 연말) 등이 꼽힌다. 2027년에도 이도주공 1단지가 착공에 들어갈 예정이다.... "
2026-04-13,네이버뉴스,"신현송 한은 총재 후보자, 입대 전 고려대 편입 이력 논란...'이중 학적...",http://www.sisunnews.co.kr/news/articleView.html?idxno=236793,"당시 현대건설 부사장 등을 지낸 신 후보자의 부친도 고려대 출신인 것으로 확인된 가운데, 고졸 학력인 신 후보자가 대학 2년 과정 수료 등 통상의 편입학 조건을 갖추지 못했음에도 편입이 가능했던 배경에 대해... "
2026-04-13,네이버뉴스,"신현송 한은 총재 후보자, '이중 학적' 의혹 … 옥스퍼드 합격 후 고려대...",https://biz.newdaily.co.kr/site/data/html/2026/04/13/2026041300125.html,"신 후보자의 부친은 현대건설 부사장과 현대종합상사 사장을 지낸 고려대 상과 출신이다. 신 후보자는 고려대 경제학과에서 1년간 수학한 뒤, 1979년 8월부터 서울 용산 한미연합군사령부에서 영문 타자병으로 복무했다.... "
2026-04-13,네이버뉴스,"[건설 Pick] 현대건설·삼성물산, 국내외 시장에서 미래 먹거리 확보 위...",https://www.lcnews.co.kr/news/articleView.html?idxno=200620,라이센스뉴스 = 박창배 기자 | 현대건설과 삼성물산이 각각 국내외 시장에서 미래 먹거리 확보를 위한 전략적 행보를 이어가고 있다. 현대건설은 탄소 중립 선도국인 핀란드와 손잡고 차세대 에너지 인프라 시장으로... 
2026-04-13,네이버뉴스,간절기에도 '강도 유지'…삼표·현대건설 특수 콘크리트 개발,https://biz.sbs.co.kr/article_hub/20000303836?division=NAVER,"삼표그룹 계열사 삼표산업은 현대건설과 공동 연구를 통해 '간절기 특수 콘크리트'를 개발하고 현장 적용에 성공했다고 오늘(13일) 밝혔습니다. 이번 기술은 기존처럼 기온에 따라 강도를 보정하는 방식이 아닌, 별도 보정... "
2026-04-13,네이버뉴스,"삼표그룹-현대건설, 0℃서 굳는 특수 콘크리트 개발",http://www.smedaily.co.kr/news/articleView.html?idxno=355540,삼표그룹과 현대건설 관계자들이 공동 개발한 '간절기 특수 콘크리트'의 현장 검증을 마친 후 기념촬영을 하고 있다. 이 기술은 영하의 기온까지 내려가는 간절기 콘크리트 공사의 안정적인 강도를 확보해 품질 혁신을... 
2026-04-13,네이버뉴스,"삼표·현대건설, 0℃에도 굳는 콘크리트 개발…간절기 시공 변수 줄인다",https://www.asiatime.co.kr/article/20260413500109,"삼표·현대건설, 시멘트 굳히기 '혁신' 성과 용산·반포 건설현장에 적용해 검증 완료 향후 기술 인증 절차로 공신력 확보 예정 [아시아타임즈=옥한빈 기자] 삼표그룹과 현대건설이 기온 변화가 큰 봄·가을철에도... "
2026-04-13,네이버뉴스,"삼표·현대건설, 기술동맹…'반포 디에이치' 등 고급단지 품질 높인다",https://www.sidae.com/article/2026041310524079830,삼표그룹이 현대건설과 손잡고 기온 변화가 심한 간절기에도 안정적인 강도를 발현하는 특수 콘크리트를 개발하며 건설 현장의 품질 혁신을 주도하고 있다. 건설기초소재 전문기업 삼표그룹의 계열사 삼표산업은... 
2026-04-13,네이버뉴스,"삼표그룹, 현대건설과 '0℃에서도 굳는' 콘크리트 개발",https://www.womentimes.co.kr/news/articleView.html?idxno=102123,이는 삼표산업과 현대건설과 공동 연구를 통해 별도의 기온 보정 강도 적용 절차 없이 계획된 품질을 확보할 수 있는 '간절기 특수 콘크리트'를 개발한데 따른 것이다. 이 특수 콘크리트은 기존 '기온 보정값' 적용 방식의... 
2026-04-13,네이버뉴스,"현대건설, 압구정3·5구역에서 자산관리로 차별화",https://www.arunews.com/news/articleView.html?idxno=61450,현대건설이 서울 강남구 압구정3·5구역에 공동주택 최초로 금융권 프라이빗 자산관리 센터를 결집한다. 일종의 종합 금융 솔루션을 제공하겠다는 취지다. 현대건설은 이달 9일 압구정3·5구역 입주민 전용 '원스톱... 
2026-04-13,네이버뉴스,배당 역송금 시즌 돌아왔다…환시 변수 될 '삼전닉스' 역대급 배당일은,https://news.einfomax.co.kr/news/articleView.html?idxno=4409173,"아울러 현대글로비스, 현대로템, 현대건설, 현대오토에버, 현대차증권 등이 외국인에 도합 2천500억원(약 1억7천만달러)의 배당금을 지급한다. SK하이닉스와 현대차그룹의 배당금만으로도 8억달러를 훌쩍 넘는다.... "
