date,source,title,link,description
2026-04-17,네이버뉴스,"신반포2차, 한강변 48층·2000가구 넘는 대단지로 탈바꿈",https://www.hankyung.com/article/202604177621i,시공은 현대건설이 맡는다. 단지명은 ‘디에이치 르블랑’으로 정했다. 한강변 입지의 특성을 최대한 살리고 한강변관리기본계획에 따른 입체적 수변경관 창출을 위해 특별건축구역으로 지정해 주변 도시맥락과... 
2026-04-17,네이버뉴스,"신반포2차, 48층 규모 재건축 속도…2056가구 공급",http://www.edaily.co.kr/news/newspath.asp?newsid=02994646645417104,"통해 치안센터와 아버지센터 등 공공시설을 건립한다. 한강변 반포권 최대 재건축 단지인 신반포2차 시공사는 현대건설이다. 현대건설은 이곳에 하이앤드 브랜드를 적용, 2056가구 규모 ‘디에이치 르블랑’을 선보인다."
2026-04-17,네이버뉴스,[서미숙의 집수다] LH 공공주택 직접시행 전환…브랜드 각축장 된 민참...,https://www.yna.co.kr/view/AKR20260417048000003?input=1195m,지난해 평택 고덕 민참 프로젝트를 주수한 현대건설도 민참사업 수주를 더욱 확대한다는 방침이다. 올해 LH가 발주한 1차 민참사업 공모에는 인천 검단·영종지구 등 4개 블록 1천697가구의 경우 DL이앤씨 컨소시엄이... 
2026-04-17,네이버뉴스,"마이베네핏 AI 헬스케어 솔루션, 조달청 혁신제품 2연속 지정",https://www.mt.co.kr/future/2026/04/17/2026041617013957733,"현대건설과의 협업을 통해 주거단지 헬스케어 솔루션도 공급하고 있다. 제품의 유효성은 SCI급 논문 6편을 포함한 12편의 임상 논문을 통해 검증됐다. 정석모 마이베네핏 대표는 ""공공과 산업 현장에서 모두 활용 가능한... "
2026-04-17,네이버뉴스,중동전쟁 장기화 '불가항력' 사유 인정...건설사 책임준공기한 연장 '일...,http://www.popcornnews.net/news/articleView.html?idxno=118617,"■ 현대건설-포스코이앤씨, 준공사항변동 선제 조치 나서 이번 정부 결정에 따라 향후 조합에 공사비 상승 및 기간 지연 발생 가능성을 예고하는 시공사 움직임이 늘어날 것으로 예상된다. 포스코이앤씨는 최근 시공 중인... "
2026-04-17,네이버뉴스,"""사즉생의 각오"" 건설업계, '안전 중심' 산업 생태계 새 판 짠다",https://www.mediapen.com/news/view/1093931,"현대건설은 올해 처음으로 'H-Safe 오픈이노베이션 챌린지'를 개최하고 안전 분야 혁신기업 7개사를 선정했다. 해당 프로그램은 정부와 지자체, 민간 건설사가 협력해 AI CCTV, 건설 로봇, 디지털 안전교육 플랫폼 등 다양한... "
2026-04-17,네이버뉴스,상도동 7500가구 ‘친환경 주거타운’ 탈바꿈,https://www.dnews.co.kr/uhtml/view.jsp?idxno=202604161439435700557,"이 자리에는 현대건설, 대우건설, ㈜한화 건설부문, 제일건설, 우미건설, 극동건설 등 6개 건설사가 참석해 관심을 보였다. 상도15구역은 상도동 279번지 일대로 지상 35층 아파트 3204가구와 근린생활시설을 조성하는... "
2026-04-17,네이버뉴스,GTX-C 청량리변전소 인허가 갈등 장기화…GTX-B 개통 지연 여파 우려,https://www.electimes.com/news/articleView.html?idxno=367097,"◆지자체 인허가 거부 방침에 시공사 법적 대응 가능성 열어둬 16일 철도업계와 관계 기관 등에 따르면, 국토교통부와 사업시행자인 지티엑스씨(현대건설 컨소시엄)는 서울 청량리역 철도부지 지하 4층(약 34m 이하)에... "
2026-04-17,네이버뉴스,"IPARK현대산업개발, 10대 건설사 중 원가율 최저",http://www.datanews.co.kr/news/article.html?no=144338,"2024년에는 전년 대비 원가율이 상승한 건설사가 현대건설, 대우건설, 현대엔지니어링, 롯데건설 등 4곳이었지만, 2025년에는 대우건설과 포스코이앤씨 2곳으로 줄었다. 특히 현대엔지니어링과 현대건설의... "
2026-04-17,네이버뉴스,"[KMEC증권 레이더 ①] 건설주, 저평가 매력 부각…자재·유가 변수는 부...",http://www.kmecnews.co.kr/news/articleView.html?idxno=46235,"반면 현대건설(2.11배), 대우건설(2.12배), 삼성E&A(1.31배)는 상대적으로 높은 편이다. 중소형 건설사는 더 낮다. 한신공영과 동부건설은 0.27배, 계룡건설은 0.25배 수준이다. 코오롱글로벌(0.68배), 금호건설(0.65배), SGC E&C... "
2026-04-17,네이버뉴스,"[단독] 불가리아 정부, 웨스팅하우스 이어 현대건설 호출…코즐로두이...",https://www.theguru.co.kr/news/article.html?no=100684,"불가리아 에너지부 장관, 주불가리아 한국대사·현대건설 경영진 회동 “코즐로두이 원전, 고정된 비용으로 건설돼야”…토지 정상가격 수용 요구 ESC 계약 연장 합의…현대건설 “새로운 엔지니어링 업무 포함될 것”... "
2026-04-17,네이버뉴스,[아파트하자보고서③] 정비사업 승부는 '대응 역량'···건설사 품질 전...,https://www.seoulfn.com/news/articleView.html?idxno=626367,현대건설은 시공 전 단계별 정밀 품질 진단으로 하자 판정 비율을 지속적으로 낮추고 있다. 전담 CS팀을 통한 신속 조치와 관리 시스템의 디지털 전환을 고도화해 고객 신뢰를 강화한다는 방침이다. 대우건설은 사전... 
2026-04-17,네이버뉴스,"[단독]현대건설 대표단, 불가리아 에너지부 장관과 회동...원전 EPC계약 ...",https://thetracker.co.kr/View.aspx?No=4045244,더트래커 박민정 기­자 mjp@thetracker.co.kr 더트래커 = 박민정 기자현대건설 대표단이 불가리아 에너지부 장관과 회동했다. 미국 웨스팅하우스와 컨소시엄 형태로 수주한 불가리아 코즐로두이 원전 7·8호기 EPC( 설계... 
2026-04-17,네이버뉴스,"“가덕도신공항은 중요한 국가 사업”… 정부, 건설사에 차질 없는 공사...",http://www.kookje.co.kr/news2011/asp/newsbody.asp?code=0200&key=20260417.99099004908,이전에 수의계약 대상이었던 현대건설 수뇌부와는 이 같은 형식의 회동이 한 번도 이뤄지지 않았다. 이런 점을 들어 업계에서는 정부가 가덕도신공항 적기 개항을 위해 총력을 다하고 있다는 평가를 내린다.
2026-04-17,네이버뉴스,"기계 상장기업 브랜드평판 4월 빅데이터 분석... 1위 두산에너빌리티, ...",https://www.pinpointnews.co.kr/news/articleView.html?idxno=446184,"뒤를 이어 휴림로봇, HD현대건설기계, 두산밥캣, 현대엘리베이터, 태광, SNT에너지, 스맥 등이 상위권을 형성했다. 중위권에서는 우진, 대동, 성광벤드, 에스에프에이, 로보스타, 한신기계 등이 포진하며 산업 전반의... "
2026-04-17,네이버뉴스,강동하남남양주선 2·5공구 향방은… 추가 참여사 등장 ‘주시’,https://news.mtn.co.kr/news-detail/2026041617223446546,"이 가운데 1공구는 서울시가, 나머지 2∼6공구는 경기도가 각각 담당한다 2공구에는 현대건설 컨소시엄만, 5공구에는 진흥기업 컨소시엄만 각각 관심을 드러냈다. 1공구 입찰참가자격사전심사(PQ) 서류 접수에는 아무도... "
2026-04-17,네이버뉴스,중동 재건 기대 확대…국내 건설사에 기회 될까,https://www.kukinews.com/article/view/kuk202604160180,"이어 현대건설, 대우건설, GS건설, DL이앤씨가 각각 2건 수준으로 파악된다. 대표적으로 화재로 손상을 받은 아랍에미리트에 위치한 루와이스 정유소는 삼성E&A를 비롯해 GS건설, 대우건설이 시공에 참여했다. 전문가 역시... "
2026-04-17,네이버뉴스,중동 리스크에 공사비 인상 조짐…건설현장 위기 현실화,https://www.etoday.co.kr/news/view/2576414,현대건설 또한 복수 사업장에서 공사비 조정에 나섰다. 현대건설은 지난달 말 서울 은평구 대조1구역 재개발 조합에 공문을 보내 원자재 공급 차질이 지속될 경우 준공 일정 조정이 불가피하다며 추가 공사비 보전을... 
2026-04-17,네이버뉴스,"압구정5구역 ‘몰카 볼펜’ 논란, 대형 로펌 격돌로 확전",https://biz.chosun.com/real_estate/real_estate_general/2026/04/17/7ENIIUEBNRFFJHP3H6ZLE4AJ3E/?utm_source=naver&utm_medium=original&utm_campaign=biz,"현대건설, 김앤장 자문 DL이앤씨 직원 고소 DL이앤씨, 광장·화우 자문 “입찰 무효 사유 아냐” 서울 강남구 압구정동 압구정5구역 재건축 시공사 선정 과정에서 발생한 ‘볼펜 몰카’ 사건이 건설사 간 자존심 대결을... "
