date,source,title,link,description
2026-04-08,네이버뉴스,"이란 종전 기대감↑...삼성E&A·HD현대·두산, 중동 재건특수 올라타나",https://www.ajunews.com/view/20260408145445879,"재건특수는 플랜트 기업뿐만 아니라 HD현대건설기계, 두산밥캣 등 K-건설장비 기업도 함께 누릴 것으로 예측된다. HD현대건설기계는 사우디아라비아, UAE, 카타르 등 중동 주요 국가와 튀르키예에서 올해 1~2월 동안 총... "
2026-04-08,네이버뉴스,강남권 마지막 뉴타운 ‘거여·마천’ 속도 붙었다⋯‘제2의 개포’ 주...,https://www.etoday.co.kr/news/view/2573947,마천4구역은 현대건설이 하이엔드 브랜드 ‘디에이치’를 앞세워 사업을 진행하고 있다. 마천1구역 역시 현대건설의 참여를 전제로 시공사 선정 절차에 들어갈 것으로 알려졌다. 마천5구역에서는 롯데건설과 현대건설... 
2026-04-08,네이버뉴스,PF 빚 대신 떠안는 건설사… 강동 건물 대출 3000억 대신 갚은 건설사도...,https://biz.chosun.com/real_estate/real_estate_general/2026/04/08/N332ZH5PXZD5TIDTNNSSMJMNTA/?utm_source=naver&utm_medium=original&utm_campaign=biz,8일 한국신용평가에 따르면 신용등급이 있는 주요 13개 건설사(현대건설·DL이앤씨· 포스코이앤씨·GS건설·롯데건설·IPARK현대산업개발·신세계건설·SK에코플랜트·KCC건설·서희건설·BS한양·IS동서·진흥기업)가 1년... 
2026-04-08,네이버뉴스,[특징주]‘중동 재건 특수’ 기대감에…건설주 급등,https://www.dnews.co.kr/uhtml/view.jsp?idxno=202604081503576910493,"이외 DL이앤씨(25.93%), 현대건설(21.04%), 삼성물산(12.77%) 등 주요 건설사들도 두 자릿수 상승률을 기록하며 거래를 마쳤다. 이번 건설주 급등의 주요 배경은 미·이란 간 2주 휴전 합의다.도널드 트럼프 미국 대통령은... "
2026-04-08,네이버뉴스,"스마트 장비 들이고 교육 전문가 키우고 … 건설업계, 안전경영 고삐",https://biz.newdaily.co.kr/site/data/html/2026/04/08/2026040800275.html,8일 건설업계에 따르면 현대건설은 AI가 탑재된 건설 장비 도입을 추진하고 있다. AI 기반 영상 인식 및 위험 감지 기술을 활용해 사고를 예방하고 근로환경을 근본적으로 개선하기 위한 것이다. 이를 위해 현대건설은... 
2026-04-08,네이버뉴스,현대건설 주가 21% 급등…건설주 랠리 속 강세 지속,https://www.job-post.co.kr/news/articleView.html?idxno=212981,"국내 대형 건설사 현대건설 주가가 4월 8일 급등하며 건설주 강세 흐름을 이어갔다. 한국거래소(KRX)에 따르면 현대건설 주가는 이날 18만9,100원에 마감하며 전일 대비 3만3,200원(+21.30%) 상승했다. 장 초반부터 강한... "
2026-04-08,네이버뉴스,"[중화학 ON] 포스코, 조업지원 협력사 직원 7000명 직접 고용 外",https://dealsite.co.kr/articles/159858,"◆HD건설기계-현대건설, 건설기계 스마트 안전 기술 개발 '맞손' HD건설기계가 현대건설과 '건설기계 스마트 안전기술 공동 개발 및 적용을 위한 업무협약'을 체결했다. 이번 협약은 건설 장비 중심의 안전관리 역량... "
2026-04-08,네이버뉴스,"현대건설, HD건설기계와 스마트 안전기술 공동 개발",http://www.metroseoul.co.kr/article/20260408500299,현대건설 김제영 안전수행지원실장(왼쪽)과 HD건설기계 최태근 글로벌 통합 영업본부장이 '건설기계 스마트 안전기술 공동 개발 및 적용을 위한 업무협약'을 체결하고 기념사진을 촬영하고 있다. /현대건설 현대건설이... 
2026-04-08,네이버뉴스,"[TOP's Pick] [중후장대] 포스코, 협력사 직원 7000명 ‘직접 고용’ 外",https://www.topdaily.kr/articles/109598,"◆ HD건설기계-현대건설, ‘스마트 안전’ 맞손…AI 굴착기 현장 투입 HD건설기계와 현대건설이 7일 ‘건설기계 스마트 안전 기술 개발 협력’을 위한 MOU를 체결함. 이번 협약으로 HD건설기계는 AI 카메라를 활용한... "
2026-04-08,네이버뉴스,400조 쌓였는데 공사는 멈췄다…건설업 '착공 절벽'의 역설[NW리포트],https://www.newsway.co.kr/news/view?ud=2026040814204749405,"기업별로는 삼성물산 29조4978억원, 현대건설 71조781억원, 대우건설 50조5968억원, DL이앤씨 28조1240억원, GS건설 70조5607억원, 현대엔지니어링 24조6261억원, 포스코이앤씨 48조72억원, 롯데건설 40조1785억원... "
2026-04-08,네이버뉴스,"현대건설, HD건설기계와 협력…""AI 장비로 현장 안전 강화""",http://www.kdfnews.com/news/articleView.html?idxno=181526,현대건설이 AI 기반 건설장비 도입을 통해 현장 안전관리 고도화에 나선다. 건설기계 단계부터 안전기술을 적용해 사고 예방 체계를 강화하겠다는 구상이다. 현대건설은 7일 서울 종로구 계동 본사에서 HD건설기계와... 
2026-04-08,네이버뉴스,30대 건설사 중 1분기 행정처분 최다 건설사는,https://www.goodkyung.com/news/articleView.html?idxno=285588,"현대건설, 한화 건설부문, SK에코플랜트, 코오롱글로벌, 효성중공업, 계룡건설산업도 1건씩 과태료 처분을 받았다. 세부 위반 사항으로는 '하도급 통지의무 불이행'이 대부분이었으며, '건설공사대장 미통보 또는... "
2026-04-08,네이버뉴스,"'30조' 목동 재건축 스타트…6단지, 첫 시공사 입찰 앞둬",https://www.asiatime.co.kr/article/20260408500290,일찍이 관심을 보여오던 DL이앤씨를 비롯해 △삼성물산 건설부문 △현대건설 △대우건설 △포스코이앤씨 △SK에코플랜트 등 10개사다. 현설에서는 정비계획 기준 범위 내에서 시공자를 선정하되 가구당 주차대수 2대... 
2026-04-08,네이버뉴스,[특징주] 건설주 줄줄이 상한가…종전 따른 인프라 재건 기대 영향,https://www.sidae.com/article/2026040814422664778,DL이앤씨는 26.06% 급등했고 현대건설도 21.30% 오르며 20% 넘는 상승률을 보였다. 건설주가 잇따라 강세를 보이는 이유는 미국과 이란 전쟁이 곧 마무리될 것이라는 기대감이 강하게 작용한 것으로 풀이된다. 미국과... 
2026-04-08,네이버뉴스,"HD건설기계, 현대건설 현장에 스마트 굴착기 공급",https://www.newsfreezone.co.kr/news/articleView.html?idxno=684112,HD건설기계는 현대건설과 서울 종로구 현대건설 사옥에서 '건설기계 스마트 안전기술 공동 개발 및 적용을 위한 업무협약'을 체결했다고 8일 밝혔다. 이번 협약은 양사의 기술력과 현장 데이터를 바탕으로 건설 장비의... 
2026-04-08,네이버뉴스,"포스코이앤씨, 건설사 첫 노란봉투법 심문 대상…'교섭공고 미이행' 쟁...",https://www.newspim.com/news/view/20260408000454,"현재 민주노총, 한국노총 등 노동계는 현대건설, 대우건설, 롯데건설, DL이앤씨 등 건설사의 교섭요구 사실 공고 미이행에 대한 시정신청을 계획 중이다. 우선 각 하청 노조가 개별적으로 교섭을 진행하기 위해... "
2026-04-08,네이버뉴스,"HD건설기계·현대건설, AI로 '사고 제로 현장' 만든다",https://www.megaeconomy.co.kr/news/newsview.php?ncode=1065589822153417,HD건설기계가 현대건설과 손잡고 안전한 건설 현장 조성을 위한 '스마트 안전 기술 협력'을 본격화한다. HD건설기계는 7일 서울 종로구에 있는 현대건설 본사에서 양사 관계자가 참석한 가운데 ‘건설기계 스마트... 
2026-04-08,네이버뉴스,"현대건설-HD건설기계, MOU...굴착기 AI 적용 '현장안전 강화'",http://www.popcornnews.net/news/articleView.html?idxno=117812,"현대건설이 지난 7일 서울 종로구 계동 본사에서 HD건설기계와 '건설기계 스마트 안전기술 공동 개발 및 적용을 위한 업무협약'을 체결했다고 밝혔다. 양사는 이번 협약을 통해 건설장비 중심 안전 역량을 강화하고, 지속... "
2026-04-08,네이버뉴스,"현대건설 파트너 웨스팅하우스, AP1000 설계 개정 신청…원전 확대 본격...",http://www.press9.kr/news/articleView.html?idxno=74763,현대건설의 글로벌 원전 파트너인 웨스팅하우스가 차세대 주력 모델인 AP1000 원자로 설계 개정에 나서며 대형 원전 확대 전략에 속도를 내고 있다. 8일 미국 원자력규제위원회(NRC)에 따르면 웨스팅하우스는 AP1000... 
2026-04-08,네이버뉴스,하중 과하면 넘어질 위험 알리는 AI 굴착기,https://news.bizwatch.co.kr/article/real_estate/2026/04/08/0017,현대건설이 AI 기반 안전 모니터링 시스템과 원격제어 타워크레인을 선보인 것에 이어 굴착기에도 AI를 장착한다. 건설현장 안전관리의 실효성을 키우기 위해 인공지능(AI)을 탑재한 건설 장비를 계속해서 도입하는... 
2026-04-08,네이버뉴스,"경기도 이주민 법률지원단, 법무법인 케이비(법무법인 KB) 이성기 대표변...",https://www.enetnews.co.kr/news/articleView.html?idxno=48650,"법무법인 케이비(법무법인 KB) 이성기 대표변호사는 연세대학교 건축공학 전공자이자 前 현대건설 출신으로, 실제 건설 현장과 시공사 내부 구조를 직접 경험하여 건설·부동산 분쟁 전반에 대한 실무 이해도를 갖춘 건설... "
2026-04-08,네이버뉴스,"삼성물산, 압구정4구역 무혈입성 유력…2차 현설 단독 참석",https://sports.hankooki.com/news/articleView.html?idxno=6930365,"앞서 현대건설이 한화 건설부과 협업해 압구정5구역과 갤러리아 백화점 및 수인분당선 압구정로데오역을 연결한다고 발표한 바 있다. 조합 관계자는 ""다른 압구정 재건축 사업지에서 여러 발표가 나올 때마다 우리... "
2026-04-08,네이버뉴스,[오늘의 건설] GS건설·현대건설·포스코이앤씨,http://www.financialreview.co.kr/news/articleView.html?idxno=41498,현대건설은 건설 현장의 사각지대 안전사고를 막기 위해 HD건설기계와 업무협약을 맺었다. 포스코이앤씨는 건설 현장 근로자의 '작업중지권' 활성화를 위해 안전 교육 전문가를 육성한다. 허윤홍 GS건설 대표(가운데)와... 
2026-04-08,네이버뉴스,"현대건설, AI 탑재 건설장비로 현장 안전 강화",https://www.thepowernews.co.kr/view.php?ud=202604081411078870de3f0aa1be_7,"현대건설은 HD건설기계와 '건설기계 스마트 안전기술 공동 개발 및 적용을 위한 업무협약'을 체결했다고 7일 밝혔다. 현대건설은 지난 7일 서울 종로구 계동 본사에서 HD건설기계와 협약을 맺고, 건설장비를 활용한 현장... "
2026-04-08,네이버뉴스,"현대건설, 사우디 현장 안전 대책 논란…직원 불안감 토로",https://www.youthdaily.co.kr/news/article.html?no=217025,"진출한 현대건설과 현대엔지니어링의 현장 인력에 대한 안전 대책을 두고 내부에서 불안과 불만의 목소리가 나오고 있다. 8일 건설업계와 직장인 익명 커뮤니티 등에 따르면, 최근 이란은 사우디아라비아 동부 산업 단지의... "
2026-04-08,네이버뉴스,"현대건설, AI 탑재 건설장비 도입…현장 안전관리 강화",http://www.biztribune.co.kr/news/articleView.html?idxno=352028,현대건설_HD건설기계 MOU 체결식 | 현대건설 현대건설이 건설현장 안전관리의 실효성을 높이기 위해 AI가 탑재된 건설 장비 도입에 적극 나선다. 현대건설은 7일 서울 종로구 계동 본사에서 HD건설기계와 '건설기계... 
2026-04-08,네이버뉴스,'힐스테이트 안양펠루스' 1순위 청약경쟁률 4.9대 1,https://www.newsis.com/view/NISX20260408_0003582702,"강세훈 기자, 안태현 인턴기자 = 현대건설이 경기도 안양시 만안구 안양동 일대에 공급하는 '힐스테이트 안양펠루스' 1순위 청약 경쟁률이 4.94대 1을 기록했다. 8일 한국부동산원 청약홈에 따르면 전날... "
2026-04-08,네이버뉴스,"현대건설, HD건설기계와 스마트 안전기술 협력… AI 굴착기 하반기 투입",https://www.s-journal.co.kr/news/articleView.html?idxno=40294,현대건설이 HD건설기계와 손잡고 인공지능(AI) 기반 건설장비를 활용한 현장 안전관리 고도화에 나선다. 현대건설은 HD건설기계와 '건설기계 스마트 안전기술 공동 개발 및 적용을 위한 업무협약(MOU)'을 체결했다고 8일... 
2026-04-08,네이버뉴스,[더밸류 브리핑] 한화금융계열 소식…한화투자증권·한화자산운용,http://www.thevaluenews.co.kr/news/view.php?idx=197963,"2월 말 기준 주요 편입 종목은 현대건설, 한국항공우주, 두산에너빌리티, 한화에어로스페이스, 현대로템, 한화시스템, HD한국조선해양, LIG넥스원, 삼성중공업, 한화오션 등이다. 산업별 비중은 방산 42.0%, 조선 22.6... "
2026-04-08,네이버뉴스,"HD건설기계, 현대건설과 맞손…건설기계 스마트 안전 기술 개발 협력",https://www.etnews.com/20260408000277,HD건설기계가 7일 서울 종로구 현대건설 사옥에서 '건설기계 스마트 안전기술 공동 개발 및 적용을 위한 업무협약'을 체결했다고 8일 밝혔다. 이번 협약은 양사가 보유한 기술력과 현장 운영 경험을 토대로 건설 장비... 
2026-04-08,네이버뉴스,"""이게 무슨 일이야""…재건 기대감에 줄줄이 '상한가'",http://www.wowtv.co.kr/NewsCenter/News/Read?articleId=A202604080371&t=NN,"이 중 희림, 대우건설, 상지건설이 상한가로 치솟았고 GS건설(28.13%), DL이앤씨(24.87%), 현대건설(22.26%), 삼표시멘트(21.66%), 동신건설(20.45%), 한미글로벌(14.34%) 등도 일제히 상승폭을 키우고 있다. 미국과 이란은 전쟁... "
2026-04-08,네이버뉴스,"현대건설, AI 탑재 굴착기 하반기 현장 투입…HD건설기계와 맞손",https://www.sedaily.com/article/20029874?ref=naver,현대건설(000720)이 건설현장 안전관리 강화를 위해 인공지능(AI) 기반 스마트 안전기술이 탑재된 건설장비 도입에 나선다. 현대건설은 7일 서울 종로구 계동 본사에서 HD건설기계와 ‘건설기계 스마트 안전기술 공동 개발... 
2026-04-08,네이버뉴스,[굿모닝! 8일 건설업계 소식] 현대건설·GS건설·포스코이앤씨·우미건설,https://www.goodkyung.com/news/articleView.html?idxno=285590,현대건설은 인공지능(AI) 기반 건설장비를 활용해 건설 현장 안전관리 강화에 나선다. 이를 위해 HD건설기계와 '건설기계 스마트 안전기술 공동 개발 및 적용을 위한 업무협약(MOU)'을 체결했다. 양사는 ▲굴착기 등... 
2026-04-08,네이버뉴스,"현대건설, AI 기반 건설장비 도입 확대…현장 안전관리 고도화",https://www.pinpointnews.co.kr/news/articleView.html?idxno=443830,현대건설 김제영 안전수행지원실장(왼쪽)과 HD건설기계 최태근 글로벌 통합 영업본부장이 '건설기계 스마트 안전기술 공동 개발 및 적용을 위한 업무협약'을 체결하고 기념사진을 촬영하고 있다. 사진=현대건설.... 
2026-04-08,네이버뉴스,"""커뮤니티가 하이엔드 기준""…DL이앤씨 '아크로', 6년 연속 선호도 1위",https://www.newspim.com/news/view/20260408000862,"이어 현대건설 '디에이치(28.0%)', 롯데건설 '르엘(13.7%)', 대우건설 '써밋(12.2%)'이 순위에 올랐다. 선두인 아크로와 2위 브랜드 간의 격차는 18.1%포인트(p)로, 하이엔드 주거 시장에서 독보적인 위상을 입증했다.... "
2026-04-08,네이버뉴스,[산업계 동향] HD건설기계·에쓰오일·현대무벡스,http://www.iminju.net/news/articleView.html?idxno=162282,민주신문=김혜인 기자｜HD건설기계는 현대건설과 건설기계 스마트 안전기술 공동 개발 및 적용을 위한 업무협약을 체결했다고 밝혔다. 양사는 스마트 안전 기술이 적용된 굴착기 등 건설기계를 공급하며 제작... 
2026-04-08,네이버뉴스,"HD건설기계·현대건설, 스마트 안전기술 공동 개발",http://www.enewstoday.co.kr/news/articleView.html?idxno=2416337,HD건설기계와 현대건설이 건설 현장 안전 강화를 위한 기술 협력에 나섰다. HD건설기계는 7일 서울 종로구 현대건설 사옥에서 양사 관계자가 참석한 가운데 '건설기계 스마트 안전기술 공동 개발 및 적용'을 위한... 
2026-04-08,네이버뉴스,"[건설 Pick] 현대건설·우미건설, AI로 '안전' 챙기고 20년 인연으로 '신...",https://www.lcnews.co.kr/news/articleView.html?idxno=200398,"◆ 현대건설, AI 기반 '스마트 안전' 시스템 구축 현대건설이 HD건설기계와 손잡고 AI 기술을 탑재한 건설 장비 도입을 본격화한다. 양사는 굴착기 등 주요 기기에 AI 카메라를 적용해 작업자의 접근을 실시간으로 감지하는... "
2026-04-08,네이버뉴스,"HD건설기계, 현대건설과 건설기계 스마트 안전 기술개발 협력",https://www.busan.com/view/busan/view.php?code=2026040813162409868,HD건설기계는 지난 7일 현대건설과 ‘건설기계 스마트 안전기술 공동 개발 및 적용을 위한 업무협약’을 체결했다고 8일 밝혔다. 이번 협약으로 양사는 스마트 안전 기술이 적용된 건설장비의 공급과 실증·검증에... 
2026-04-08,네이버뉴스,"현대건설, AI 굴착기 도입 통한 ‘현장 안전관리 전환’…HD건설기계와...",https://www.fetv.co.kr/news/article.html?no=216563,"어라운드뷰·과부하 감지 등 장비 중심 안전기술 공동개발 하반기 현장 투입, 장비 제작단계부터 안전 표준화 추진  현대건설이 인공지능(AI) 기반 건설장비를 앞세워 현장 안전관리 체계 전환에 나섰다. 장비 자체에 안전... "
2026-04-08,네이버뉴스,"[아유경제_부동산] 현대건설, HD건설기계와 맞손… AI 탑재 건설장비 도...",http://www.areyou.co.kr/news/articleView.html?idxno=93309,현대건설이 건설현장 안전 관리의 실효성을 높이기 위해 인공지능(AI)을 탑재한 건설장비 도입을 추진한다. 최근 현대건설은 이달 7일 HD건설기계와 건설기계 스마트 안전기술 공동 개발ㆍ적용을 위한 업무협약을... 
2026-04-08,네이버뉴스,기반시설 첨단공법 개발에 민관 ‘맞손’,https://www.naeil.com/news/read/584408?ref=naver,첨단기술 개발에 선도적으로 나선 현대건설은 국책연구기관과 함께 기반시설 건설기술을 한단계 진화시키기 위해 협력한다. 현대건설은 한국건설기술연구원과 ‘건설기술 발전 및 산업고도화를 위한 상호 협력체계... 
2026-04-08,네이버뉴스,[건설사 체력점검-대우건설②] 가덕도·체코 ‘허들’…도약? 추락?,https://theviewers.co.kr/View.aspx?No=4030378,"당초 현대건설·포스코이앤씨 등이 포함된 컨소시엄이 추진했지만, 공사 난도와 공기 부담을 이유로 이탈하면서 사업은 사실상 좌초 위기에 놓였다. 이후 정부가 사업비를 10조7000억원으로 늘리고 공기를 106개월로... "
2026-04-08,네이버뉴스,"현대건설, AI 기반 건설장비 활용… 안전 사고 사전 차단",https://www.donga.com/news/Economy/article/all/20260408/133698015/2,현대건설이 굴착기 중심 스마트 안전기술 공동 개발로 건설장비 기반 현장 안전관리 체계 고도화를 추진한다. AI 기반 영상 인식·위험 감지 기술 적용으로 작업 환경 가시성 및 사고 대응 체계를 강화한다는 방침이다.... 
2026-04-08,네이버뉴스,"""AI 건설장비로 안전 강화""…현대건설-HD건설기계, 스마트 안전기술 MOU",https://www.mt.co.kr/estate/2026/04/08/2026040810581164044,현대건설이 건설현장 안전관리의 실효성을 높이기 위해 AI가 탑재된 건설장비 도입에 적극 나선다. 현대건설은 지난 7일 서울 종로구 계동 본사에서 HD현대건설기계와 '건설기계 스마트 안전기술 공동 개발 및 적용을 위한... 
2026-04-08,네이버뉴스,"[Invest]중동 휴전에 현대건설·대우건설 신고가…건설주, 재건·원전 기...",https://www.investchosun.com/site/data/html_dir/2026/04/08/2026040880078.html,"DL이앤씨와 현대건설, GS건설 등 주요 건설사들도 두 자릿수 상승률을 기록하며 동반 강세를 보였고, 삼성E&A 역시 상승 흐름에 동참했다. 대형 건설주 전반이 일제히 오르며 업종 전체로 매수세가 확산되는 양상이다.이번... "
2026-04-08,네이버뉴스,해외·에너지로 돌파구 찾는 건설업계,https://www.bigtanews.co.kr/article/view/big202604080008,"현대건설은 2030년까지 에너지 분야 매출 비중 21%를 목표로 대형 원전·SMR·해상풍력을 동시에 공략하고 있다. 미국 웨스팅하우스(원전), 홀텍(SMR) 등과 협력을 강화하고 있으며, 원자력 수소 생산, 원전해체 분야 공동... "
2026-04-08,네이버뉴스,"[TOP's Pick] [건설] 포스코이앤씨, 현장 안전 강화 '세이프티 파트너' 양...",https://www.topdaily.kr/articles/109595,"한 줄 코멘트 => AI 시대 이끌 데이터센터 역량 선제적 확장 ◆ 현대건설, HD건설기계와 스마트 안전기술 협력 맞손 현대건설이 건설현장 안전관리의 실효성을 높이기 위해 인공지능(AI)이 탑재된 건설 장비 적극 도입.... "
2026-04-08,네이버뉴스,"현대건설, AI 기반 건설장비로 현장 안전 지킨다",https://news.bbsi.co.kr/news/articleView.html?idxno=4077049,현대건설이 건설현장 안전관리의 실효성을 높이기 위해 인공지능(AI)이 탑재된 건설 장비 도입에 적극 나섭니다. 현대건설은 7일 서울 종로구 계동 본사에서 HD건설기계와 '건설기계 스마트 안전기술 공동 개발과 적용을... 
2026-04-08,네이버뉴스,중동發 공사비 폭등에 정비사업 갈등 확산…입주 지연·공급 경고등,https://www.thepublic.kr/news/articleView.html?idxno=300349,"현대건설은 최근 서울 송파구 마천4구역 재개발 조합에 공사비를 기존 3834억원에서 6733억원으로 약 75% 인상하고, 공사 기간도 34개월에서 44개월로 연장해달라는 공문을 발송했다. 대조1구역과 등촌1구역 등에서도 유사한... "
2026-04-08,네이버뉴스,"[산업소식] 삼성전자 2026년형 TV·사운드바, 獨 '탄소저감' 인증 획득",http://www.4th.kr/news/articleView.html?idxno=2110155,2026년 4월 7일 서울 종로구 계동 현대건설 본사에서 김제영 현대건설 안전수행지원실장(왼쪽)과 최태근 HD건설기계 글로벌 통합 영업본부장이 '건설기계 스마트 안전기술 공동 개발 및 적용을 위한 업무협약'을... 
2026-04-08,네이버뉴스,"HD건설기계-현대건설, 스마트 안전기술 협력…건설현장 사고 예방 강화",https://www.socialvalue.kr/news/view/1065580452740934,HD건설기계가 현대건설과 손잡고 건설현장 안전 강화를 위한 스마트 기술 협력에 나선다. HD건설기계는 현대건설과 ‘건설기계 스마트 안전기술 공동 개발 및 적용을 위한 업무협약’을 체결했다고 8일 밝혔다. ▲지난... 
2026-04-08,네이버뉴스,돌아온 외국인…다시 반도체 랠리 20만전자·100만닉스 재가동한다,http://www.smedaily.co.kr/news/articleView.html?idxno=355271,"이외에도 GS건설(24.88%), DL이앤씨(16.53%), 현대건설(12.89%), 삼성물산(10.22%), HDC현대산업개발(7.33%) 등이 급등세를 자랑 중이다. 호르무즈 해협 개방에 따른 국제 유가 하락으로 흥구석유(-16.63%), 중앙에너비스(-16.49... "
2026-04-08,네이버뉴스,"현대건설, AI 건설장비 도입…현장 안전관리 강화",https://www.newsis.com/view/NISX20260408_0003582622,현대건설이 건설현장 안전관리의 실효성을 높이기 위해 인공지능(AI)이 탑재된 건설 장비 도입에 나선다. 현대건설은 7일 서울 종로구 계동 본사에서 HD건설기계와 '건설기계 스마트 안전기술 공동 개발 및 적용을 위한... 
2026-04-08,네이버뉴스,"현대건설, AI 건설장비로 현장 안전 지킨다… HD건설기계와 기술 개발 협...",https://www.ezyeconomy.com/news/articleView.html?idxno=234505,현대건설이 건설현장 안전관리의 실효성을 높이기 위해 인공지능(AI)이 탑재된 건설 장비 도입에 나선다. 현대건설은 지난 7일 서울 종로구 계동 본사에서 HD건설기계와 '건설기계 스마트 안전기술 공동 개발 및 적용을... 
2026-04-08,네이버뉴스,"현대건설, HD건설기계와 굴착기 중심 AI 안전기술 공동개발...하반기부터...",http://www.updownnews.co.kr/news/articleView.html?idxno=316821,현대건설이 HD건설기계와 협력해 인공지능 기반 건설기계 도입을 본격화하며 안전 혁신에 속도를 내고 있다. 현대건설은 7일 서울 종로구 계동 본사에서 HD건설기계와 '건설기계 스마트 안전기술 공동 개발 및 적용을... 
