date,source,title,link,description
2026-04-27,네이버뉴스,"메이사, 신세계건설 전 현장에 드론 공간정보 솔루션 공급",https://www.mt.co.kr/future/2026/04/27/2026042713300434870,"이러한 경쟁력을 바탕으로 현대건설, 대우건설, DL이앤씨, 우미건설, HDC현대산업개발 등 주요 건설사에도 솔루션을 공급해왔다. 회사는 드론·위성·CCTV·IoT(사물인터넷) 등 다양한 데이터를 통합해 '단일 진실 공급원'을... "
2026-04-27,네이버뉴스,"목동 재건축, 시공사 선정 '수의계약' 흐름…6단지 이어 5·12·14단지 확...",https://www.newspim.com/news/view/20260427000843,현대건설은 주요 건설사 중 가장 먼저 목동 현장에 홍보 라운지를 열었다. 현대건설은 올해 서울 목동에 자사 하이엔드 브랜드인 '디에이치(THE H) 라운지'를 조성하고 조합원을 대상으로 홍보 활동을 펼치고 있다.... 
2026-04-27,네이버뉴스,"경콘진, 문화기술 콘텐츠 지원 확대",https://www.jeonmae.co.kr/news/articleView.html?idxno=1251615,"대기업 협업형에는 현대퓨처넷, 현대건설, CJ ENM, YG엔터테인먼트, 스튜디오리얼라이브 등 주요 기업이 참여해 중소기업과 공동 프로젝트를 수행한다. 자유형은 기업이 제작 방식과 실증 계획을 자율 제안하는 방식이며... "
2026-04-27,네이버뉴스,'2026 대한민국 상생 채용박람회' 개최… 청년 일자리 '기회',http://www.ikld.kr/news/articleView.html?idxno=333595,"또한, 삼성전자·현대건설·한국오라클 등이 참여하는 K-디지털 트레이닝과 삼성물산·포스코·한샘 등 대중소 상생 프로그램 홍보관이 함께 운영돼 청년 구직자에게 직무 이해 및 역량개발을 위한 밀착 상담을... "
2026-04-27,네이버뉴스,"'도촬 논란 덮고 저금리 미끼' DL이앤씨, 압구정5구역 '무리한 올인' 역...",https://www.newsfreezone.co.kr/news/articleView.html?idxno=687096,"맞붙은 현대건설은 브랜드 신뢰와 시공 경험을 앞세우고 있는 반면, DL이앤씨는 파격 조건으로 맞서는 형국이다. 시장에서는 이를 두고 품질과 신뢰의 경쟁이 아니라, 조건 덤핑 경쟁으로 변질되고 있다는 비판이 적지... "
2026-04-27,네이버뉴스,'상생 채용박람회' 28∼29일 열려…700개 기업서 2200명 이상 채용,http://www.seouleconews.com/news/articleView.html?idxno=90894,삼성전자와 현대건설은 'K-디지털 트레이닝관'을 차려 디지털·신기술 인재양성 프로그램을 상담한다. 삼성물산·포스코·한샘 등은 '대중소 상생 프로그램 홍보관'을 설치한다. 현장 1차 면접도 진행된다. 지방 소재... 
2026-04-27,네이버뉴스,"건설업계, AI·에너지로 체질 전환…신사업 확장 경쟁 본격화",https://www.ezyeconomy.com/news/articleView.html?idxno=235059,현대건설은 북유럽 원전 시장 진출을 모색하며 핀란드 신규 원전 프로젝트 관련 사전 업무를 진행하고 있다. 에너지 전환 흐름에 맞춰 글로벌 시장에서 입지를 확대하려는 전략이다. 동시에 주거 서비스 분야에서도... 
2026-04-27,네이버뉴스,삼성·SK·현대차·LG 총출동..역대 최대 규모 채용박람회 열린다,http://www.breaknews.com/1203291,"먼저, 삼성전자·현대건설 등이 참여하는 ‘K-디지털 트레이닝관’과 삼성물산, 포스코, 한샘 등 ‘대중소 상생 프로그램 홍보관’이 함께 운영된다. 이를 통해... "
2026-04-27,네이버뉴스,삼성고시 끝나자마자 채용박람회…반도체 취업 열기 절정,http://www.joseilbo.com/news/news_read.php?uid=567312&class=33&grp=,삼성전자와 현대건설은 'K-디지털 트레이닝관'을 운영하며 디지털·신기술 인재 양성 프로그램을 안내할 예정이다. 온라인 채용 플랫폼 '사람인'을 통한 온라인 박람회는 7월 31일까지 이어진다. 연·고대 반도체... 
2026-04-27,네이버뉴스,윤여정이 극 중 소유한 '회장님 사옥' 정체…용산 화장품 회사라고?,https://realty.chosun.com/site/data/html_dir/2026/04/27/2026042702462.html,"서울 용산구에 위치한 아모레퍼시픽 본사는 현대건설이 시공한 대표적인 오피스 건축물이다. 영국 건축가 데이비드 치퍼필드가 설계한 이 건물은 정육면체 형태와 알루미늄 루버 외관, 중앙을 비워낸 구조가 특징이다.... "
2026-04-27,네이버뉴스,"""조용한 집이 경쟁력""… 층간소음, 집값·분양성적 '새 기준'",http://www.seoulwire.com/news/articleView.html?idxno=718954,"현대건설은 슬래브 두께를 강화한 'H 사일런트 홈 시스템'을 적용했고, DL이앤씨는 'D-사일런트 플로어'를 앞세워 바닥충격음 저감 기술 고도화에 나섰다. 코오롱글로벌은 오는 5월 분양 예정인 '상주북천 하늘채 파크원... "
2026-04-27,네이버뉴스,역대 최대 규모 '2026 대한민국 상생 채용박람회' 개최…청년 취업난 해...,http://www.queen.co.kr/news/articleView.html?idxno=455857,삼성전자·현대건설 등이 참여하는 K-디지털 트레이닝관과 삼성물산·포스코·한샘 등이 함께하는 상생 프로그램 홍보관도 마련돼 직무 이해와 역량 개발을 지원한다. 박람회는 단순 채용정보 제공을 넘어 다양한 체험형... 
2026-04-27,네이버뉴스,현대건설 '컨' GTX-C·대장홍대선 민자사업 기지개 [이슈],https://www.redaily.co.kr/news/articleView.html?idxno=16298,현대건설 컨소시엄이 주관하는 대형 민자철도사업인 GTX-C와 대장홍대선이 이달 말부터 첫 삽을 뜰 전망이다. 23일 업계에 따르면 GTX-C는 오는 30일부터 용지보상이 마무리된 곳부터 철거 및 지장물 이설 등 사전 공사에... 
2026-04-27,네이버뉴스,건설 '빅5' 1분기 '희비'…수익성 격차 확대,https://www.sisaon.co.kr/news/articleView.html?idxno=200603,"오는 28일에는 현대건설과 대우건설이, 29일에는 삼성물산이, 30일에는 DL이앤씨와 GS건설이 각각 잠정실적을 발표할 예정이다. '喜'…DL·GS·삼성, 영업이익 개선 전망 DL이앤씨는 주택 중심의 고마진 구조가 유지되며... "
2026-04-27,네이버뉴스,삼성·SK·현대차·LG 파트너사 총출동…상생 채용박람회 개막,https://www.dailian.co.kr/news/view/1638288/?sc=Naver,삼성전자·현대건설·한국오라클 등이 참여하는 K-디지털 트레이닝과 삼성물산·포스코·한샘 등 대중소 상생 프로그램 홍보관도 함께 운영된다. 청년 구직자를 위한 다양한 프로그램도 마련됐다. 현직자와의 1대 1... 
2026-04-27,네이버뉴스,노동부·중기부 '대한민국 상생 채용박람회'…7백개 기업 2천2백명 채용,https://biz.sbs.co.kr/article_hub/20000306885?division=NAVER,"또 삼성전자, 현대건설, 한국오라클 등이 참여하는 K-디지털 트레이닝과 삼성물산, 포스코, 한샘 등의 대중소 상생 프로그램 홍보관도 운영됩니다. 이와 함께 취업 선배와의 1대1 커피챗, 기업 인사담당자의 취업 특강... "
2026-04-27,네이버뉴스,대한민국 상생 채용박람회…삼성·SK 등 파트너사 현장 면접 진행,https://www.ngonews.kr/news/articleView.html?idxno=229129,"삼성전자·현대건설·한국오라클 등이 참여하는 K-디지털 트레이닝과 삼성물산·포스코·한샘 등 대중소 상생 프로그램 홍보관도 함께 운영된다. 청년들의 관심이 높은 취업 선배와의 1대 1 커피챗, 기업 인사담당자의... "
2026-04-27,네이버뉴스,경제계 총출동… 민·관 협력 역대급 청년 채용의 장 열린다,https://www.viva100.com/article/20260427500523,"삼성전자·현대건설 등이 참여하는 ‘K-디지털 트레이닝관’과 삼성물산, 포스코, 한샘 등 ‘대중소 상생 프로그램 홍보관’도 현장에서 취업 청년들을 맞이한다. 이곳에서는 구직자에게 다양한 채용 기회 제공과 함께... "
2026-04-27,네이버뉴스,"배유나, '10년 동행' 도로공사 떠난다…사인 앤드 트레이드로 전격 현대...",https://www.sportschosun.com/volleyball/2026-04-27/202604270100180430011825,도로공사와 현대건설은 27일 배유나의 사인 앤드 트레이드 계약을 했다. 배유나는 앞서 도로공사와 2억5000만원의 FA 계약을 했다. 협상 과정이 수월하지는 않았다. 도로공사는 최근 김세빈과 이지윤이 눈부신... 
2026-04-27,네이버뉴스,"수주전 점점 더 치열… GS건설, 4조원 돌파로 선두",https://www.arunews.com/news/articleView.html?idxno=62067,"연초 현대건설과 삼성물산 건설부문의 양강 구도가 예상됐지만 GS건설 가세에 수주 판도 재편 가능성도 커지고 있다. 특히 시장규모는 약 80조원으로, 하반기에 접어들수록 굵직한 사업장들의 시공자 선정이... "
2026-04-27,네이버뉴스,민관합동 청년일자리 ‘총력전’…삼성 SK 등 15개 그룹 참여,http://www.kookje.co.kr/news2011/asp/newsbody.asp?code=0200&key=20260427.99099007463,"삼성전자·현대건설 등이 참여하는 ‘K-디지털 트레이닝관’과 삼성물산, 포스코, 한샘 등 ‘대중소 상생 프로그램 홍보관’이 함께 운영된다. 이를 통해 구직자에게 다양한 채용 기회 제공은 물론 직무 이해 및 역량... "
2026-04-27,네이버뉴스,"'살인기업 특별상' 쿠팡, 변협 인권실사 평가 꼴찌…""50개사 중 50등""",http://www.lawleader.co.kr/news/articleView.html?idxno=19028,이날 컨퍼런스에서 발표된 기업 인권실사 평가에 따르면 현대건설이 12점 만점을 획득하며 전체 1위에 올랐다. 그 뒤는 LG전자(11.07점)ㆍ네이버(11점)ㆍ삼성전자(10.96점)ㆍ카카오(10.16점) 등이 상위권을 차지했다.... 
2026-04-27,네이버뉴스,2026년 대한민국 상생 채용박람회…청년 구직자 2200여명 이상 채용 예정,https://www.donga.com/news/Economy/article/all/20260427/133813317/1,"삼성전자, 현대건설, 한국오라클 등이 참여하는 ‘K-디지털 트레이닝 홍보관’과 삼성물산, 포스코, 한샘 등이 참여하는 ‘대중소 상생 프로그램 홍보관’도 운영된다. 청년들은 직무 이해와 역량 개발을 위한 상담을... "
2026-04-27,네이버뉴스,"“일자리 총력전” 700여개 기업 참여...한경협, 역대 최대 규모 채용 박...",https://www.etoday.co.kr/news/view/2579305,"먼저 삼성전자·현대건설 등이 참여하는 ‘K-디지털 트레이닝관’과 삼성물산, 포스코, 한샘 등 ‘대중소 상생 프로그램 홍보관’이 함께 운영된다. 이를 통해 구직자에게 다양한 채용 기회 제공은 물론 직무 이해 및... "
2026-04-27,네이버뉴스,"""청년 취업난 정면 대응""…2026 대한민국 상생 채용박람회 역대 최대 규...",https://www.ajunews.com/view/20260427082411230,"삼성전자·현대건설 등이 참여하는 K-디지털 트레이닝관과 삼성물산, 포스코, 한샘 등 대중소 상생 프로그램 홍보관도 동시에 운영된다. 구직자는 채용 기회뿐 아니라 직무 이해와 역량 개발까지 연계 지원을 받을 수... "
2026-04-27,네이버뉴스,"한경협, 상생 채용박람회 개최…삼성·SK 등 700여개 기업 참여",http://www.edaily.co.kr/news/newspath.asp?newsid=03030726645420384,"삼성전자·현대건설 등이 참여하는 K-디지털 트레이닝관과 삼성물산, 포스코, 한샘 등 대중소 상생 프로그램 홍보관이 함께 운영된다. 구직자에게 다양한 채용 기회 제공은 물론 직무 이해 및 역량 개발을 위한 상담까지... "
2026-04-27,네이버뉴스,"정부·경제계, 청년 채용 확대 맞손...대한민국 상생 채용박람회 개최",https://www.ajunews.com/view/20260427103149569,삼성전자･현대건설･한국오라클 등이 참여하는 K-디지털 트레이닝과 삼성물산･포스코･한샘 등 대중소 상생 프로그램 홍보관이 함께 운영돼 청년 구직자에게 직무 이해 및 역량개발을 위한 밀착 상담을 지원한다.... 
2026-04-27,네이버뉴스, 신임 한국은행 총재 신현송,https://www.ilyosisa.co.kr/news/article.html?no=255558,아버지는 현대건설 부사장과 현대종합상사 사장을 지냈다. 아버지가 영국으로 일자리를 옮기게 되자 1968년부터 3년여가량 런던에서 초등학교에 다녔다. 다시 귀국해 학업을 이은 적도 있으나 아버지와 함께 영국으로... 
2026-04-27,네이버뉴스,올해 대한민국 최대 규모 상생채용박람회 개최,http://www.wowtv.co.kr/NewsCenter/News/Read?articleId=A202604270084&t=NN,"삼성전자·현대건설 등이 참여하는 'K-디지털 트레이닝관'과 삼성물산, 포스코, 한샘 등 '대중소 상생 프로그램 홍보관' 운영과 함께 구직자에게 다양한 채용 기회 제공은 물론 직무 이해 및 역량 개발을 위한 상담까지... "
2026-04-27,네이버뉴스,삼성·LG·SK·현대차 총출동…청년 채용 '큰장' 섰다,https://www.etnews.com/20260427000163,삼성전자와 현대건설은 'K-디지털 트레이닝관'을 차려 디지털·신기술 인재양성 프로그램을 상담한다. 삼성물산·포스코·한샘 등은 '대중소 상생 프로그램 홍보관'을 설치한다. 현장 1차 면접도 열린다. 지방 소재 기업... 
2026-04-27,네이버뉴스,"삼성·SK·현대차·LG, 700개 기업 총출동…청년채용 '총력전'",https://www.shinailbo.co.kr/news/articleView.html?idxno=5015233,"이번 박람회에는 삼성전자, SK쉴더스, 현대건설, LG이노텍 등 주요 그룹 계열사부터 대기업 파트너사, 중견·중소기업, 스타트업, 외국계 기업까지 총 700개 기업이 참여한다. 이는 역대 최대 규모다. 박람회 현장은... "
2026-04-27,네이버뉴스,청년채용 위해 한경협·삼성·현대차 등 700개 기업 총출동,http://www.smedaily.co.kr/news/articleView.html?idxno=356200,"우선 삼성전자·현대건설 등이 참여하는 'K-디지털 트레이닝관'과 삼성물산, 포스코, 한샘 등이 하는 '대중소 상생 프로그램 홍보관'은 함께 운영된다. 이를 통해 구직자에게 다양한 채용 기회 제공은 물론 직무 이해... "
2026-04-27,네이버뉴스,"""700개 기업 한자리에""…정부·재계 총출동, 역대 최대 채용박람회 열린...",https://www.newspim.com/news/view/20260427000280,"삼성전자·현대건설 등이 참여하는 디지털 트레이닝 프로그램과 삼성물산, 포스코, 한샘 등이 참여하는 대중소 상생 프로그램 홍보관도 함께 운영돼 직무 이해와 역량 개발을 지원한다. 취업선배로 참여하는 한 개발... "
2026-04-27,네이버뉴스,"정부·경제계 총 출동, 민관합동 청년 일자리 '총력전' .... 700여개 기업...",http://www.worktoday.co.kr/news/articleView.html?idxno=84070,"먼저 삼성전자·현대건설 등이 참여하는 'K-디지털 트레이닝관'과 삼성물산, 포스코, 한샘 등 '대중소 상생 프로그램 홍보관'이 함께 운영된다. 이를 통해 구직자에게 다양한 채용 기회 제공은 물론 직무 이해 및 역량... "
2026-04-27,네이버뉴스,삼성·SK·현대차 등 700개 참여 ‘역대 최대규모 채용박람회’ 28~29일 ...,https://www.khan.co.kr/article/202604271200001,"대표적으로 삼성전자와 현대건설 등은 ‘K-디지털 트레이닝관’에, 삼성물산·포스코·한샘 등 ‘대중소 상생 프로그램 홍보관’에 참여한다. 취업선배와의 대화에는 SK·카카오·토스 등 주요 기업의 현직 선배들이... "
2026-04-27,네이버뉴스,"""삼성·SK·현대차·LG 취업하려면 이곳으로""…역대 최대 채용박람회",https://www.news1.kr/industry/general-industry/6149568,"삼성전자·현대건설 등이 참여하는 K-디지털 트레이닝관과 삼성물산, 포스코, 한샘 등 대·중·소 상생 프로그램 홍보관을 함께 운영한다. 이를 통해 구직자에게 다양한 채용 기회 제공은 물론 직무 이해 및 역량 개발을... "
2026-04-27,네이버뉴스,"정부, 경영계와 상생 채용박람회 개최…구직자 4000명 이상 참여",https://www.newspim.com/news/view/20260427000438,"삼성전자·현대건설·한국오라클 등이 참여하는 K-디지털 트레이닝(KDT)과 삼성물산·포스코·한샘 등 대중소 상생 프로그램 홍보관도 운영된다. 참여 구직자는 취업선배와 1대1 커피챗, 기업 인사담당자의 취업 실전... "
2026-04-27,네이버뉴스,"정부, 채용박람회 개최…700개 기업 참여 2200명 뽑는다",https://www.newsis.com/view/NISX20260427_0003607196,또한 삼성전자·현대건설·한국오라클 등이 참여하는 'K-디지털 트레이닝'과 삼성물산·포스코·한샘 등 '상생 프로그램 홍보관'이 함께 마련된다. 이를 통해 청년 구직자에게 직무 이해 및 역량개발을 위한 상담을... 
2026-04-27,네이버뉴스,"""청년 취업난 해소""…정부·경제계, '상생 채용박람회' 개최",https://www.youthdaily.co.kr/news/article.html?no=218181,"먼저 삼성전자·현대건설 등이 참여하는 'K-디지털 트레이닝관'과 삼성물산, 포스코, 한샘 등 '대중소 상생 프로그램 홍보관'이 함께 운영된다. 이를 통해 구직자에게 다양한 채용 기회 제공은 물론 직무 이해 및 역량... "
2026-04-27,네이버뉴스,대한민국 상생 채용박람회…700개 기업서 2천200명 이상 채용,https://www.yna.co.kr/view/AKR20260427035400530?input=1195m,"삼성전자·현대건설·한국오라클 등이 참여하는 K-디지털 트레이닝과 삼성물산·포스코·한샘 등 대중소 상생 프로그램 홍보관도 함께 운영된다. 청년들의 관심이 높은 취업 선배와의 1대 1 커피챗, 기업 인사담당자의... "
2026-04-27,네이버뉴스,"제작부터 판로까지 한 번에…경콘진, 콘텐츠 기업 25곳 키운다",https://www.mt.co.kr/policy/2026/04/27/2026042711172299059,"특히 대기업 협업형에는 현대퓨처넷, 현대건설, CJ ENM, YG엔터테인먼트, 스튜디오리얼라이브 등 주요 기업이 참여한다. 중소기업이 대기업 인프라와 협업 경험을 쌓고 실질적인 사업화 기회를 확보할 수 있는 구조다.... "
2026-04-27,네이버뉴스,자산가는 전쟁 이후를 본다…재건·에너지 인프라주 분할매수[큰손따라...,https://biz.heraldcorp.com/article/10726252?ref=naver,"KODEX 건설 ETF는 같은 날 기준 현대건설(23.09%)을 가장 높은 비율로 담고 있고, 삼성E&A와 대우건설도 각각 18.02%와 15.14%의 비중으로 편입하고 있다. TIGER 200 건설 ETF 역시 현대건설(26.26%)과 삼성E&A(16.50%), 대우건설(13.62... "
2026-04-27,네이버뉴스,"현대건설, 성대야구장 민참 ‘무혈입성’ 유력",https://www.dnews.co.kr/uhtml/view.jsp?idxno=202604241725508390605,현대건설이 올해 한국토지주택공사(LH)의 제2차 민간참여 공공주택 건설사업(민참사업) 첫 주자인 ‘서울도봉 01블록(성대야구장)’에 무혈 입성할 전망이다. 26일 LH에 따르면 최근 재공고를 낸 제2-2차 민참사업인... 
2026-04-27,네이버뉴스,[기업들] 교육 지원부터 환경 정화까지…단순 기부 넘어 '안전망 구축·...,http://www.dailypop.kr/news/articleView.html?idxno=98356,현대건설은 창원 진해 지역 8개 초교에 어린이용 경안전모 3600여 개를 전달하고 체험형 대피 훈련을 실시하며 재난 대응 역량 강화에 힘을 보탰다. 사진=한전KPS 임직원들이 환경정화 활동을 펼쳤다. 전력설비 정비... 
2026-04-27,네이버뉴스,"""지진 나면 어떻게 피할까""… 현대건설, 진해 초등학교 대상 안전수업 ...",https://www.ilyoseoul.co.kr/news/articleView.html?idxno=516219,"현대건설 이형석 재경본부장(뒷줄 중앙)과 건설산업사회공헌재단 이재식 사무처장(앞줄 맨 왼쪽), 플랜코리아 이재명 실장(뒷줄 맨 오른쪽), 경상남도창원교육지원청 관계자 등이 '재난안전 경안전모 전달식 및... "
2026-04-27,네이버뉴스,"국토부, 28일 스마트시티 솔루션 비즈니스 상담회 첫 개최",https://www.imaeil.com/page/view/2026042709325765716,"스마트시티 분야 우수 솔루션을 보유한 기업 16개사와 세종시·부산시 등 전국 지방정부 5개 기관, 한국토지주택공사(LH), 현대건설·호반건설·IPARK현대산업개발·롯데건설 등 민간 건설사와 KT 등이 함께한다. 이번... "
2026-04-27,네이버뉴스,"[CEO 열전] 정의선 현대차 회장, 계동 15층 다시 밝혔다…현대가 '왕좌'...",https://www.megaeconomy.co.kr/news/newsview.php?ncode=1065575123045024,"이후 그룹이 현대건설을 인수한 2011년, 정몽구 당시 회장이 계동 사옥을 재방문하며 '11년 만의 복귀'가 이뤄졌고, 언론은 이를 '왕의 귀환'으로 조명했다. 정의선 회장의 이번 계동 사옥 활용은 해당 공간이 사용 중단된... "
2026-04-27,네이버뉴스,수도권 전세시장 불안에 무순위 · 임의공급 청약 관심,https://www.viva100.com/article/20260427500398,‘동탄파크릭스’ 는 현대건설 · 계룡건설산업 · 동부건설 · 대보건설이 컨소시엄으로 조성한 단지다. 동탄2신도시 신동 일대에 지하 2층 ~ 지상 최고 20층 · 44개 동 · 전용면적 74 ~ 110㎡ · 총 2063가구로 이뤄져... 
2026-04-27,네이버뉴스,"GS건설, 성수1지구 시공사로 낙점...올해 수주액 4조원 돌파",https://www.m-economynews.com/news/article.html?no=66794,오랫동안 GS건설이 공을 들여온 지역으로 현대건설 등이 물밑작업을 해왔으나 업계 예상대로 GS건설이 시공권을 따냈다. 이로써 GS건설은 올해 도시정비사업 수주액 4조원을 돌파하게 됐다. 27일 정비업계에... 
2026-04-27,네이버뉴스,"지주사 체제 안착한 효성, 투명 경영과 미래 성장 '두 토끼' 잡는다",https://www.pinpointnews.co.kr/news/articleView.html?idxno=448830,"씨에스베어링, 한국전력, 현대건설, 대창솔루션 등은 단기 상승 이후 부담이 반영되며 약세를 보인다. 한국전력은 전기요금 정책 불확실성과 비용 부담 이슈가 지속되며 투자심리를 제약하는 모습이다. 중소형 풍력... "
2026-04-27,네이버뉴스,전쟁 여파에 갈린 증시...건설주 일제히 목표가 ↑ vs 항공·IT는 ↓,https://www.lcnews.co.kr/news/articleView.html?idxno=201332,"◆ 현대·삼성·대우·GS·DL 등 주요 건설사 목표가 상향 현대건설은 현재 15만 2300원 안팎에서 거래 중이지만, 업계에서는 미국과 불가리아 원전 본계약이 가시화될 경우 주가가 19만 5000원까지 치고 올라갈 것으로... "
2026-04-27,네이버뉴스,"현대건설·YG 등 대기업과 협업…경콘진, ‘문화기술 콘텐츠 제작·유통...",https://www.seoul.co.kr/news/publicnews/policy_admin/public_org/2026/04/27/20260427500033?wlog_tag3=naver,"‘대기업 협업형’은 현대퓨처넷, 현대건설, CJ ENM, YG엔터테인먼트, 스튜디오리얼라이브 등 국내 정상급 파트너사 5개 사가 참여하여 중소기업과 공동 과제를 수행한다. 제작 이후의 단계를 책임지는 <문화기술 콘텐츠... "
2026-04-27,네이버뉴스,"기업들, 다양한 형태 사회공헌활동 전개",http://www.wsobi.com/news/articleView.html?idxno=311053,"현대건설은 지난 22일 건설산업사회공헌재단, 플랜코리아와 함께 경남 창원시 진해구 안골포초등학교에서 '재난안전교육 및 어린이용 경안전모 전달식'을 진행했다고 밝혔다. 이날 전달식에는 현대건설 이형석... "
2026-04-27,네이버뉴스,"GS건설, 성수1지구 확보...도시정비 수주 4조 돌파",https://www.newswhoplus.com/news/articleView.html?idxno=59550,현대건설은 확정 수주액은 1조865억원 수준이지만 공사비 5조5610억원 규모의 압구정3구역 우선협상대상자로 선정돼 있다. 최종 시공권을 확보하면 단숨에 선두권으로 올라설 가능성이 크다. 삼성물산도 강남권 대형... 
2026-04-27,네이버뉴스,코스피 6560선 돌파…미·이란 협상교착에도 '또 신고가' [개장시황],https://www.news1.kr/finance/general-stock/6149572,이번 주에는 마이크로소프트·메타·아마존·알파벳 등 미국 매그니피센트7(M7) 실적과 함께 현대건설·두산에너빌리티·삼성SDI·한화에어로스페이스 등 국내 주력 업종 실적 이벤트가 이어진다. 한편... 
2026-04-27,네이버뉴스,"코스피, 반도체 호조에 사상 첫 6560선…코스닥도 '52주 최고치'",https://www.newsworks.co.kr/news/articleView.html?idxno=839040,"한 연구원은 ""국내 증시에서도 한화에어로스페이스, 현대건설, 두산에너빌리티, 삼성전기, 삼성SDI 등 방산, 건설, 원전, MLCC, ESS 등 최근 국내 주도주들의 실적이 몰려 있다""며 ""지난 금요일 인텔의 주가 20%대... "
