date,source,title,link,description
2026-04-14,네이버뉴스,"현대건설 ""경쟁사 압구정5구역 입찰 서류 무단 촬영 … 공정성 훼손 엄...",http://www.queen.co.kr/news/articleView.html?idxno=455049,"현대건설 계동사옥 현대건설이 서울 압구정5구역 시공사 선정 과정에서 불거진 경쟁사의 입찰 서류 무단 촬영 논란과 관련해 강경 대응 방침을 밝혔다. 현대건설은 14일 공식 입장문을 통해 ""압구정5구역 조합원 이익을... "
2026-04-14,네이버뉴스,"""글로벌 대기업까지 뛰어들었다""···UAM 해외는 '확장' 국내는 '이탈'",http://www.enewstoday.co.kr/news/articleView.html?idxno=2418649,"특히 2개 컨소시엄 가운데 현대차·KT·대한항공·인천국제공항공사·현대건설로 구성된 원팀만 그랜드챌린지 1·2단계 실증을 모두 수행했으며, 현재까지 민간 컨소시엄 형태를 유지하며 실증을 이어가고 있다. 반면... "
2026-04-14,네이버뉴스,"현대건설, 압구정5구역 수주전서 '몰카' 적발…DL이앤씨 상대로 법적 대...",http://www.srtimes.kr/news/articleView.html?idxno=201212,현대건설이 서울 강남구 압구정5구역 재건축 정비사업 시공사 선정 입찰 과정에서 경쟁사인 DL이앤씨 직원이 입찰 서류를 무단으로 불법 촬영했다며 경찰에 고소하는 등 엄정 대응에 나섰다. ​현대건설은 14일 배포한... 
2026-04-14,네이버뉴스,이란 미사일 공격에 사우디 현대건설·현대ENG 사무소 일부 파손,https://www.livebiz.today/news/articleView.html?idxno=201599,14일 건설업계에 따르면 이란의 사우디아라비아 공습으로 현대건설·현대엔지니어링의 현지 사무소가 일부 파손되는 물리적 피해가 발생했다. 사우디 동부 산업도시 주바일 지역에 있는 현대건설·현대엔지니어링의... 
2026-04-14,네이버뉴스,'1.5조 대어' 압구정5구역 수주전 과열…현대건설·DL이앤씨 고소전,http://www.4th.kr/news/articleView.html?idxno=2110443,14일 정비업계에 따르면 현대건설은 최근 압구정5구역 재건축 입찰 과정에서 발생한 서류 무단 촬영 사건과 관련해 DL이앤씨 관계자를 상대로 경찰에 고소장을 제출하고 법적 대응에 착수했다. 현대건설은 법무법인 자문... 
2026-04-14,네이버뉴스,대우건설 결국 '데이터센터' 건설 본격화 : 1만 평 대형 센터 수요 급증...,https://www.huffingtonpost.kr/article/256610,"2023년 데이터센터 사업에 진출한 대우건설은 현대건설, GS건설 등 경쟁사보다 후발주자에 속한다. 그간 대우건설은 데이터센터 사업의 중요도를 다른 사업보다 상대적으로 낮게 평가했다. 하지만 최근 데이터센터가... "
2026-04-14,네이버뉴스,"현대건설, '입찰서류 도촬' DL이앤씨 법적 대응",http://www.newstomato.com/ReadNews.aspx?no=1297865&inflow=N,뉴스토마토 = 이수정 기자 | 현대건설 사옥 전경. (사진=현대건설)  현대건설이 압구정5구역 경쟁사인 DL이앤씨 관계자가 입찰서류를 무단 촬영한 건에 대해 경찰에 고소장을 제출했습니다. 현대건설은 14일 입장문을 통해... 
2026-04-14,네이버뉴스,"현대건설, 압구정 5구역 '도촬 논란' 경쟁사 고소",https://www.ytn.co.kr/_ln/0102_202604141753310157,현대건설은 서울 강남구 압구정 5구역 재건축 입찰 과정에서 경쟁사 직원이 입찰 서류를 무단 촬영했다며 경찰에 고소장을 냈습니다. 현대건설은 입장문을 내고 재건축 조합에서 입찰서류 사진 촬영 금지를 거듭... 
2026-04-14,네이버뉴스,이란의 사우디 공습에 현대건설·현대ENG 사무소 일부 파손,https://biz.sbs.co.kr/article_hub/20000304278?division=NAVER,이란의 사우디아라비아 공습으로 현대건설·현대엔지니어링의 현지 사무소가 일부 파손된 사실이 뒤늦게 알려졌습니다. 14일 건설업계에 따르면 사우디 동부 산업도시 주바일 지역에 있는 현대건설·현대엔지니어링의... 
2026-04-14,네이버뉴스,‘대안제시형’ 계양강화道 1공구에 금호·HJ·태영 등 7개사 도전,https://news.mtn.co.kr/news-detail/2026041417461517524,"지난달 종합심사낙찰제 방식인 3·4·5·6공구의 개찰을 실시, 동부건설·금호건설·현대건설·DL이앤씨를 각각 4개 공구 낙찰적격자로 선정했다. 턴키(설계·시공 일괄 진행) 방식인 7공구 담당 사업자는 롯데건설... "
2026-04-14,네이버뉴스,"[고유가 3.0] 비용·수급·자금난 처한 건설업, 생존모드 돌입…'질적 성...",https://www.financialpost.co.kr/news/articleView.html?idxno=255394,"지난해 국토교통부가 발표한 시공능력평가(토목건축공사업) 기준에 따르면, 상위권 건설사는 ▲삼성물산 ▲현대건설 ▲대우건설 ▲DL이앤씨 ▲GS건설 ▲현대엔지니어링 ▲포스코이앤씨 ▲롯데건설 ▲SK에코플랜트... "
2026-04-14,네이버뉴스,"압구정5구역 입찰 '도촬 소동'…현대건설, 경쟁사 직원 고소",https://www.sidae.com/article/2026041417010515087,공사비 1조5000억원 규모의 서울 강남구 압구정5구역 재건축 사업 수주 경쟁에서 현대건설이 DL이앤씨를 고소하는 사태가 발생했다. 14일 현대건설은 압구정5구역 재건축 입찰 과정에서 DL이앤씨 직원이 입찰 서류를 무단... 
2026-04-14,네이버뉴스,이란의 공습에 사우디 현대건설 사무소 일부 파손,https://view.asiae.co.kr/article/2026041417444438093,이란의 사우디아라비아 공습으로 현대건설의 현지 사무소가 일부 파손된 사실이 뒤늦게 알려졌다. 14일 건설업계에 따르면 사우디 동부 산업도시 주바일 지역에 있는 현대건설의 '아미랄 프로젝트' 현장 사무실이 지난... 
2026-04-14,네이버뉴스,"현대건설, 압구정5구역 '도촬 논란' DL이앤씨에 법적대응…""공정 경쟁 원...",https://www.ngonews.kr/news/articleView.html?idxno=228324,"현대건설은 최근 서울 강남구 압구정5구역 재건축 입찰 과정에서 경쟁사 직원이 입찰 서류를 무단 촬영했다며 엄정 대응하겠다고 14일 밝혔다. 현대건설은 이날 배포한 입장문에서 ""입찰 서류 무단 촬영 논란과 관련해... "
2026-04-14,네이버뉴스,제로에너지빌딩·히트펌프 … 고효율 신기술 확산,https://www.mk.co.kr/article/12016729,"현대건설은 인공지능(AI) 기반 시스템으로 에너지 효율을 실시간 관리해 국내 최초로 고층형 ZEB 인증을 획득했다. 공기열, 지열, 수열 등을 끌어모아 난방과 온수를 공급하는 히트펌프도 각광받고 있다. 초기 설치... "
2026-04-14,네이버뉴스,현대건설 “입찰서류 무단 촬영 엄정 대응…DL이앤씨 고소”,https://www.dailian.co.kr/news/view/1633522/?sc=Naver,현대건설은 서울 강남구 압구정5구역 재건축 정비사업 입찰 과정에서 발생한 입찰서류 무단 촬영 논란에 엄정 대응한다고 14일 밝혔다. 현대건설은 이날 입장문에서 “시공사 선정 입찰 마감일 조합이 ‘입찰서류에 대한... 
2026-04-14,네이버뉴스,"압구정5구역 입찰 과정서 '무단 촬영' 논란…현대건설 ""엄정 대응할 것...",https://news.einfomax.co.kr/news/articleView.html?idxno=4409499,현대건설 계동 사옥[출처: 현대건설] 최근 강남구 압구정5구역의 재건축 정비사업 입찰 과정에서 경쟁사 관계자가 현대건설의 입찰서류를 무단 촬영하며 공정성 논란이 불거졌다. 현대건설은 엄정 대응을 예고하면서도... 
2026-04-14,네이버뉴스,"현대건설, 압구정5구역 입찰서류 도촬에 엄정 대응",http://www.koreastocknews.com/news/articleView.html?idxno=117925,"현대건설(000720, 대표 이한우)은 최근 서울 강남구 압구정5구역 재건축 입찰 과정에서 경쟁사 직원이 입찰 서류를 무단 촬영했다며 엄정 대응하겠다고 14일 밝혔다. 현대건설은 이날 입장문을 통해 ""입찰 서류 무단 촬영... "
2026-04-14,네이버뉴스,"압구정5구역 재건축…현대건설, ‘서류 무단 촬영’ DL에 법적대응",https://www.chosun.com/economy/real_estate/2026/04/14/LEJR2QDQO5HJNCAEVSTKRHFPOM/?utm_source=naver&utm_medium=referral&utm_campaign=naver-news,"현대건설이 최근 서울 강남 압구정5구역(한양 1·2차 아파트) 재건축 입찰 과정에서 불거진 경쟁사의 ‘서류 무단 촬영’ 논란과 관련해, 경찰 고소 등 법적 대응 입장을 14일 밝혔다. 현대건설은 이날 오후 배포한 입장문을... "
2026-04-14,네이버뉴스,현대건설 사우디 현장 인근 포격…인명 피해 없어,https://www.newsis.com/view/NISX20260414_0003591089,이란이 사우디아라비아의 산업시설을 공격하면서 현대건설 중동사업장 인근에 포격이 발생한 것으로 전해졌다. 14일 현대건설 등에 따르면 지난 7일(현지시간) 현대건설의 사우디 '아미랄 프로젝트' 현장 사무실 인근에서... 
2026-04-14,네이버뉴스,압구정5구역 수주전 ‘공정성’ 논란 확산…입찰 절차 중단,https://www.tfmedia.co.kr/news/article.html?no=203714,입찰서류 무단 촬영 논란에 절차 중단 현대건설 “경쟁 환경 영향”…엄정 대응 방침  압구정5구역 재건축 정비사업 수주전이 입찰서류 무단 촬영 논란으로 제동이 걸렸다. 해당 사안은 입찰 절차 중단으로 이어지며 공정성... 
2026-04-14,네이버뉴스,"현대건설, 압구정5구역 입찰서류 무단 촬영 논란에 “클린 수주 원칙 강...",https://weekly.cnbnews.com/news/article.html?no=212047,"▲ 현대건설,압구정5구역,입찰서류,무단 촬영,클린 수주 현대건설이 압구정5구역 재건축 입찰 과정에서 발생한 입찰서류 무단 촬영 논란과 관련, 조합원의 이익을 위해 클린 수주 원칙을 한층 강화하겠다고 밝혔다. 사진... "
2026-04-14,네이버뉴스,"압구정5구역 입찰서 '도촬' 논란…현대건설, DL이앤씨 법적 대응",http://www.yonhapnewstv.co.kr/AKR20260414172037kjW,"현대건설은 최근 서울 강남구 압구정5구역 재건축 입찰 과정에서 경쟁사 직원이 입찰 서류를 무단 촬영했다며 엄정 대응하겠다고 밝혔습니다. 현대건설은 오늘(14일) 배포한 입장문에서 ""입찰 서류 무단 촬영 논란과... "
2026-04-14,네이버뉴스,"광주, 태양광 전기로 수돗물 생산…전국 첫 '직접 전력구매'",https://www.polinews.co.kr/news/articleView.html?idxno=728443,"전력 거래는 현대건설이 맡는다. 발전소 규모는 300킬로와트로, 총 3억4000만 원이 투입됐다. 다만 현재 발전 규모로는 정수장 전체 전력을 감당하기 어렵다. 일부 전력만 직접 조달하는 수준으로, 기존 전력망과 병행 운영이... "
2026-04-14,네이버뉴스,"현대건설, 입찰서류 무단 촬영 적발에 엄정 대응 선언",http://www.ttlnews.com/news/articleView.html?idxno=3099097,현대건설은 압구정5구역 재건축 정비사업 입찰 과정에서 발생한 입찰서류 무단 촬영 사건에 대해 엄정 대응하겠다고 밝혔다. 이번 사건은 입찰 마감 직후 진행된 입찰서류 개봉 및 날인 절차에서 경쟁사 관계자가 조합과... 
2026-04-14,네이버뉴스,"현대건설, 압구정5구역 입찰서류 경쟁사 도촬에 '법적대응' 시사",https://www.newsis.com/view/NISX20260414_0003591046,현대건설이 서울 압구정 5구역 시공사 선정 과정에서 발생한 경쟁사의 입찰 서류 무단 촬영에 대해 엄정 대응을 시사했다. 현대건설은 14일 입장문을 내고 최근 압구정5구역 재건축 정비사업 입찰 과정에서 발생한 입찰서류... 
2026-04-14,네이버뉴스,"[건설 Pick] GS건설·현대건설, 기술혁신과 공정수주로 건설업계 신뢰 회...",https://www.lcnews.co.kr/news/articleView.html?idxno=200748,"GS건설이 모듈러 교량의 고질적인 부식 문제를 해결하며 스마트 인프라 시장의 문을 열었다면, 현대건설은 정비사업 현장의 불공정 행위에 엄정 대응하며 시장 질서 바로잡기에 주력하고 있다. 최근 건설 경기 위축으로... "
2026-04-14,네이버뉴스,"'조합원 100% 한강 조망' 승부수…포스코이앤씨, 신반포서 '삼성 넘기' ...",https://www.asiatoday.co.kr/view.php?key=20260414010004259,"현재 현대건설과 DL이앤씨가 경쟁 중인 압구정5구역에서도 같은 조건이 제안된 상태다.반면 삼성물산은 이번 입찰에서 한강변 인접 입지에 따른 조망 극대화를 강조했지만, 조합원 전 가구의 조망 확보 여부에... "
2026-04-14,네이버뉴스,압구정5구역 '서류 촬영' 파장…현대건설 vs DL이앤씨 정면 충돌,http://www.newslock.co.kr/news/articleView.html?idxno=128646,"이에 대해 현대건설은 공정성 훼손을 강하게 문제 삼고 있다. 회사 측은 오늘 입장문을 내고 ""입찰서류 밀봉은 정보 비대칭을 방지하기 위한 핵심 장치""라며 ""핵심 경쟁 정보가 외부로 유출될 경우 특정 업체가 유리한... "
2026-04-14,네이버뉴스,1분기 증권사 역대급 실적 기대…2분기에도 '고공행진' 가능성↑,https://www.joongangenews.com/news/articleView.html?idxno=511476,"전쟁으로 훼손된 주요 시설물은 약 27개가 있는 것으로 추정되는데 그 중 과거 시공 담당이었던 건설사별 현장 수는 삼성E&A는 7개, 현대건설·대우건설·GS건설·DL이앤씨가 각각 2개로 예상된다""라고 했다."
2026-04-14,네이버뉴스,"""아이돌봄 공백, 스타트업 혁신으로 풀어낼 것""",https://www.mk.co.kr/article/12016640,최근엔 현대건설과 협약을 맺고 서울 강남구 개포동 '디에이치아너힐즈' 아파트 커뮤니티에 들어갔다. 현재 1호점인 서울 마포구 염리초점을 비롯해 2호점 한서초점과 3호점 가재울초점도 운영하고 있다. 1호점은 인근에... 
2026-04-14,네이버뉴스,"현대건설, 압구정5구역 '도촬 논란' 경쟁사에 법적대응",https://www.yna.co.kr/view/AKR20260414142600003?input=1195m,"경찰에 고소장 제출…""'클린 수주' 원칙 강화할 것"" 현대건설은 최근 서울 강남구 압구정5구역 재건축 입찰 과정에서 경쟁사 직원이 입찰 서류를 무단 촬영했다며 엄정 대응하겠다고 14일 밝혔다. 현대건설은 이날 배포한... "
2026-04-14,네이버뉴스,"압구정5구역 입찰서류 무단촬영 논란 … 현대건설 ""엄정 대응, 클린수주...",https://biz.newdaily.co.kr/site/data/html/2026/04/14/2026041400312.html,뉴데일리 박정환 기자 = 현대건설이 서울 강남구 압구정5구역 주택재건축사업 시공사 선정 과정에서 발생한 경쟁사의 입찰 서류 무단 촬영 논란에 대해 엄정 대응하겠다는 입장을 밝혔다. 14일 현대건설은 입장문을 통해... 
2026-04-14,네이버뉴스,현대건설 “압구정5구역 ‘클린수주’ 원칙 강화”,https://www.etoday.co.kr/news/view/2575713,"이투데이=김지영 기자 | “공정 경쟁 훼손 행위 엄정 대응” 현대건설이 압구정5구역 재건축 시공사 선정 과정에서 불거진 경쟁사의 입찰서류 무단 촬영 논란과 관련, 수주 과정의 투명성을 높이겠다고 밝혔다. 현대건설은... "
2026-04-14,네이버뉴스,"DL이앤씨 압구정5구역 입찰서류 '무단 촬영' 논란에…현대건설 ""공정 훼...",http://www.kdfnews.com/news/articleView.html?idxno=181904,경쟁 입찰에 참여한 현대건설과 DL이앤씨 가운데 DL이앤씨 측 직원이 현장에서 몰래 촬영을 시도하다 적발되면서 공정성 논란이 불거진 상황이다. 업계에 따르면 이번 사안은 입찰 마감 직후 진행된 입찰서류 개봉 및 날인... 
2026-04-14,네이버뉴스,"""입찰 도촬, 공정경쟁 훼손""…현대건설, 압구정5구역 논란에 강경 대응",https://biz.sbs.co.kr/article_hub/20000304249?division=NAVER,"압구정5구역 재건축 입찰 과정에서 '서류 무단 촬영' 논란이 불거진 가운데, 현대건설이 공정경쟁 훼손 행위에 대해 강경 대응 방침을 밝혔습니다. 현대건설은 해당 사안과 관련해 입찰 마감 직후 진행된 서류 개봉 및 날인... "
2026-04-14,네이버뉴스,"압구정 5구역서 입찰서류 '무단 촬영' 소동…현대건설 ""클린수주""",https://www.hankyung.com/article/2026041404046,"현대건설은 최근 압구정5구역 재건축 정비사업 입찰 과정에서 발생한 입찰서류 무단 촬영 논란과 관련해 ""공정 경쟁의 원칙을 훼손하는 행위에 대해 엄정하게 대응하겠다""는 입장을 밝혔다. 현대건설은 14일 ""불공정 행위가... "
2026-04-14,네이버뉴스,"현대건설, 압구정5구역 무단 촬영 논란에 ""공정 경쟁 원칙 훼손...엄정 ...",https://www.ebn.co.kr/news/articleView.html?idxno=1705424,현대건설은 최근 압구정5구역 재건축 정비사업 입찰 과정에서 발생한 무단 촬영 논란과 관련해 공정 경쟁의 원칙을 훼손하는 행위에 대해 엄정 대응하겠다고 밝혔다. 신속통합기획 방식으로 재건축을 추진 중인... 
2026-04-14,네이버뉴스,"""현대건설은 조합원의 이익을 위해, 클린수주 원칙 지켜가겠습니다""",https://news.bbsi.co.kr/news/articleView.html?idxno=4078324,"현대건설은 최근 압구정5구역 재건축 정비사업 입찰 과정에서 발생한 입찰서류 무단 촬영 논란과 관련해 ""공정 경쟁의 원칙을 훼손하는 행위에 대해 엄정하게 대응하겠다""라고 밝혔습니다. 또 불공정 행위가 있었음에도... "
2026-04-14,네이버뉴스,"[아유경제_부동산] 현대건설, 핀란드와 에너지 인프라 분야 협력 강화",http://www.areyou.co.kr/news/articleView.html?idxno=93389,현대건설이 핀란드와 신규 대형 원전에 이어 에너지 분야에서도 협력을 강화한다. 현대건설은 이달 10일 서울 종로구 계동 본사에서 빌레 타비오 핀란드 외교통상개발부 장관을 비롯한 핀란드 대표단과 면담을 갖고... 
2026-04-14,네이버뉴스,"압구정5구역 '클린수주 전면전'···현대건설 ""압구정5구역 '도촬 논란...",https://www.smartbizn.com/news/articleView.html?idxno=141887,"| 스마트비즈 = 전근홍 기자 | 현대건설이 서울 강남권 최대 재건축 사업지로 꼽히는 압구정5구역 수주전과 관련해 발생한 입찰서류 무단 촬영 논란에 대해 ""공정 경쟁 원칙을 훼손하는 행위에 엄정 대응하겠다""며 클린수주... "
2026-04-14,네이버뉴스,1분기 지역업체 하도급 2조 7120억 수주,https://www.ggilbo.com/news/articleView.html?idxno=1152705,"구체적으로 선화3차 주상복합(코오롱글로벌) 364억 원, KT인재개발원 공동주택(계룡건설) 172억 원, 도안2지구 2블록 공동주택(현대건설) 186억 원, 도룡동 주상복합(GS건설) 107억 원 등이다. 시는 경쟁력 있는... "
2026-04-14,네이버뉴스,압구정5구역 재건축 입찰서류 무단 촬영 논란,https://www.financialpost.co.kr/news/articleView.html?idxno=255480,서울 강남구 압구정5구역 재건축 시공사 선정 입찰 과정에서 DL이앤씨 직원이 경쟁사인 현대건설 서류를 무단 촬영하다가 적발되는 사건이 발생했다. 입찰 마감일인 지난 10일 입찰서 개봉에 이은 상호 날인 과정에서... 
2026-04-14,네이버뉴스,"광주시, 태양광 전력으로 수돗물 생산…직접 PPA 모델 구축",https://www.todayenergy.kr/news/articleView.html?idxno=296574,"이번 사업은 상수도사업본부와 빛고을시민햇빛발전 사회적협동조합, 현대건설이 협력해 추진한 것으로, 지난해 10월 체결한 '용연정수장 유휴부지 활용 태양광 직접 PPA 협약'에 기반한다. 협약에 따라 시민햇빛발전... "
2026-04-14,네이버뉴스,[단독]현대건설 사우디 사무실도 이란 미사일 공격 여파…천장 파손,https://www.mt.co.kr/estate/2026/04/14/2026041416114267187,이란의 사우디아라비아 산업시설 보복 공격으로 현대건설 중동 사업장도 사무실 천장이 파손되는 피해를 입은 것으로 알려졌다. 이런 가운데 사우디 현장에 파견된 현대건설·현대엔지니어링 임직원 중 일부는 회사가... 
2026-04-14,네이버뉴스,"현대건설 ""압구정5구역 입찰 서류 무단 촬영 엄정 대응…클린수주 강화...",https://www.news1.kr/realestate/general/6136254,"현대건설(000720)은 서울 압구정5구역 시공사 선정 과정에서 발생한 경쟁사의 입찰 서류 무단 촬영에 대해 엄정 대응하겠다는 입장을 밝혔다. 현대건설은 14일 입장문을 통해 ""당사는 압구정5구역 조합원 이익을 위해... "
2026-04-14,네이버뉴스,DL이앤씨 압구정5구역 입찰서류 도촬 장비는 펜카메라,https://www.discoverynews.kr/news/articleView.html?idxno=1089032,DL이앤씨의 경영원칙[출처=DL이앤씨] DL이앤씨의 서울 강남 압구정5구역 재건축 시공사 선정 입찰 과정에서 불거진 무단 촬영에 대해 현대건설은 14일 이번 사안은 경쟁방법의 적법성과 공정성을  훼손하는 중대한... 
2026-04-14,네이버뉴스,축제 끝·이제 프런트의 시간…허수봉·정호영 어디로?,https://www.dailian.co.kr/news/view/1633483/?sc=Naver,레전드 양효진이 은퇴를 선언한 현대건설이 이미 정호영 영입에 관심을 보이고 있는 가운데 높이 보강이 절실한 팀들에게 2001년생으로 아직 젊은 정호영은 매력적인 자원이다. 세터 김다인을 향한 인기도 상당할... 
2026-04-14,네이버뉴스,"현대건설, 압구정5구역 입찰 촬영 논란에 “엄정 대응”",https://www.thepowernews.co.kr/view.php?ud=202604141620473119de3f0aa1be_7,압구정5구역 재건축 시공사 선정 과정에서 입찰서류 무단 촬영 논란이 불거진 가운데 현대건설이 공정 경쟁 원칙 훼손 행위에 엄정 대응하겠다는 입장을 밝혔다. 현대건설은 압구정5구역 재건축 정비사업 입찰 과정에서... 
2026-04-14,네이버뉴스,현대건설 “압구정5구역 ‘클린수주’ 원칙 강화할 것”,https://biz.chosun.com/real_estate/real_estate_general/2026/04/14/YNIWY6KEOFDN3DU5R56BS4L66A/?utm_source=naver&utm_medium=original&utm_campaign=biz,"경쟁사 입찰서류 무단 촬영 언급 “조합원 이익 최우선, 공정 경쟁하겠다” 현대건설은 최근 압구정5구역 재건축 정비 사업 입찰 과정에서 발생한 입찰 서류 무단 촬영 논란 등 공정 경쟁의 원칙을 훼손하는 행위에 대해... "
2026-04-14,네이버뉴스,"현대건설, 압구정5구역 논란에 클린수주 원칙 강화",https://www.inthenews.co.kr/news/article.html?no=85590,입찰서류 무단 촬영 논란 대응 공정 경쟁·조합원 이익 강조 인더뉴스 제해영 기자ㅣ현대건설은 압구정5구역 재건축 정비사업 입찰 과정에서 발생한 입찰서류 무단 촬영 논란과 관련해 공정 경쟁 원칙을 강화하겠다고 14일... 
2026-04-14,네이버뉴스,"현대건설, 압구정5구역 입찰서류 무단 촬영에 ""클린수주 원칙 강화""",https://www.newsclaim.co.kr/news/articleView.html?idxno=3060683,"현대건설,이한우 사진=현대건설 현대건설(대표 이한우)이 압구정5구역 재건축 시공사 선정 과정에서 발생한 경쟁사 입찰서류 무단 촬영 논란과 관련해, 공정 경쟁을 훼손하는 행위에 대해 엄정 대응하겠다는 입장을... "
2026-04-14,네이버뉴스,"현대건설 ""압구정5구역 입찰서류 무단 촬영, 공정 경쟁 훼손…엄정 대응...",https://www.mediapen.com/news/view/1093323,"압구정5구역 재건축 정비사업 입찰 과정에서 경쟁사 직원의 입찰서류 무단 촬영 논란이 불거진 가운데, 현대건설이 공정 경쟁 원칙 훼손에 대해 엄정 대응 방침을 밝혔다. 현대건설 계동 사옥./사진=현대건설 현대건설은... "
2026-04-14,네이버뉴스,"롯데건설 희망퇴직에 건설업계 긴장…""인력 구조 손볼 수밖에""",https://www.ajunews.com/view/20260414151823606,"건설사별로 살펴보면 DL이앤씨 847명, GS건설 487명, 대우건설 357명, 현대건설 247명 줄었다. 한 건설사 관계자는 “다수 건설사들이 조직 개편을 통해 인력을 감축하고 재정비하고 있다”며 “희망퇴직이 확산되면... "
2026-04-14,네이버뉴스,“수주가 곧 리스크”…8.7조 압구정·목동 재건축 대어도 ‘무혈입성’...,https://www.ekn.kr/web/view.php?key=20260414028116448,"공사비 5조5000억원 규모의 압구정3구역은 현대건설 단독 참여로 유찰됐고, 목동6단지(약 1조2000억원) 역시 DL이앤씨 단독 응찰로 마감됐다. 반면 압구정5구역(1조4960억원)과 반포19·25차(4434억원)만 경쟁 입찰이 성사됐다. 총... "
