date,source,title,link,description
2026-04-09,네이버뉴스,"삼성물산, 압구정4구역 2차설명회 단독 참석···'금융 경쟁력' 강점",http://www.koreastocknews.com/news/articleView.html?idxno=117823,"당초 압구정4구역은 삼성물산과 현대건설의 2파전이 예상됐지만, 현대건설이 압구정3·5구역 수주에 집중하는 쪽으로 선회하면서 경쟁 입찰이 불발된 것으로 풀이된다. 업계에서는 삼성물산의 높은 신용등급(AA+)과... "
2026-04-09,네이버뉴스,"[클릭 e종목]현대건설, 원전 계약·중동 기대감…목표가↑",https://view.asiae.co.kr/article/2026040908264042089,"하나증권은 9일 현대건설에 대해 원전 프로젝트 수주 및 중동 프로젝트에 대한 기대감을 반영해 목표주가를 24만원으로 상향하고, 투자의견 '매수'를 유지했다. 김승준 하나증권 연구원은 ""지난달 현대건설 관련 원전... "
2026-04-09,네이버뉴스,[증시키워드] ‘21만 전자·100만 닉스’ 재돌파⋯전쟁 재건 기대에 대우...,https://www.etoday.co.kr/news/view/2574111,현대건설은 21% 급등한 18만 8700원에 거래를 마쳤다. 전날 도널드 트럼프 미국 대통령은 호르무즈 해협 완전 재개방을 조건으로 이란에 대한 공격을 2주간 중단한다고 밝혔다. 미국과 이란은 11일 파키스탄 수도... 
2026-04-09,네이버뉴스,"현대건설, 실적개선은 2분기부터…목표가 24만원 상향[애널리스트의 시...",https://www.newsway.co.kr/news/view?ud=2026040908145521149,하나증권이 현대건설의 실적 안정성과 센티멘트 개선 기대를 반영해 목표주가를 대폭 상향하며 상승 여력이 충분하다고 평가했다. 9일 김승준 하나증권 연구원은 현대건설에 대해 투자의견 '매수(BUY)'를 유지하고... 
2026-04-09,네이버뉴스,“건설주가 시장 이겼다…중동 재건 대표 수혜주는?”,http://www.edaily.co.kr/news/newspath.asp?newsid=02574806645414480,황 연구원은 “등대 같은 분야는 원전”이라며 “현대건설이 시작해 대우건설이 뒤를 이었고 DL이앤씨와 GS건설 순으로 밸류에이션 상승세가 이어지고 있다”고 말했다. 이어 “사업 구도에 관계없이 원전 시공(C)을... 
2026-04-09,네이버뉴스,"“현대건설, 목표가↑…2분기 중동 재건·원전 계약 기대감”-하나",https://www.itooza.com/common/iview.php?no=2026040908122509143,하나증권이 9일 현대건설에 대해 2분기에 중동 재건에 대한 기대와 원전 계약 등 투자심리가 개선될 것이라면서 목표주가를 기존 13만원에서 24만원으로 높여 잡았다. 투자의견은 ‘매수(Buy)’로 유지했다. 전 거래일... 
2026-04-09,네이버뉴스,"현대건설, 주택건축 마진 개선 2분기부터…목표가 24만원으로 상향-하나",https://www.mt.co.kr/stock/2026/04/09/2026040908050343203,하나증권은 현대건설에 대해 2분기부터 주택건축 마진이 본격적으로 좋아질 수 있다며 목표주가를 24만원으로 상향한다고 9일 밝혔다. 두 달 전 냈던 기존 목표가는 13만원. 하나증권에 따르면 현대건설의 1분기... 
2026-04-09,네이버뉴스,“전쟁 끝나면 37조원 시장 열린다”…중동 재건에 건설주 재평가 시동,http://www.edaily.co.kr/news/newspath.asp?newsid=02538726645414480,"현대건설(000720), 대우건설(047040), GS건설(006360), 삼성E&A(028050), DL이앤씨(375500) 등 플랜트 역량을 갖춘 대형 건설사들이 중동 주요 현장의 원 시공자로 참여했던 만큼, 발주처 입장에선 복구와 증설을 맡길 가장 익숙한... "
2026-04-09,네이버뉴스,"건설·증권 웃고, 정유 울고…휴전에 업종별 희비 엇갈려",https://news.einfomax.co.kr/news/articleView.html?idxno=4408506,"대우건설·GS건설·DL이앤씨·현대건설·삼성물산·HDC현대산업개발 등이 일제히 급등했고, 장 마감 기준으로 GS건설은 29.86%, 대우건설은 29.97%, DL이앤씨는 25.93% 상승했다. 미국과 이란의 휴전이 중동 지역 재건 사업... "
2026-04-09,네이버뉴스,휴전 신호에 시장 '폭주'…증시 급등에 재건주 불붙었다,https://news.jtbc.co.kr/article/NB12293407?influxDiv=NAVER,"GS건설과 대우건설 등이 상한가로 장을 마쳤고, DL이앤씨, 현대건설 등도 20% 넘게 급등했습니다. [이경민/대신증권 연구원 : 휴전이라고 하더라도 이란이 요구한 10대 항목 중에 재건을 도와달라는 부분들이 있다가 보니까... "
2026-04-09,네이버뉴스,'불안한 휴전' 우려 속 6000피 넘보는 코스피 [오늘장 미리보기],https://www.hankyung.com/article/202604098544i,"대우건설(29.97%), GS건설(29.86%) 등이 상한가를 기록했고, 중동 건설 경험이 많은 현대건설(21.04%)과 삼성물산(12.77%)도 크게 올랐다. 지난 8일(현지시간) 미국 뉴욕 증시는 2% 넘게 급등했다. 뉴욕증시에서 다우존스30... "
2026-04-09,네이버뉴스,확전 우려 걷히자 재건 기대…건설주 ‘급등',http://www.fnnews.com/news/202604090750407917,"현대건설(21.04%), DL이앤씨(25.93%) 등 주요 건설사들도 동반 급등했다. 한 달간 가장 많이 오른 업종이 휴전 소식까지 겹치며 추가 상승 동력을 확보한 셈이다. 시장 흐름도 빠르게 바뀌는 분위기다. 그간 중동발 지정학적... "
2026-04-09,네이버뉴스,코스피 6.87% 급등에…개미 5조 역대 최대 매도,https://www.sedaily.com/article/20030195?ref=naver,"중동 재건 기대감에 대우건설(047040)(30.0%), 현대건설(000720)(22.0%) 등 건설주가 급등했고 증권주도 강세를 나타냈다. 다만 키움증권(039490) 한지영 연구원은 실적 시즌이 이제 시작된 만큼 반도체 업종의 추가 상방... "
2026-04-09,네이버뉴스,"현대건설, 2분기 수주 기대·투심 돌아올 것...목표가 85% 상향-하나",http://www.edaily.co.kr/news/newspath.asp?newsid=02460006645414480,"하나증권이 현대건설(000720)에 대해 투자의견 ‘매수(BUY)’를 유지하면서 목표주가를 기존 13만원에서 24만원으로 84.6% 대폭 상향했다. 김승준 하나증권 연구원은 “3월 한 달간 현대건설 관련 원전 뉴스의 부재, 타... "
2026-04-09,네이버뉴스,"유가 100달러 아래로 떨어졌지만…EIA, 올해 전망치 21% 상향",https://www.sedaily.com/article/20030191?ref=naver,"중동 재건 기대감에 대우건설(047040)(30.0%)·현대건설(000720)(22.0%) 등 건설주가 폭등했고, 한국금융지주(071050)(12.2%)·키움증권(039490)(13.2%) 등 증권주도 강세를 보였다. 수급에서는 외국인·기관이 각각 2조 4722억 원... "
2026-04-09,네이버뉴스,부동산 상위 1% 기준 34억…1년 만에 4억 급등,https://www.sedaily.com/article/20030192?ref=naver,"현대건설(000720)은 8245억 원 규모의 신안 우이 프로젝트를 2분기 착공하고, SK에코플랜트는 532MW 규모 안마 프로젝트 운송·설치를 수주했다. 글로벌 해상풍력 시장이 지난해 769억 달러에서 2035년 3075억 달러로... "
2026-04-09,네이버뉴스,"""현대건설, 2분기 투자심리 개선 요인 많아…목표가↑""-하나",https://www.hankyung.com/article/2026040985586,하나증권은 9일 현대건설에 대해 2분기에 투자심리를 개선시킬 만한 요인이 많다며 목표주가를 기존 13만원에서 24만원으로 올렸다. 투자의견은 ‘매수’를 유지했다. 김승준 하나증권 연구원은 “3월 한달간 현대건설... 
2026-04-09,네이버뉴스,"하나증권 ""현대건설, 중동 재건·원전 계약 기대감..목표가↑""",https://kpenews.com/View.aspx?No=4035113,한국정경신문 이진성 기­자 jinlee@g.skku.edu [한국정경신문=이진성 기자] 하나증권이 현대건설에 대해 중동 재건에 대한 기대와 2분기 원전 계약 등 센티멘트가 개선될 수 있다며 투자의견 매수를 유지하고 목표주가는... 
2026-04-09,네이버뉴스,‘바람 불 때 더 띄워보자’ 건설사 새 먹거리 떠오른 해상풍력,https://www.sedaily.com/article/20030118?ref=naver,"EPC 사업자에서 에너지 디벨로퍼로 가장 선두에서 움직이는 곳은 현대건설이다. 그동안 서남해 실증단지와 제주한림 해상풍력에서 시공 경험을 쌓아온 현대건설은 올 2분기, 390MW 규모의 ‘신안 우이 해상풍력’... "
2026-04-09,네이버뉴스,[증시전략] '아슬아슬' 2주 휴전에 불안한 시장…관전 포인트는?,https://biz.sbs.co.kr/article_hub/20000303054?division=NAVER,"대우건설·현대건설 등 건설업종 급등 - 환율 안정 흐름도 시장에 긍정적으로 작용할 가능성 제기 - 달러·원 환율 주간거래 33.6원 하락한 1470.6원 - 외인 2~3월 50조 매도 자금 유출, 환율 약세 연출 - 외인 매도세 진정될... "
2026-04-09,네이버뉴스,'하이엔드 대전' 노량진…'국평 25억' 첫 분양 아파트 보니 [현장+],https://www.hankyung.com/article/2026040875776,"1·3구역엔 포스코이앤씨 '오티에르', 4구역엔 현대건설 '디에이치', 2·7구역은 SK에코플랜트 '드파인', 5구역은 대우건설 '써밋', 8구역엔 DL이앤씨 '아크로'가 들어선다. 현장에서 가장 눈에 띈 요소는 면적대별 유닛 외에... "
2026-04-09,네이버뉴스,시공단계 세계최고 수준…기획설계·유지·운영 ‘기술공백’ 과제,https://www.dnews.co.kr/uhtml/view.jsp?idxno=202604081211268620442,"(2) K-건설도 체질 개선 분주 삼성물산, 글로벌 EPC 밸류체인 구축 SK에코플랜트, 반도체종합기업 변신 현대건설, 데이터센터ㆍSMR 집중 공략 [대한경제=김민수 기자]국내 건설사들도 반도체 팹부터 소형모듈원전(SMR)까지... "
2026-04-09,네이버뉴스,"[유튜브로 진격하는 건설업계] ① 보수적 이미지 지우고, 콘텐츠 다변화...",https://www.dnews.co.kr/uhtml/view.jsp?idxno=202604081636048120526,현대건설은 유튜브 채널 ‘힐스캐스팅’을 통해 힐스맨 시리즈를 선보이고 있다. 현대건설 임직원들이 직접 출연해 힐스테이트 단지를 방문하며 입주민들을 직접 만나고 고객의 소리를 시리즈로 엮은 콘텐츠다.... 
2026-04-09,네이버뉴스,압구정·목동·반포 수주전 ‘A매치’ 열린다…현대·삼성·포스코·DL이...,https://www.etoday.co.kr/news/view/2573521,"현대건설과 삼성물산, 포스코이앤씨, DL이앤씨 등 대형 건설사들이 참전할 전망이라 올해 정비사업 시장 판도의 윤곽이 드러날 것으로 보인다. 8일 업계에 따르면 10일 입찰을 마감하는 정비사업장 중 시공권의 방향이... "
2026-04-09,네이버뉴스,[투데이 Pick] 중동 휴전에도 '공사비 쇼크' 고착화…비상등 켜진 정비업...,https://www.news2day.co.kr/article/20260408500309,현대건설은 대조 1구역에 공사비 증액을 요청한 데 이어 송파 마천 4구역에도 기존 대비 약 75% 인상된 공사비를 요구했다. 이밖에도 오는 2027년 말 준공이 예정된 과천의 대단지 아파트 역시 시공사 측이 공사 비용... 
2026-04-09,네이버뉴스,"GS건설, 허창수→허윤홍 본격 세대 교체…호실적에 성과급 활짝",https://realty.chosun.com/site/data/html_dir/2026/04/08/2026040803487.html,서울 알짜 재건축 현장으로 꼽히지만 현대건설 선호도가 너무 강하고 출혈 경쟁 예상되는 강남구 압구정 일대 수주는 과감히 포기했다. 대신 공사비 2조1000억원 규모인 성수1지구에 전사적 역량을 쏟는 중이다. 이... 
2026-04-09,네이버뉴스,"트럼프 ‘타코 땡큐’…한 달동안 가장 많이 오른 건설株, 더 센 랠리 열...",https://www.etoday.co.kr/news/view/2574007,"현대건설은 21.04%, DL이앤씨는 25.93% 올랐고, HDC현대산업개발은 8.07%, 삼성E&A는 5.65% 상승했다. 이미 한 달간 가장 많이 오른 업종이 휴전 합의 소식에 다시 한 번 상단이 열린 셈이다. 미국과 이란이 2주간 휴전에... "
2026-04-09,네이버뉴스,잠재 부실 자산 1위 신한은행…58조 중 기업 부문이 77%,https://realty.chosun.com/site/data/html_dir/2026/04/08/2026040804078.html,"올해 2월에는 현대건설과 업무협약을 맺어 ▲데이터센터 ▲신재생에너지 ▲인프라/환경 ▲전력중개거래 등 사업 전반에 대해 금융 협력을 강화했다. 프로젝트별 금융자문, 금융주선, 투자 연계 등을 통해 자금을... "
2026-04-09,네이버뉴스,"올해 정비사업 왕좌, 2분기 압구정·성수 분수령...1분기는 대우건설 선...",https://www.newspim.com/news/view/20260408000869,"이어 롯데건설이 송파 가락극동(4840억원)과 금호 제21구역(6242억원) 등에서 1조1082억원의 실적을 올렸고, 현대건설이 경기 금정2구역 재개발(4258억원)과 신길1구역 재개발(6607억원) 등을 따내며 총 1조865억원으로... "
2026-04-09,네이버뉴스,韓 떠나는 유럽 해상풍력 기업들,http://www.edaily.co.kr/news/newspath.asp?newsid=01669526645414480,독일 RWE 역시 올초 서해해상풍력(495㎿)과 신안 늘샘우이해상풍력(510㎿) 등 일부 사업을 정리하고 현대건설과 진행 중인 통영미래해상풍력 사업(360㎿)에 집중하는 등 국내 사업 포트폴리오를 조정 중이다. 세계 최대... 
2026-04-09,네이버뉴스,"현대건설, 현장에 AI 탑재 건설장비 도입 적극 나선다 .... 건설현장 안...",http://www.worktoday.co.kr/news/articleView.html?idxno=83572,현대건설 김제영 안전수행지원실장(왼쪽)과 HD건설기계 최태근 글로벌 통합 영업본부장이 '건설기계 스마트 안전기술 공동 개발 및 적용을 위한 업무협약' 체결 후 기념 촬영하고 있다. 현대건설이 건설 현장에 AI 탑재... 
2026-04-09,네이버뉴스,"현대건설, 'AI 탑재' 장비로 현장 안전 지킨다…HD건설기계와 맞손",https://www.apnews.kr/news/articleView.html?idxno=3047627,©AP신문(AP뉴스)/이미지 제공 = 현대건설 ▲현대건설 김제영 안전수행지원실장(왼쪽)과 HD건설기계 최태근 글로벌 통합 영업본부장이 지난 7일 서울 종로구 계동 현대건설 본사에서 '건설기계 스마트 안전기술 공동... 
2026-04-09,네이버뉴스,"원자력발전 관련주, '덩실덩실' 대우건설·GS건설·DL이앤씨· 현대건설...",http://www.finomy.com/news/articleView.html?idxno=252898,"8일 한국거래소에 따르면 대우건설, GS건설, 우리기술, DL이앤씨, 현대건설, 보성파워텍, 대한전선, 한미글로벌, 에이프로젠, 두산에너빌리티, 한국전력, 오르비텍, 삼영엠텍, 지투파워는 상승했다. 대우건설과... "
2026-04-09,네이버뉴스,"로봇·산업용·협동로봇 관련주, '싱글벙글' 현대무벡스·대동기어·휴림...",http://www.finomy.com/news/articleView.html?idxno=252895,"현대·기아차, 한국GM, 현대건설기계 등 다양한 고객사에 내연기관 및 전동화 부품을 공급하며 성장을 지속해오고 있다. 휴림로봇은 2026년부터 자율주행 로봇 플랫폼 'TETRA-DSV'를 중심으로 물류·공정·점검·보안 등... "
2026-04-08,네이버뉴스,"김상욱 예비후보…""겸직 없이 오직 주권자만 바라볼 것""",http://www.paxetv.com/news/articleView.html?idxno=269010,김상욱 예비후보/ [사진=본인제공] 더불어민주당 광진구 제2선거구 경선을 앞둔 김상욱 예비후보가 서울시의원에 당선될 경우 본업인 현대건설을 퇴사하고 의정 활동에만 전념하겠다는 공약을 내걸었습니다. 김... 
2026-04-08,네이버뉴스,‘서반포’ 조롱받던 흑석뉴타운 지금은?,https://www.mk.co.kr/article/12007263,"이곳 역시 현대건설 프리미엄 브랜드 ‘디에이치(디에이치켄트로나인·가칭)’를 달고 연내 분양할 예정이다. 뉴타운 지정 20년, 그 후 10곳 중 6곳 입주·2곳 분양 예정 11구역과 9구역은 올해 분양을 앞두고 있다. 이미... "
2026-04-08,네이버뉴스,"현대건설 '힐스테이트 안양펠루스', 전 세대 1순위 마감…최고 11.5대 1",https://www.ebn.co.kr/news/articleView.html?idxno=1704827,현대건설이 시공한 '힐스테이트 안양펠루스'가 전 세대 1순위 청약 마감에 성공했다. 8일 한국부동산원 청약홈에 따르면 경기 안양시 만안구 안양동에 공급되는 힐스테이트 안양펠루스는 지난 7일 진행된 아파트... 
2026-04-08,네이버뉴스,'휴전이다' 튀어오른 코스피…'재건주' 줄줄이 상한가,https://news.jtbc.co.kr/article/NB12293344?influxDiv=NAVER,"GS건설과 대우건설 등이 상한가로 장을 마쳤고, DL이앤씨, 현대건설 등도 20% 넘게 급등했습니다. [이경민/대신증권 연구원 : 휴전이라고 하더라도 이란이 요구한 10대 항목 중에 재건을 도와달라는 부분들이 있다가 보니까... "
2026-04-08,네이버뉴스,휴전 소식에 코스피 5900 탈환…환율 1470원대 급락,https://www.ichannela.com/news/main/news_detailPage.do?publishId=000000523076,"삼성전자는 21만원대, SK하이닉스도 100만원대로 반도체주가 올랐고 현대건설 21%, 대한항공 8% 오르는 등 재건주와 항공주도 강세를 보였습니다. [윤소영 / 서울 성동구] ""추가 매수를 한다면 반도체. 종전을 하면... "
2026-04-08,네이버뉴스,"[건설사리포트]GS건설, 하나금융과 첨단투자 협약ㆍ현대건설, AI 건설장...",https://www.ebn.co.kr/news/articleView.html?idxno=1704823,"현대건설, AI 건설장비로 현장 안전 강화 현대건설이 AI 기반 건설장비를 활용한 현장 안전관리 고도화에 나선다. 현대건설은 7일 서울 종로구 계동 본사에서 HD건설기계와 '건설기계 스마트 안전기술 공동 개발 및 적용을... "
2026-04-08,네이버뉴스,"“노동위가 인정했다 포스코, 교섭장에 나와라”",https://vop.co.kr/A00001691533.html,"앞서 노조는 지난 3월 10일 포스코를 비롯해 SK에너지, 현대건설 등 17개 발주처와 종합건설사에 교섭을 요구했지만, 이들 원청 기업은 사용자가 아니다라는 입장을 밝히며 교섭 요구를 거부해왔다.노조는 현장을 실질적으로... "
2026-04-08,네이버뉴스,[헬로스톡] 4월 8일 주목할 종목: 현대건설·LG에너지솔루션·SK텔레콤·...,https://www.hellot.net/news/article.html?no=111957,"현대건설 — 원전 모멘텀 본격화, SMR 착공·불가리아 EPC 체결 예정 현대건설에 대한 투자의견은 매수(Buy)를 유지하며, 목표주가는 기존 16만원에서 20만원으로 상향 조정됐다. 원전 분야에서의 독보적인 입지를... "
2026-04-08,네이버뉴스,[기획] 고금리 늪 빠진 PF 구조조정… 건설사 '생존' VS '프리미엄' 양극...,https://www.polinews.co.kr/news/articleView.html?idxno=727894,"현대건설의 '디에이치(THE H)', 롯데건설의 '르엘(LE-EL)' 등 프리미엄 브랜드는 강남권 등 서울 주요 정비사업지에서 강력한 수주 경쟁력을 증명하고 있다. 고물가와 공사비 폭등으로 수익성이 악화된 상황에서 대형사들은... "
2026-04-08,네이버뉴스,한달간 하청 985곳 교섭요구… 車·반도체 등 압박 거세진다,http://www.fnnews.com/news/202604081832512420,"현대차, 현대모비스, 한국GM, 한국타이어, HD현대중공업, 한화오션, 현대건설 등이 대표적이다. 재계 관계자는 ""현재 국내 제조 기업들은 이미 원청 노조와의 협상만으로도 노사 갈등의 골이 깊은 상황""이라며 ""민간에서... "
2026-04-08,네이버뉴스,"현대건설, AI 건설장비 도입 확대…현장 안전관리 체계 고도화",https://www.job-post.co.kr/news/articleView.html?idxno=212994,현대건설이 건설현장 안전관리 강화를 위해 AI 기반 건설장비 도입을 확대한다. 현대건설은 서울 종로구 계동 본사에서 HD건설기계와 '건설기계 스마트 안전기술 공동 개발 및 적용'을 위한 업무협약을 체결했다고 밝혔다.... 
2026-04-08,네이버뉴스,호실적·휴전發 안도 랠리…개미는 역대 최대 5조 ‘팔자’,https://www.sedaily.com/article/20030088?ref=naver,"중동 재건 기대감에 대우건설(30.0%), 현대건설(22.0%) 등 건설 업종이 급등했고 한국금융지주(12.2%), 키움증권(13.2%) 같은 증권주도 활짝 웃었다. 반도체 호황에 대한 기대가 커지면서 시장 내 영향력도 확대되고... "
2026-04-08,네이버뉴스,"“특별법에 인허가 대폭 단축”…현대·호반·SK, 해상풍력 판 키운다",https://www.sedaily.com/article/20030073?ref=naver,가장 기민하게 움직이는 곳은 현대건설이다. 현대건설은 지난해 말 8245억 원 규모의 시공 계약을 맺은 ‘신안 우이 해상풍력’ 프로젝트를 2분기 중으로 착공한다. 발전용량 390메가와트(MW) 규모의 신안 우이 프로젝트는... 
2026-04-08,네이버뉴스,"[브리핑] 현대건설·포스코이앤씨 ""현장 안전이 최우선""…스마트 기술 ...",http://www.dailypop.kr/news/articleView.html?idxno=97892,현대건설은 HD건설기계와 손잡고 '스마트 안전기술 협력'을 위한 업무협약(MOU)을 체결했다. 이번 협력을 통해 양사는 건설 장비의 자율 주행과 실시간 모니터링 시스템을 고도화하여 현장 사고 예방에 앞장설 방침이다.... 
2026-04-08,네이버뉴스,미국-이란 2주간 휴전에 코스피 급등,http://www.newstomato.com/ReadNews.aspx?no=1297192&inflow=N,"대우건설(047040)·GS건설(006360)이 상한가를 기록했고 현대건설(000720)과 DL이앤씨(375500)도 20%대 급등했습니다. 반면 전쟁 수혜주였던 한화에어로스페이스(012450)(-3.64%), 현대로템(064350)(-1.9%) 등 방산주는 약세를... "
2026-04-08,네이버뉴스,"[더벨][이사회 분석 | 현대건설] 신임 CSO도 주식 매입 참여, 책임경영 ...",https://www.thebell.co.kr/free/content/ArticleView.asp?key=202604031715064200102237,현대건설 사내이사진이 전원 자사주를 매입해 책임경영 의지를 다지고 있다. 최근 정기 주주총회에서 신임 사내이사로 안전품질본부장(CSO)인 신재점 상무를 선임했다. 신 상무는 이사회에 합류하면서 보통주... 
2026-04-08,네이버뉴스,[단독] 삼성물산 건설부문 '스마트 헬스케어' 상표 출원…주거서비스 경...,https://ilyo.co.kr/?ac=article_view&entry_id=510320,현대건설은 개발 중인 헬스케어 기술을 접목한 미래형 건강주택 ‘올라이프케어 하우스(All Life-care House)’의 실증시설을 기술연구원에 구축했다. GS건설은 원격의료 솔루션 기업 ‘솔닥(SOLDOC)’과 제휴를 맺어 통합서비스... 
2026-04-08,네이버뉴스,휴전 소식에 줄줄이 '상한가' 직행…'종전 수혜주' 뭐길래,https://www.hankyung.com/article/2026040879051,중동 건설 경험이 많은 현대건설(21.04%)과 삼성물산(12.77%)에도 투자자의 매수세가 몰렸다. 과거 이란 현지 프로젝트를 수행한 DL이앤씨도 전일 대비 25.93% 오른 9만5200원에 장을 마감했다. 반도체주도 일제히... 
2026-04-08,네이버뉴스,"[현장]응찰→2차 현설 '단독 참여'...삼성물산, 압구정4구역 수의계약 전...",http://www.popcornnews.net/news/articleView.html?idxno=117843,사업 초반에는 현대건설의 브랜드타운화가 점쳐지기도 했다. 그러나 삼성물산이 입찰을 공식화하고 책임준공확약서를 제출하는 등 적극 행보를 보이면서 시공권 획득 가능성은 삼성물산 쪽으로 기울었다. 현대건설은... 
2026-04-08,네이버뉴스,"[100세 트렌드] '노후의 집'이 바뀐다…시니어 레지던스, 부동산 시장 새...",https://www.newsquest.co.kr/news/articleView.html?idxno=264430,"현대건설은 은평구에서 시니어 레지던스를 추진 중이고, HDC현대산업개발은 노원구 서울원 복합단지 안에 웰니스 레지던스를 공급할 계획이다. 과거 수도권 외곽이나 지방 중심으로 거론되던 시니어 주거가 이제는 서울... "
2026-04-08,네이버뉴스,"건설업계, AI·금융·안전 혁신으로 체질 전환 가속",https://www.seoultimes.news/news/article.html?no=2000094953,"현대건설, AI 건설장비 도입…현장 안전관리 고도화 GS건설, 금융 협력 기반 데이터센터 투자 확대 포스코이앤씨, 작업중지권 중심 자율 안전문화 구축 주거·인재·연구까지…건설·연관 산업 경쟁력 강화 [서울타임즈뉴스... "
2026-04-08,네이버뉴스,"현대건설, AI 기반 안전기술 탑재한 굴착기 현장 투입",https://www.getnews.co.kr/news/articleView.html?idxno=867322,현대건설이 건설현장 안전관리 체계를 고도화하고자 인공지능(AI) 탑재 건설장비 도입에 본격화 한다. 이 건설사는 이달 7일 HD건설기계와 '건설기계 스마트 안전기술 공동 개발 및 적용을 위한 업무협약'을 맺었다고 8일... 
