date,source,title,link,description
2026-04-27,네이버뉴스,"코스피, 6560선까지 올라 사상 최고치 또 경신…SK스퀘어·하닉 5%↑",https://www.dt.co.kr/article/12059594?ref=naver,"이번주 국내 증시는 미국-이란 휴전 협상, 4월 FOMC 이후 파월 의장 기자회견, MS·메타·아마존 등 미국 M7 실적, 현대건설과 두산에너빌리티, 삼성SDI 등 국내 주력 업종 실적 이벤트를 치를 예정이다. 키움증권은... "
2026-04-27,네이버뉴스,"기술력 vs 자본력···세아·포스코·현대제철, SMR '소재 전쟁'",https://www.newsfreezone.co.kr/news/articleView.html?idxno=687002,"포스코그룹의 포스코이앤씨나 현대차그룹의 현대건설이 원전 수주를 따내면, 그 건물에 들어가는 핵심 철강재를 같은 그룹 내 소재사인 현대제철이나 포스코 제품으로 채우는 식의 '팀워크'가 가능하다는 것이 업계... "
2026-04-27,네이버뉴스,"경콘진, 최대 1억4000만원 지원…콘텐츠 기업 25곳 모집",http://www.bizwnews.com/news/articleView.html?idxno=135026,"특히 현대건설, CJ ENM, YG엔터테인먼트 등과 협업하는 프로그램을 통해 중소기업의 사업화 기회를 확대한다. 유통 지원은 글로벌 진출과 기존 참여 기업 성장, 신규 콘텐츠 발굴 등으로 구성되며 해외 전시 참가와 성과... "
2026-04-27,네이버뉴스,"건설사 1Q 실적, 원가율이 가른 '희비'",https://www.ebn.co.kr/news/articleView.html?idxno=1706680,"반면 현대건설과 대우건설은 주택 착공 감소와 일부 프로젝트 매출 공백, 비용 부담이 겹치며 전년 대비 부진한 흐름을 보일 가능성이 제기된다. ◆주택시장 회복 지연 속 건설사별 비용 통제 역량 부각 이번 실적의... "
2026-04-27,네이버뉴스,"현대건설, 압구정 재건축에 입주민 전용 '수요응답형 교통' 도입",https://www.pointdaily.co.kr/news/articleView.html?idxno=302877,"사진=현대건설  현대건설이 서울 강남구 재건축 사업지인 압구정 2·3·5구역을 하나로 묶는 입주민 전용 수요응답형 교통(DRT) 서비스를 추진한다. 현재 5구역은 DL이앤씨와 경쟁 중이다. 27일 현대건설은 ""압구정 현대는... "
2026-04-27,네이버뉴스,"건설기술인협회 기계기술인회, PPI 배수시험타워 현장견학 실시",http://www.kmecnews.co.kr/news/articleView.html?idxno=46806,"주요 납품 및 설계 반영 실적으로는 포스코이앤씨(전주서신더샵비발디, 더샵광양레이크센텀, 더샵속초프라임뷰), 현대건설(힐스테이트동탄역센트릭), 한화건설(한화포레나충주호암), 계룡건설산업(엘리프미아)... "
2026-04-27,네이버뉴스,"경콘진, 2026 문화기술 콘텐츠 기업 '제작부터 유통까지' 토탈 지원",https://www.m-i.kr/news/articleView.html?idxno=1367846,특히 '대기업 협업형'은 현대퓨처넷·현대건설·CJ ENM·YG엔터테인먼트·스튜디오리얼라이브 등 국내 정상급 파트너사 5개 사가 참여해 중소기업과 공동 과제를 수행한다. 이를 통해 중소기업은 대기업의 인프라를 직접... 
2026-04-27,네이버뉴스,"AI 공간정보 플랫폼 ​​​​​​​ '메이사', 신세계건설 전국 모든 건...",https://www.aitimes.kr/news/articleView.html?idxno=39769,"현대건설, 대우건설, DL이앤씨, 우미건설, IPARK현대산업개발 등 국내 주요 건설사가 메이사를 채택한 것도 같은 맥락이다. 메이사는 드론·위성·CCTV·IoT 등 다계층 공간 데이터를 통합해 현장의 '단일 진실 공급원(Single... "
2026-04-27,네이버뉴스,"[굿모닝 증시]""전쟁도, FOMC도 아니다…국내 증시 향방 가를 주요 변수는...",https://view.asiae.co.kr/article/2026042708275702335,"한화에어로스페이스, 현대건설, 두산에너빌리티 등 국내 방산·조선 업종의 실적이 몰려 있다. 이 외에도 지난 24일 인텔의 주가가 20%대 폭등하면서 중앙처리장치(CPU) 시장의 성장 내러티브가 확산한 가운데 실적... "
2026-04-27,네이버뉴스,"“더 간다? 숨 고른다?”…이번주 코스피, 미 FOMC·빅테크 실적이 가른...",https://www.mk.co.kr/article/12027873,"국내에선 28일 삼성SDI·현대건설·HD현대일렉트릭, 30일 삼성전기·LG에너지솔루션·한화에어로스페이스 등이 1분기 실적을 공개할 예정이다. 해외에선 27일 버라이즌, 28일 비자, 29일 알파벳(구글)·메타... "
2026-04-27,네이버뉴스,"'예전 개미 아니다'…6천피 시대 동학개미, 수익률로 외국인 눌렀다",https://news.einfomax.co.kr/news/articleView.html?idxno=4411758,"이 외에도 인공지능(AI)발 전력 수요 기대가 반영된 LS일렉트릭과 중동 내 재건 기대감이 부각된 현대건설, 에코프로가 신규 종목(5.0%)에 이름을 올렸다. 반면 'WON K-글로벌수급상위' ETF는 지난달 말 기준 관광과... "
2026-04-27,네이버뉴스,"[AI 주거혁신] ①""AI가 현장을 바꾼다""…건설사들, 시공 넘어 데이터 경...",http://www.hansbiz.co.kr/news/articleView.html?idxno=835149,"현대건설은 로봇과 헬스케어, 모듈러 공법 등을 결합해 설계부터 시공, 주거 단계까지 아우르는 기술 적용을 추진 중이다. 대우건설은 드론과 BIM, AI 기반 솔루션을 통해 공정·품질 관리 체계를 데이터 중심으로 전환하는... "
2026-04-27,네이버뉴스,"[오늘의 투자전략] 코스피, 6600선 뚫을까⋯한화에어로ㆍ현대건설ㆍ두산...",https://www.etoday.co.kr/news/view/2579296,"국내 증시에서도 한화에어로스페이스, 현대건설, 두산에너빌리티, 삼성전기, 삼성SDI 등 방산, 건설, 원전, MLCC, ESS 등 최근 국내 주도주들의 실적이 몰려 있다. 지난주 인텔의 주가 20%대 폭등 이후 CPU 시장 성장... "
2026-04-27,네이버뉴스,이란 노이즈 속 '슈퍼위크' 돌입…코스피 상승 이어가나[뉴스새벽배송],http://www.edaily.co.kr/news/newspath.asp?newsid=01377606645420384,"사진=로이터 슈퍼위크 돌입에 코스피 상승 전망 -키움증권은 이번 주 코스피에 대해 △미·이란 휴전 협상 진행 과정 △4월 FOMC 이후 파월 의장 기자회견 △MS, 메타, 아마존, 알파벳 등 미국 M7 실적, △현대건설... "
2026-04-27,네이버뉴스,"콘텐츠는 만들고 끝이 아니다…경콘진, ‘제작부터 유통까지’ 전주기...",https://www.venturesquare.net/1078476/,-총 15억8천만원 투입… 제작 15개·유통 10개 기업 모집 -현대건설·YG 등 대기업 협업… 글로벌 판로까지 연계 2026 문화기술 콘텐츠 제작지원 기업 모집 포스터 (자료 제공: 경기도콘텐츠진흥원) 콘텐츠 지원이 ‘제작’... 
2026-04-27,네이버뉴스,개포·반포 이어 압구정서도…7년 연속 1위 현대건설 뜬다,https://www.sedaily.com/article/20037327?ref=naver,"내년 창립 80주년을 맞는 현대건설(000720)은 전후 복구사업을 시작으로 토목, 플랜트, 에너지, 주택 등 모든 건설 분야에서 경쟁력을 쌓아왔다. 특히 ‘힐스테이트’에 이어 하이엔드 브랜드 ‘디에이치’까지 높은... "
2026-04-27,네이버뉴스,압구정5구역 시공사 선정 재개…현대·DL 승부 가를 관전포인트는,https://daily.hankooki.com/news/articleView.html?idxno=1361500,사진=카카오맵 로드뷰 캡처 불법 '도촬' 논란으로 시공사 선정 중단 위기에 몰렸던 서울 강남구 압구정5구역 재건축사업의 시공사 입찰이 재개되며 현대건설과 DL이앤씨의 정면 승부가 시작됐다. 금융 조건과 상품... 
2026-04-27,네이버뉴스,"GS건설, 주말에만 3조 수주... 도시정비 수주전 ‘요동’",https://www.sedaily.com/article/20037307?ref=naver,현대건설(000720)의 경우 현재 확정 수주액이 1조 865억 원에 그치지만 단일 공사비만 5조 5610억 원에 달하는 압구정3구역의 우선협상대상자로 선정된 상태다. 현대건설은 공사비 1조 4960억 원 규모의 압구정5구역에서도... 
2026-04-27,네이버뉴스,대형 건설사 압구정·성수 찍고 목동으로 …시공사 선정 줄줄이 대기,http://www.queen.co.kr/news/articleView.html?idxno=455799,"26일 정비업계에 따르면 현대건설은 올해 서울 목동에 하이엔드 브랜드 '디에이치(THE H)' 라운지를 조성하고 조합원 대상 브랜드 홍보와 접점 확대에 나섰다. 목동 재건축 사업은 14개 단지, 약 2만6000가구 규모에 달하는... "
2026-04-27,네이버뉴스,"경기콘텐츠진흥원, 문화기술 콘텐츠 제작·유통 지원 기업 모집…현대건...",https://platum.kr/archives/285850,대기업 협업형에는 현대퓨처넷·현대건설·CJ ENM·YG엔터테인먼트·스튜디오리얼라이브 등 5개사가 파트너로 참여해 중소기업과 공동 과제를 수행한다. 자유형은 기업이 제작 방식과 실증 계획을 자율적으로 제안할 수... 
2026-04-27,네이버뉴스,서울 아파트 갱신계약 비율 47%…갱신청구권 사용은 되레 감소,https://www.sedaily.com/article/20037316?ref=naver,“압구정 3·5구역도 수주 목표…현대 헤리티지 확장” - 핵심 요약: 현대건설(000720)이 총 공사비 5조 5610억 원 규모의 압구정 3구역 수주에 사실상 성공하며 지난해 수주액의 절반가량을 이미 확보했다. 현대건설은... 
2026-04-27,네이버뉴스,"[건설 재무 경고등①] 단기차입 부담 커졌지만, 현금 방어력은 ‘제각각...",https://www.dailian.co.kr/news/view/1632092/?sc=Naver,"현대건설은 단기차입금이 1조원대로 확대됐지만 작년 현금 및 현금성 자산이 4조8126억원에 달했고, 유동비율도 147.9%를 기록했다. 포스코이앤씨 역시 단기차입금이 2023년 4779억원에서 지난해 6792억원으로... "
2026-04-27,네이버뉴스,압구정·성수 찍고 목동으로…대형 건설사 수주전 이동,https://www.news1.kr/realestate/general/6148447,"목동 선점 경쟁…라운지 열고 '표심 공략' 26일 정비업계에 따르면 현대건설(000720)은 올해 서울 목동에 디에이치(THE H) 라운지를 조성하고 조합원 대상 브랜드 홍보에 나섰다. 목동 재건축은 14개 단지, 약 2만 6000가구... "
2026-04-27,네이버뉴스,"1분기 공공공사 수주, 현대건설 4325억 원 '톱'...남광토건·KCC건설 뒤이...",http://www.consumernews.co.kr/news/articleView.html?idxno=754726,올 1분기 공공공사 시장에서 현대건설(대표 이한우)이 4000억 원 이상을 수주하며 1위를 차지했다. 남광토건(대표 김종수·이동철)과 KCC건설(대표 정몽열·심광주)도 각각 3000억 원 이상을 수주하며 상위권에 이름을... 
2026-04-27,네이버뉴스,[업체탐방] 고부가 산업설비 전문 시공기업 '대아이앤씨',http://www.kmecnews.co.kr/news/articleView.html?idxno=46659,"해외에서는 현대건설이 수행한 '쿠웨이트 KALM LNG TANK PKG3 공사'에 참여했고, 경북 포항에서는 포스코이앤씨의 '포항3 FINEX 합리화 기계공사' 등을 시공했다. 울산 샤힌프로젝트에서 대아이앤씨가 담당한 기계배관공사 시공... "
2026-04-27,네이버뉴스,중동발 공사비 급등 우려…고통분담 요구된다,http://www.kmecnews.co.kr/news/articleView.html?idxno=46758,현재 현대건설이 지난달 서울 은평구 대조1구역 주택재개발 정비사업조합에 공사비 원가 상승과 공기지연 가능성을 알리는 공문을 보냈다. 포스코이앤씨도 최근 일부 사업장 시행사에 공기 지연과 원가 상승 리스크를 담은... 
2026-04-27,네이버뉴스,[이번주 시공사 현장설명회 스케줄(2026.4.27~5.1)],https://www.sisaon.co.kr/news/articleView.html?idxno=200574,"입찰은 오는 6월 15일 오후 2시 마감되며 현대건설과 DL이앤씨, 롯데건설 등 여러 대형 건설사들이 참여 의지를 보이고 있는 것으로 알려졌다. 방배7구역 재건축 조합도 같은날 현설을 연다. 서울 서초구 방배동... "
2026-04-27,네이버뉴스,[프료젝트 X파일]반년째 멈춘 강동하남남양주선 2ㆍ5공구 입찰절차,https://www.dnews.co.kr/uhtml/view.jsp?idxno=202604261709564170675,같은 해 7월 이뤄진 첫 입찰공고는 현대건설 팀만 참여해 유찰됐고 이후 재공고와 2차 재공고에서도 같은 일이 반복됐다. 5공구는 같은 해 10월23일 재공고의 PQ 서류 접수를 끝으로 절차가 멈췄다. 첫 입찰공고는 참여사가... 
2026-04-27,네이버뉴스,'8700兆 데이터센터' K건설 새 시장 연다,https://www.mt.co.kr/estate/2026/04/27/2026042619542076130,"현대건설은 2004년 금융결제원 분당센터를 시작으로 KT 목동 IDC(인터넷데이터센터), 네이버 데이터센터 '각 세종' 등 주요 프로젝트를 수행하며 국내 최다 수준의 데이터센터 시공실적을 보유했다. 이를 기반으로 친환경... "
2026-04-27,네이버뉴스,‘전방위 불장’… 반도체 이어 건설·원전·조선·2차전지도,https://www.kmib.co.kr/article/view.asp?arcid=1777191477&code=11151200&cp=nv,"같은 기간 DL이앤씨는 140.58%(4만1150→9만9000원), 현대건설 146.79%(7만100→17만3000원), GS건설 106.85%(1만9700→4만750원) 등 대형 건설주가 전반적으로 올랐다. 중동 지역 인프라 재건, 플랜트 수주, 차세대 원전... "
2026-04-27,네이버뉴스,"[DQN] 1위 차지한 대우건설, 사업장·가구수 모두 압도적 [이지역 분양왕...",http://www.fntimes.com/html/view.php?ud=2026042600330389dd55077bc2_18,"현대건설, 광명 대단지 효과로 6432가구…실적 2위 시공능력평가 2위 현대건설은 경기도에서 4개 단지를 시공하며 총 6432가구를 기록해 2위에 올랐다. 단독 사업으로는 과천 주암동 ‘디에이치아델스타’ 880가구, 용인... "
2026-04-26,네이버뉴스,삼성물산·GS건설·한화 원청 사용자성 인정,https://m.skyedaily.com/news_view.html?ID=303106,"또한 지난 23일, 현대건설, 롯데건설, HDC현대산업개발에 대한 공고문 미이행에 대한 시정신청도 접수한 상태다. 건설노조는 시공능력평가 순위 상위 종합건설사에 대한 원청 사용자성이 모두 인정된 만큼 더 이상의... "
2026-04-26,네이버뉴스,반여동 풍경 바뀐다…‘왕자’ 등 대규모 정비사업 속도,http://www.kookje.co.kr/news2011/asp/newsbody.asp?code=0200&key=20260427.22002007313,"이곳은 현대건설이 시공을 맡아 지하 3층~최고 35층, 7개 동 813세대 규모의 ‘힐스테이트 루센츠’로 재건축될 예정이다. 현재 반여동 일대에선 반여3-1구역뿐만 아니라 여러 정비사업이 동시다발적으로 추진되고 있다.... "
2026-04-26,네이버뉴스,“압구정 3·5구역도 수주 목표…현대 헤리티지 확장”,https://www.sedaily.com/article/20037269?ref=naver,“2구역에 이어 3·5구역도 수주해 ‘압구정 현대’의 헤리티지(유산)를 확장하고 책임있게 완성해 나가겠습니다.” 신국현 현대건설(000720) 도시미래가치사업1실장(상무)은 최근 서울경제신문과 만나 “압구정... 
2026-04-26,네이버뉴스,개포·반포 이어 압구정서도…랜드마크 ‘디에이치’ 뜬다,https://www.sedaily.com/article/20037267?ref=naver,"내년 창립 80주년을 맞는 현대건설(000720)은 전후 복구사업을 시작으로 토목, 플랜트, 에너지, 주택 등 모든 건설 분야에서 경쟁력을 쌓아왔다. 특히 ‘힐스테이트’에 이어 하이엔드 브랜드 ‘디에이치’까지 높은... "
2026-04-26,네이버뉴스,"GH, '노사관계 우수기업' 최초 인증 및 '남·북부 산단 안전 네트워크' ...",https://www.cstimes.com/news/articleView.html?idxno=703385,"현대엔지니어링 건설안전 체험교육장에서 열린 이번 프로그램은 △고소작업 및 추락, 가상현실(VR) 사고 체험 △감전 사고 시뮬레이션 △응급처치 교육 등 실제 현장에서 발생할 수 있는 다양한 위험 상황을 경험하도록... "
2026-04-26,네이버뉴스,GS ‘4조 돌파’ 선두로…대우도 2.2조 추격전,https://www.sedaily.com/article/20037259?ref=naver,"GS건설이 도시정비사업 레이스에서 선두를 달리고 있지만 대우건설과 현대건설, 삼성물산도 뒤를 바짝 추격 중이다. 대우건설은 올 1분기 총 5개 사업지에서 2조 2525억 원의 수주액을 기록한 가운데 신대방역세권... "
2026-04-26,네이버뉴스,스마트 개미가 탐낼 실적 유망주는 '에너지·건설·AI',https://www.hankyung.com/article/2026042673851,"이란 전쟁 종전 가능성이 제기되자 DL이앤씨(6만1278원→10만3824원), GS건설(2만7389원→4만2347원), 현대건설(15만556원→21만1056원) 등도 목표주가가 올랐다. 전후 에너지 시설 재건 수요가 늘면서 해외 수주가 잇따를... "
2026-04-26,네이버뉴스,"GS건설, 서울 성동구 성수1지구 재개발 시공",https://www.newsworks.co.kr/news/articleView.html?idxno=839022,"당초 지난해 8월 현대건설·GS건설·HDC현대산업개발이 관심을 보이며 3파전 구도가 예상됐으나, 입찰 지침 불공정 논란이 불거지며 1차 입찰이 취소됐다. 조합이 60여 개 항목에서 특정 제품을 지정해 GS건설에 유리한... "
2026-04-26,네이버뉴스,'삼전' 다음으로 많이 샀다…외국인 1조 베팅한 'K굴뚝주',https://www.hankyung.com/article/2026042675001,현대자동차그룹은 중동 재건 수혜주인 현대건설 주가가 올해 147% 급등하면서 ‘시총 300조원 시대’를 열었다. 전문가들은 이 같은 변화를 ‘한국 제조 포트폴리오의 재발견’으로 평가한다. 조수홍 NH투자증권... 
2026-04-26,네이버뉴스,"나승희 미국 한인나눔운동 대표 ""어떻게 찾아올지 모르는 통일에 대비해...",https://www.kado.net/news/articleView.html?idxno=2046870,"강릉여고 상과반을 졸업하고 현대건설주식회사에서 고졸 사원으로 일을 시작한 이후 세계은행 입행이라는 꿈을 이룰 때까지의 과정도 들려줬다. 한국투자금융주식회사, 하얏트 호텔 등을 거쳐 혈혈단신으로 미국... "
2026-04-26,네이버뉴스,"현대차그룹, 로봇·방산 앞세워 시총 300조 고지",https://www.hankyung.com/article/2026042674411,원전 건설 수혜주로 꼽히는 현대건설은 이 기간 시총이 4배 증가해 19조2645억원을 기록했다. 반면 이노션(-32.47%)과 현대제철(-25.44%) 시총은 큰 폭으로 감소했다. 현대차와 기아의 지난 1분기 실적은 만족스럽지... 
2026-04-26,네이버뉴스,“아파트 이름 줄여라”…재건축 단지명 ‘다이어트’ 바람,https://www.dt.co.kr/article/12059537?ref=naver,"26일 정비업계에 따르면 현대건설은 최근 진행한 압구정3구역 재건축 입찰 단지명으로 ‘압구정 현대’를 제안했다. 압구정 현대 뒤에 별도 영문 수식어를 덧붙이는 방법도 있지만, 이를 배제한 것이다. 현대건설이 조합원... "
2026-04-26,네이버뉴스,"[증시 주간 전망대] 6500대 안착 기대감↑…""실적 주도 장세 지속""",http://www.seoulwire.com/news/articleView.html?idxno=718732,"전쟁 중에도 반도체와 금융주 등의 실적이 어닝서프라이즈를 기록 중인 가운데 29일에 집중된 AI 빅테크 기업(아마존, 마이크로소프트, 구글, 메타)들 실적 발표 및 삼성SDI·현대건설·HD현대일렉트릭(28일), 삼성전기... "
2026-04-26,네이버뉴스,"""층간소음 잡아라""…건설업계, 소음저감 신기술 경쟁 가열",https://daily.hankooki.com/news/articleView.html?idxno=1361471,"현대건설은 지난해 공급한 '힐스테이트 회룡역 파크뷰'에 슬래브 두께를 240mm로 강화한 'H 사일런트 홈 시스템 I'을 적용했으며, 기존 시스템에서 업그레이드한 'H 사일런트 홈 시스템Ⅱ'를 '디에이치 대치 에델루이'에... "
2026-04-26,네이버뉴스,[디벨로퍼 인사이드] “매출 0원에 부채 2.5조”… 인창개발 고레버리지...,https://www.viva100.com/article/20260422501173,"가양동 본PF 대주단에는 한국산업은행·신한은행·IBK캐피탈 등 주요 금융기관이 참여했고, 시공사 현대건설은 책임준공의무와 자금보충의무, 조건부 채무인수 약정을 부담하고 있다. 약정서에는 인창개발이 기한이익을... "
2026-04-26,네이버뉴스,"[마켓 ING]다시 사상 최고치 랠리 나선 코스피, 빅테크 실적·FOMC 주목",https://view.asiae.co.kr/article/2026042613281219843,"(구글)·메타·마이크로소프트(MS)·아마존, 30일 애플·일라이릴리 등이 실적을 공개한다. 국내는 28일 삼성SDI·현대건설·HD현대일렉트릭, 30일 삼성전기·LG에너지솔루션·한화에어로스페이스 등이 1분기 실적을 발표한다."
2026-04-26,네이버뉴스,중동발 원자재 수급난에 전국 건설현장 셧다운 위기,https://www.asiatime.co.kr/article/20260426500114,현대건설은 서울 송파구 마천4구역 재개발 조합을 상대로 공사비 2899억원 증액을 요구했고 은평구 대조1구역과 강서구 등촌1구역 등에도 공기 연장과 공사비 증액 가능성을 언급한 공문을 발송했다. 아울러... 
2026-04-26,네이버뉴스,8700조 시장 열린다…'AI 호황' 반도체 이어 들썩이는 이 업계,https://www.mt.co.kr/estate/2026/04/27/2026042214293441459,"현대건설은 2004년 금융결제원 분당센터를 시작으로 KT목동 IDC, 네이버 데이터센터 '각 세종' 등 주요 프로젝트를 수행하며 국내 최다 수준의 데이터센터 시공 실적을 보유하고 있다. 이를 기반으로 향후에는 친환경 전력... "
2026-04-26,네이버뉴스,"타타대우 중형트럭 하이쎈 보니...""전기트럭도 개발 중"" [카미경]",https://www.bloter.net/news/articleView.html?idxno=660467,하이쎈에는 240마력의 HD현대건설기계 HCE DX05 엔진과 235마력의 커민스 F4.5 엔진을 적용했다. 변속기는 ZF 8단 전자동변속기와 앨리슨 9단 전자동변속기를 선택할 수 있다. 다단화된 기어비를 통해 연비 효율을 높이고... 
2026-04-26,네이버뉴스,[기획] 에너지·재건 기대감에 건설주 강세 지속…향후 전망은?,https://www.m-i.kr/news/articleView.html?idxno=1367747,"이날 기준 최근 3개월간 GS건설과 삼성E&A, 현대건설 등이 두 자릿수 상승률을 기록한 가운데, 특히 대우건설은 600%이상 급등했다. 시장에서는 그동안 부동산 경기 침체로 저평가돼 있던 건설주가 해외 수주 기대를 바탕으로... "
2026-04-26,네이버뉴스,[인터뷰] 우즈만 페르미 뉴클리어 대표 “한국 원전 업계의 강점은 기술...,https://biz.chosun.com/industry/company/2026/04/26/VAS7CJ4TG5CP3L4DALK5GIRQ4Q/?utm_source=naver&utm_medium=original&utm_campaign=biz,"바라카 원전은 한국전력공사가 한국수력원자력, 현대건설, 삼성물산, 두산에너빌리티 등을 포함한 ‘팀 코리아’를 이끌고 2009년 12월 수주한 해외 원전 1호 사업이다. 총용량은 5600메가와트(MW)로 총 4호기로 구성돼... "
2026-04-26,네이버뉴스,"페르미 대표 “韓 기업의 책임감 있는 직업윤리, 美로 가져오고 싶다”",https://www.chosun.com/economy/industry-company/2026/04/26/4QTIIAPZDREYFJISZPSZQDBBSA/?utm_source=naver&utm_medium=referral&utm_campaign=naver-news,현대건설과 두산에너빌리티 등 국내 기업도 원전 설계와 주요 기자재 분야에서 협업하고 있다. 우즈만 대표는 한국이 원전을 중단 없이 건설해온 점도 강점으로 꼽았다. 미국과 유럽은 신규 원전 건설이 끊기며 현장... 
2026-04-26,네이버뉴스,"건설업계, 신사업 속도",https://www.m-i.kr/news/articleView.html?idxno=1367734,현대건설이 웨스팅하우스와 추진 중인 대형원전 AP1000 노형 조감도. 사진=현대건설 제공 매일일보 = 윤하늘 기자  |  국내 건설사들이 주택·토목 중심에서 벗어나 에너지·인공지능(AI) 등 신사업 확장에 속도를 내고... 
2026-04-26,네이버뉴스,"[기획] ""주택 대신 에너지""…건설업계, 중동 재건 수혜 입을까",https://www.m-i.kr/news/articleView.html?idxno=1367719,사진=현대건설 제공 매일일보 = 이혜경 기자  |  국내 건설사들이 중동 전쟁 종전 이후 인프라 재건 사업으로 수혜를 입을 것이란 기대감이 나오며 업계의 관심이 쏠리고 있다. 핵심 설비가 잇따라 파괴되면서 대규모 재건... 
2026-04-26,네이버뉴스,"“이명박 잘 나간다더니 끝났군”…기피부서 발령, MB 인사 반전 [이명...",https://www.joongang.co.kr/article/25423345,태국 빠따니-나라티왓 고속도로 준공 과정에서 큰 공을 세우면서 이름을 알린 나에게 뜻밖에도 현대건설 중기(重機)사업소 관리과장이라는 직책이 주어졌기 때문이다. 순간 뒤통수를 얻어맞은 기분이었다.... 
