date,source,title,link,description
2026-04-14,네이버뉴스,"광주광역시, 전국 최초 자체 발전 에너지로 수돗물 생산한다",https://www.dailysportshankook.co.kr/news/articleView.html?idxno=427428,"이는 지난해 10월17일 상수도사업본부가 전력효율을 높이기 위해 빛고을시민햇빛발전 사회적협동조합, 현대건설과 함께 체결한 '용연정수장 유휴부지를 활용한 태양광 직접 PPA 발전 협약'으로 이뤄졌다. 협약에 따라... "
2026-04-14,네이버뉴스,"광주시, 태양광으로 수돗물 만든다…전국 첫 '직접 PPA' 도입",https://www.namdonews.com/news/articleView.html?idxno=907389,"이번 사업은 지난해 10월 상수도사업본부와 빛고을시민햇빛발전 사회적협동조합, 현대건설이 체결한 '용연정수장 유휴부지를 활용한 태양광 직접 PPA 발전 협약'에서 출발했다. 세 기관은 오는 2035년까지 10년간... "
2026-04-14,네이버뉴스,"광주시, 태양광 전기로 수돗물 생산…전국 첫 탄소중립 상수도 모델",https://www.viva100.com/article/20260414500169,"이번 사업은 빛고을시민햇빛발전 사회적협동조합, 현대건설과의 협약을 바탕으로 추진됐다. 협동조합은 3억4000만 원을 들여 1442㎡ 부지에 발전소를 설치·운영하고, 상수도사업본부는 부지를 제공하며 생산 전력을... "
2026-04-14,네이버뉴스,"대전시, 지역업체 하도급 참여율 ‘양호’",https://biz.heraldcorp.com/article/10716460?ref=naver,주요 실적으로는 ▷선화3차 주상복합(코오롱글로벌) 364억원 ▷KT인재개발원 공동주택(계룡건설) 172억원 ▷도안2지구 2블럭 공동주택(현대건설) 186억원 ▷도룡동 주상복합(GS건설) 107억원 등 주요 현장을 중심으로... 
2026-04-14,네이버뉴스,8000억 적자에도 주가 5배 뛴 대우건설…원전 수주로 얼마나 더 오르나,https://realty.chosun.com/site/data/html_dir/2026/04/14/2026041400978.html,"과거 시공을 담당했던 건설사가 재건 수주를 받을 확률이 높은 만큼, 삼성E&A(과거 시공 7개)를 필두로 현대건설, 대우건설, GS건설, DL이앤씨(각 2개) 등의 수혜가 예상된다. 재건 수주는 전쟁이 완전히 종료된 후 1~2년 뒤... "
2026-04-14,네이버뉴스,태양광 활용해 수돗물 생산…광주상수도본부 직접전력거래 구축,https://www.newsis.com/view/NISX20260414_0003589904,"광주상수도사업본부는 태양광 에너지를 활용해 수돗물을 생산하기 위해 지난해 10월17일 빛고을시민햇빛발전 사회적협동조합, 현대건설 등과 ' ‘용연정수장 유휴부지를 활용한 태양광 직접PPA 발전 협약'을 맺었다.... "
2026-04-14,네이버뉴스,"대전, 건설 침체 속 ‘지역 하도급 확대’…1분기 2.7조 수주",https://cc.newdaily.co.kr/site/data/html/2026/04/14/2026041400036.html,주요 실적으로는 △선화3차 주상복합(코오롱글로벌) 364억 원 △KT인재개발원 공동주택(계룡건설) 172억 원 △도안2지구 2블럭 공동주택(현대건설) 186억 원 △도룡동 주상복합(GS건설) 107억 원 등 대형 현장을 중심으로... 
2026-04-14,네이버뉴스,"[뉴스+]""살아남고 봐야된다""…건설업계, 인력 감축·선별 수주 '위기경영...",https://www.businessplus.kr/news/articleView.html?idxno=110561,"현대건설은 최근 서울 은평구 대조1구역 재개발, 송파구 마천4구역 재개발, 강서구 등촌1구역 재건축 조합 등에 공사비 증액을 요청하는 공문을 보냈다. 공사비를 올려주지 않으면 공사를 중단하거나 지연할 수밖에 없다는... "
2026-04-14,네이버뉴스,"광주시, 자체 발전 태양광 에너지로 수돗물 생산…전국 최초",https://www.news1.kr/local/gwangju-jeonnam/6135347,"이는 지난해 10월 17일 상수도사업본부가 전력효율을 높이기 위해 빛고을시민햇빛발전 사회적협동조합, 현대건설과 함께 체결한 '용연정수장 유휴부지를 활용한 태양광 직접 PPA 발전 협약'으로 이뤄졌다. 협약에 따라... "
2026-04-14,네이버뉴스,"대전시 ""1분기 지역업체 하도급 2조 7120억원 수주""",http://www.fnnews.com/news/202604140838021738,주요 실적별로는 △선화3차 주상복합(코오롱글로벌) 364억 원 △KT인재개발원 공동주택(계룡건설) 172억 원 △도안2지구 2블럭 공동주택(현대건설) 186억 원 △도룡동 주상복합(GS건설) 107억 원 등 주요 현장을 중심으로... 
2026-04-14,네이버뉴스,"중동전쟁 와중에 삼성E&A·현대·GS·대우건설, 쿠웨이트 LNG 프로젝트 입...",https://www.theguru.co.kr/news/article.html?no=100512,"삼성E&A, 현대건설, GS건설, 대우건설 등이 물망에 오른다. 14일 쿠웨이트 현지 매체에 따르면 쿠웨이트 공공입찰중앙청(CAPT)은 국영 석유회사 KIPIC가 신청한 알주르 LNG 터미널 내 LNG 재액화 설비 사업의 시행을 위한... "
2026-04-14,네이버뉴스,대전 지역업체 하도급 1분기 2조 7120억원 수주,https://www.sedaily.com/article/20032062?ref=naver,주요 실적으로는 △선화3차 주상복합(코오롱글로벌) 364억 원 △KT인재개발원 공동주택(계룡건설) 172억 원 △도안2지구 2블럭 공동주택(현대건설) 186억 원 △도룡동 주상복합(GS건설) 107억 원 등 주요 현장을 중심으로... 
2026-04-14,네이버뉴스,"포스코이앤씨, 반포서 ‘잭팟’…삼성물산과 수주전 판세 흔드나",https://www.smarttoday.co.kr/ko-kr/articles/106454,"삼성물산은 시공능력평가 12년 연속 1위에, 지난해 도시정비사업 수주액 9조 원 이상을 기록하며 현대건설과 양강체제를 굳히고 있다. 신반포 19·25차 통합재건축 포스코이앤씨 조감도 반면 포스코이앤씨는 이번... "
2026-04-14,네이버뉴스,"KB證 “건설주, 글로벌 에너지 인프라 위 재평가…현대건설·삼성E&A·DL...",https://www.etoday.co.kr/news/view/2575398,"최선호주로는 현대건설과 삼성E&A를, 관심주로는 DL이앤씨를 제시했다. 장문준 KB증권 연구원은 14일 “현재 건설업종 주가를 설명하는 핵심 변수는 더 이상 국내 주택이 아니다”라며 “원전, 가스·액화천연가스(LNG)... "
2026-04-14,네이버뉴스,"기본급 30개월치 위로금...건설사, 줄줄이 희망퇴직",https://www.sedaily.com/article/20032055?ref=naver,"DL이앤씨가 847명으로 감소 폭이 가장 컸고, GS건설 487명, 대우건설 357명, 현대건설 247명 순이었다. 현대엔지니어링과 포스코이앤씨 등 시공능력 상위권 대형사들도 희망퇴직을 검토하거나 임원 수를 줄이는 등 조직... "
2026-04-14,네이버뉴스,"[리브랜딩 혁신] 'IPARK' 앞세운 이유… 건설사, ""브랜드가 곧 회사""",http://www.seoulwire.com/news/articleView.html?idxno=716562,현대건설은 국민 브랜드인 '힐스테이트'와 함께 하이엔드 브랜드 '디에이치(THE H)'를 통해 강남권과 주요 재건축 시장에서 입지를 강화하고 있다. 특히 디에이치는 세계적인 건축가 협업과 단지별 특화 설계를 앞세워... 
2026-04-14,네이버뉴스,[대전소식]대표음식 전면 개편...빵·칼국수·두부두루치기 외,https://daily.hankooki.com/news/articleView.html?idxno=1357789,주요 실적으로는 △선화3차 주상복합(코오롱글로벌) 364억 원 △KT인재개발원 공동주택(계룡건설) 172억 원 △도안2지구 2블럭 공동주택(현대건설) 186억 원 △도룡동 주상복합(GS건설) 107억 원 등 주요 현장을 중심으로... 
2026-04-14,네이버뉴스,13조원 '큰 장'…핵심 정비사업지 시공사 선정 '분수령' [한강벨트 수주...,https://www.sisaon.co.kr/news/articleView.html?idxno=200173,공사비만 5조5610억원에 달하는 압구정3구역 재건축은 현대건설의 '무혈입성' 가능성이 한층 높아진 분위기다. 지난 10일 마감된 1차 입찰에서 현대건설이 단독으로 참여하면서 유찰됐기 때문이다. 이 사업은 압구정동... 
2026-04-14,네이버뉴스,"롯데건설, 희망퇴직 시행…최대 기본급 30개월치 위로금 지급",https://biz.heraldcorp.com/article/10716379?ref=naver,"곳곳에서 공사비를 둘러싼 갈등이 나타나는 실정이다. 현대건설은 지난달부터 서울 은평구 대조1구역 재개발, 송파구 마천4구역 재개발, 강서구 등촌1구역 재건축 사업의 조합에 공사비 증액을 요구하는 공문을 보냈다."
2026-04-14,네이버뉴스,"하나증권 “건설주, 단기 변동성 심화, 장기 방향성 견고..유가 회복되...",https://kpenews.com/View.aspx?No=4040562,"0%p 상회했다”면서 “지난주 기관과 연기금이 매수, 외인이 매도했는데 기관은 GS건설과 DL이앤씨, 삼성EA를 매수한 반면 현대건설을 매도했고 외인은 대우건설을 매수, 나머지 건설주를 전반적으로 매도했다”고... "
2026-04-14,네이버뉴스,"[더벨][디벨로퍼 리포트] 일레븐건설, 용산 파크사이드 효과에 순익 '쑥...",https://www.thebell.co.kr/free/content/ArticleView.asp?key=202604091352456520101674,"2021년 12월 토지대금을 완납했고, 현대건설이 2023년 2월 착공에 들어가 현재 공사를 진행 중이다. 지난해 7월 '더 파크사이드 서울' 내 하이엔드 오피스텔 '더 파크사이드 스위트' 분양을 진행했다. 청약 접수 결과 총... "
2026-04-14,네이버뉴스,올 1분기 PF 유동화증권 21% 증가…4건 중 1건 현대건설,https://www.dnews.co.kr/uhtml/view.jsp?idxno=202604131308002350993,1분기 PF 유동화증권 18.1조원…건설사 신용보강 7.7조원 현대건설 4조원 신용보강…전체 4건 중 1건 꼴 3월 금융기관 보강 건설사 보강보다더 많아 키움ㆍ삼성ㆍ한투 각각 4000억원씩 제공 [대한경제=권해석 기자]... 
2026-04-14,네이버뉴스,"롯데건설, 장기 근속자에 '최대 30개월치' 희망퇴직",http://www.newsroad.co.kr/news/articleView.html?idxno=57844,"현대건설은 지난달부터 서울 은평구 대조1구역 재개발, 송파구 마천4구역 재개발, 강서구 등촌1구역 재건축 사업 조합에 공사비 증액을 요구하는 공문을 발송했다. 고정된 공사비로는 급등한 원가를 감당하기 어렵다는... "
2026-04-14,네이버뉴스,"""AX 성패, 협력사·데이터·인력에 달렸다"" [삽 대신 AI, 건설업 환골탈...",https://www.etoday.co.kr/news/view/2574399,안계현 현대건설 기반기술연구실장은 “기술을 개발해도 실제 사용하는 주체는 협력사인데 현장의 디지털 기반이 따라오지 못하면 효과를 보기 어렵다”며 “데이터 생산의 한계와 민간 확산을 고려하면 제도와 표준이... 
2026-04-14,네이버뉴스,"'재건 잭팟' 꿈꾸는 저PBR 건설주, 신기루일까 기회일까",https://www.ziksir.com/news/articleView.html?idxno=130575,"DL이앤씨(25.93%), 현대건설(21.04%), 삼성물산(12.77%) 등 대형 건설사들은 두 자릿수 상승률을 보였다. 전쟁으로 파괴된 정유·가스·도로 등 인프라 복구 수요가 주동력이었다. 한국투자증권에 따르면, 급등 당일 코스피... "
2026-04-14,네이버뉴스,“공사를 했는데 손해가 늘어요”…10대 건설사 작년 잠재손실 2조 육박,https://www.sedaily.com/article/20032031?ref=naver,"시공 순위 2·3위인 현대건설과 대우건설은 같은 기간 각각 관련 부채가 528억 원에서 699억 원, 1861억 원에서 3034억 원으로 증가했다. 포스코이앤씨(525억 원→1139억 원)와 SK에코플랜트(817억→4120억 원) 등도... "
2026-04-14,네이버뉴스,재개발ㆍ재건축 공사비 갈등 전국 확산… 지방 정비사업까지 ‘도미노...,https://www.dnews.co.kr/uhtml/view.jsp?idxno=202604131356526700009,13일 업계에 따르면 현대건설은 올해 공사비 갈등의 중심에 서 있다. 미ㆍ이스라엘-이란 무력 충돌 이후 3월 말부터 서울 주요 사업지에 증액 요청이 본격화됐다. 가장 긴박한 현장은 은평구 대조1구역이다. 올해 10월... 
2026-04-14,네이버뉴스,피지컬 AI로 안전 공사장 실현… 대기업 벤처캐피털 덕에 가능했다,https://www.donga.com/news/Economy/article/all/20260414/133731747/2,하지만 대형 투자를 통해 신뢰가 쌓이면서 로보콘은 현대건설 등 대형 건설사와 직접 계약해 솔루션을 제공할 수 있었다. 최근에는 글로벌 시공 능력 10위권의 유럽 대형 건설사 경영진이 방문해 도입 협상을 진행하는... 
2026-04-14,네이버뉴스,[프로젝트 X파일]3기 신도시 광역철도 수주경쟁,https://www.dnews.co.kr/uhtml/view.jsp?idxno=202604131626321100059,"1공구는 참여사가 한개사도 없었고 2공구는 현대건설만, 5공구는 진흥기업만 참여해 유찰됐다. 3공구와 4공구, 6공구 등 3개 공구는 경쟁이 이뤄졌는데 각 공구에는 금광기업, 극동건설, 남광토건 등이 포진해 있다.... "
2026-04-14,네이버뉴스,"DL이앤씨, 서울과 수도권 시공권 갈등…핵심인재 유출·법 위반 논란 확...",https://www.job-post.co.kr/news/articleView.html?idxno=213453,"현대엔지니어링이 6명, 포스코이앤씨 5명, 현대건설 3명, GS건설 3명, 삼성물산 2명, 대우건설 2명, DL이앤씨 2명 순으로 집계됐다. ■ 압구정5구역 조합원 설명회 이후 '마카롱 세트' 등 선물 제공'…법 위반 논란... "
2026-04-14,네이버뉴스,'양효진 주니어' 이야기라니! 마지막 시상식이라 가능했던 '말말말' [V-시...,https://www.mhnse.com/news/articleView.html?idxno=528061,2007-08시즌 신인 1라운드 4순위로 현대건설에 데뷔한 양효진은 올 시즌을 끝으로 19년 간의 '원클럽맨' 생활을 청산하고 현역 은퇴를 선언했다. 양효진은 데뷔 시절부터 눈에 띄는 활약을 펼치며 주전으로 발돋움했고... 
2026-04-14,네이버뉴스,이란 전쟁 덕에 건설사들 대박난다?… ‘장밋빛 전망 경계령’,https://www.kmib.co.kr/article/view.asp?arcid=1776069723&code=11151500&cp=nv,"현대건설을 비롯해 대우건설, GS건설과 DL이앤씨, 삼성E&A 등이 중동에서 존재감이 두드러졌던 기업들이다. 한 건설업체 관계자는 “화학공업이나 에너지 사업 쪽이 타격을 받아 그 분야가 우선될 것”이라고 말했다. 이란... "
2026-04-14,네이버뉴스,"[Biz & Now] 삼표·현대건설, 특수 콘크리트 개발",https://www.joongang.co.kr/article/25419827,삼표산업은 현대건설과 기온 보정 강도 적용 절차 없이 계획된 품질을 확보할 수 있는 ‘간절기 특수 콘크리트’를 개발했다고 13일 밝혔다. 영하에 가까운 외기온도(0℃)에서도 48시간 이내에 5㎫(메가파스칼) 이상의... 
2026-04-13,네이버뉴스,"삼표산업·현대건설, ‘0℃에서도 굳는’ 간절기용 특수 콘크리트 개발",http://www.lawissue.co.kr/view.php?ud=202604132252361887f4ab64559d_12,삼표그룹 계열사 삼표산업은 현대건설과 공동 연구를 통해 기온 보정 강도 적용 없이도 품질 확보가 가능한 ‘간절기 특수 콘크리트’를 개발하고 현장에 적용했다고 13일 밝혔다. 해당 콘크리트는 삼표시멘트의 조강형... 
2026-04-13,네이버뉴스,GS건설 상한가에 이때다? 오너 일가 2명 장내 매도 [재계톡톡],https://www.mk.co.kr/article/12013762,같은 날 DL이앤씨와 현대건설도 20% 넘게 뛰었고 삼성E&A도 5.65% 올랐다. 주가 급등은 호르무즈 해협 통행 정상화 기대 속 중동 정유·가스·석유화학 시설 복구 수요 확대 전망이 투자 심리를 자극한 영향으로... 
2026-04-13,네이버뉴스,[포토] 베스트7 양효진 '연경언니와 약속 지켰다',https://www.starnewskorea.com/sports/2026/04/13/2026041320471626866,진에어 2025~2026 V-리그 시상식이 13일 서울 광진구 그랜드 워커힐 호텔 비스타홀에서 열렸다. 양효진(현대건설)이 베스트7 수상 후 소감을 밝히고 있다.
2026-04-13,네이버뉴스,"엑스코, 전기산업엑스포 역대 규모…“AI 시대 전력 인프라가 국가 경쟁...",https://www.ksmnews.co.kr/news/view.php?idx=600187,"지난해 한국전력공사 및 발전 5사(남동·중부·서부·남부·동서발전), KEPCO KPS, 한국전력기술 등 공공 바이어는 물론, 포스코이앤씨, 현대건설 등 국내 굴지의 건설 및 엔지니어링사가 바이어로 참여해 뜨거운... "
2026-04-13,네이버뉴스,"삼표그룹, 현대건설과 ‘0℃에서도 굳는’ 간절기 특수 콘크리트 개발",https://www.pressian.com/pages/articles/2026041320161591918?utm_source=naver&utm_medium=search,양사 공동 연구 결실…용산·반포 등 프리미엄 주거 단지 국내 최초 적용 성공 기온 보정 강도 적용 없이 48시간 내 탈형강도 확보…공기 단축·품질 안정성 기대 삼표그룹이 현대건설과 손잡고 기온 변화가 큰 간절기에도... 
2026-04-13,네이버뉴스,"여서동 현대건설 입주민들, 민덕희 여수시의원에 감사 마음 '미담'",http://www.breaknews.com/1199899,여수시의회 더불어민주당 민덕희 의원(여서·문수·광림)이 여서동 현대건설아파트 입주민들에게 감사의 뜻을 전달받았다. 민 의원이 대표 발의한 '여수시 건축... 
2026-04-13,네이버뉴스,LH 경기남부 ‘5건중 2건’ 민간 브랜드 입는다… 올해 공공 1만2천여가...,https://www.kyeongin.com/article/1761773,평택고덕·화성동탄2 등 연내 분양 금호·현대건설·DL이앤씨 등 참여 민간 비율 28%… 공모 증가 추세 한국토지주택공사(LH) 경기남부지역본부가 4월부터 본격적인 분양에 돌입한다. /연합뉴스 한국토지주택공사(LH)... 
2026-04-13,네이버뉴스,"롯데건설, 희망퇴직 시행...조직 체질 개선 시동",https://economist.co.kr/article/view/ecn202604130071,현대건설은 ▲서울 은평구 대조1구역 재개발 ▲송파구 마천4구역 재개발 ▲강서구 등촌1구역 재건축 사업 등에서 공사비 증액을 요청한 것으로 알려졌다. 원가 부담을 더 이상 내부에서 흡수하기 어려운 상황에... 
2026-04-13,네이버뉴스,"압구정5구역, '디에이치 vs 아크로'…하이엔드 브랜드 전쟁의 전면전",https://www.the-pr.co.kr/news/articleView.html?idxno=61102,"현대건설과 DL이앤씨가 각각 '디에이치(THE H)'와 '아크로(ACRO)'를 전면에 내세우며, 단순 시공권 경쟁을 넘어 '누가 압구정을 대표하는 하이엔드 주거 브랜드가 될 것인가'를 놓고 정면 충돌에 나섰다. 정비업계에 따르면... "
2026-04-13,네이버뉴스,10대 건설사 작년 잠재손실 2조…“손해 보면서 공사중인 현장 늘어”,https://www.sedaily.com/article/20031963?ref=naver,"시공 순위 2·3위인 현대건설과 대우건설은 같은 기간 각각 관련 부채가 528억 원에서 699억 원, 1861억 원에서 3034억 원으로 증가했다. 포스코이앤씨(525억 원→1139억 원)와 SK에코플랜트(817억 원→4120억 원) 등도... "
2026-04-13,네이버뉴스,"정부, 중동전 ‘불가항력’ 선언… 민간 공사, 기간 연장 길 열렸다",https://www.dt.co.kr/article/12057207?ref=naver,"조합에 공사비 증액을 요청하는 사례도 이어지고 있다. 현대건설은 지난달부터 은평구 대조1구역 재개발, 서울 송파구 마천4구역 재개발, 강서구 등촌1구역 재건축 사업의 조합에 공사비 증액을 요구하는 공문을 보냈다."
2026-04-13,네이버뉴스,불가리아 원전 지연에… 현대건설·웨스팅하우스 부실 계약 공방,https://www.asiatoday.co.kr/view.php?key=20260413010003966,"코즐로두이 원전 7·8호기 EPC 계약 지연 불가리아 정부, 웨스팅하우스에 구두 경고 준공까지 2년 지연, 현지 언론 “부실 계약” 전문가 “지체 보상금 등 책임소재에 난관” 현대건설이 미국 웨스팅하우스와 컨소시엄... "
2026-04-13,네이버뉴스,"롯데건설, 장기근속자 등 희망퇴직 실시…최대 30개월분 위로금",https://www.sedaily.com/article/20031948?ref=naver,"현대건설은 지난달부터 은평구 대조1구역 재개발, 서울 송파구 마천4구역 재개발, 강서구 등촌1구역 재건축 사업의 조합에 공사비 증액을 요구하는 공문을 보냈다. 한국건설기술연구원 공사비원가관리센터에 따르면... "
2026-04-13,네이버뉴스,"삼표그룹, 현대건설과 간절기 특수 콘크리트 개발",http://www.fnnews.com/news/202604131815231107,삼표그룹이 현대건설과 간절기에도 안정적인 강도를 발현하는 특수 콘크리트를 상용화했다. 삼표그룹은 계열사 삼표산업이 현대건설과 공동 연구를 통해 기온 보정 강도 적용 절차 없이도 품질을 확보할 수 있는 '간절기... 
2026-04-13,네이버뉴스,"대우건설, 5대 건설사 중 계약직 비율 최대",https://www.junggi.co.kr/news/articleView.html?idxno=36111,"13일 중기이코노미가 삼성물산(건설부문), 현대건설, 대우건설, DL이앤씨, GS건설 등 국내 5대 건설사의 사업보고서를 분석한 결과 대우건설의 전체 소속 직원 중 계약직 직원 비중이 33.44%로 5대 건설사 중 가장 높은... "
2026-04-13,네이버뉴스,"삼성물산, 전력거래소와 EMS 해외 진출 맞손",https://www.1conomynews.co.kr/news/articleView.html?idxno=48036,"현대건설은 핀란드 정부 및 에너지 기업들과 협력해 차세대 열에너지 인프라 시장 공략에 힘쓰고 있다. 북유럽 시장 진출을 본격화한다는 전략으로 핀란드, 미국 등 해외 기업들과 함께 신규 원전 건설을 위한 협력을... "
2026-04-13,네이버뉴스,"삼표그룹-현대건설, 간절기 특수 콘크리트 개발…현장 적용",https://www.100ssd.co.kr/news/articleView.html?idxno=208141,삼표그룹이 현대건설과 공동 연구를 통해 기온 변화가 큰 간절기에도 안정적인 강도를 확보할 수 있는 특수 콘크리트를 개발해 현장에 적용했다. 삼표그룹은 기온 보정 강도 적용 절차 없이도 계획된 품질을 확보할 수 있는... 
2026-04-13,네이버뉴스,곧 이란 해상 봉쇄…코스피 5800선 턱걸이,https://biz.sbs.co.kr/article_hub/20000303985?division=NAVER,"현대건설은 1%대 하락했고 GS건설과 계룡건설은 각각 3%, 6%대 하락했습니다. 반면 LS일렉트릭 주식분할 거래 재개와 AI 데이터센터 전력 수요 급증 기대감이 맞물리면서 13.71% 급등했고, 미국 내 생산시설을 확보하기... "
2026-04-13,네이버뉴스,[포토] 자스티스 '베스트7 아리가또',https://www.starnewskorea.com/sports/2026/04/13/2026041317562853465,진에어 2025~2026 V-리그 시상식이 13일 서울 광진구 그랜드 워커힐 호텔 비스타홀에서 열렸다. 자스티스(현대건설)이 베스트7 수상 후 소감을 밝히고 있다.
2026-04-13,네이버뉴스,"[포토] 김다인, 아련한 눈빛",https://www.starnewskorea.com/sports/2026/04/13/2026041317543825662,진에어 2025~2026 V-리그 시상식이 13일 서울 광진구 그랜드 워커힐 호텔 비스타홀에서 열렸다. 김다인(현대건설)이 베스트7 수상 후 소감을 밝히고 있다.
2026-04-13,네이버뉴스,"4월 둘째 주 ETF 시장, 반도체 강세",http://www.newsmaker.or.kr/news/articleView.html?idxno=176042,"이 상품은 코스피200 건설 업종을 기초로 하며, 현대건설, 삼성E&A, 삼성물산, 대우건설, 한전기술, DL이앤씨, GS건설 등을 편입하고 있다. 건설 업종은 원전 수주 기대와 중동 지역 재건 수요 기대가 반영되며... "
2026-04-13,네이버뉴스,"0도 콘크리트 개발, 겨울 공정 한계 돌파",https://www.ppss.kr/news/articleView.html?idxno=292669,삼표산업과 현대건설이 저온 환경에서도 시공 가능한 특수 콘크리트를 개발했다. 삼표산업은 13일 현대건설과 함께 영상 0도에서도 안정적으로 굳는 간절기 특수 콘크리트를 개발하고 현장 적용에 성공했다고 밝혔다.... 
2026-04-13,네이버뉴스,"국내 건설사, 이란 재건 기대감 속 '신중론' 우세",https://www.koscaj.com/news/articleView.html?idxno=323554,"현대건설도 이날 소폭 하락했지만 연초 9만원대 대비 여전히 두 배 가까운 수준을 유지하고 있다. 증권가도 긍정적인 시각을 내놓고 있다. 이란을 비롯해 바레인, 쿠웨이트, UAE 등지의 정유시설과 인프라 복구 수요가... "
2026-04-13,네이버뉴스,"롯데건설, 희망퇴직 시행…기본급 최대 30개월치 위로금 지급(종합)",https://www.yna.co.kr/view/AKR20260413128851003?input=1195m,"현대건설은 지난달부터 은평구 대조1구역 재개발, 서울 송파구 마천4구역 재개발, 강서구 등촌1구역 재건축 사업의 조합에 공사비 증액을 요구하는 공문을 보냈다. 대한건설정책연구원 이은형 연구위원은 ""불확실성이... "
