date,source,title,link,description
2026-04-14,네이버뉴스,[거래소 기관] 삼성전자·SK하이닉스 집중 매수…2차전지는 매도,https://www.pinpointnews.co.kr/news/articleView.html?idxno=445445,"반면 순매도 상위에서는 엘앤에프, LS ELECTRIC, 효성중공업, 현대건설 등이 포함됐다. 엘앤에프는 2차전지 소재 대표 종목으로 성장성이 부각돼 왔지만, 최근 업황 둔화 우려와 밸류에이션 부담이 겹치며 기관 차익실현... "
2026-04-14,네이버뉴스,"'공사비 1조4000억 대어'…상도15구역 현설 6곳 참여, 경쟁전 성립할까",https://www.viva100.com/article/20260414501111,"이날 현설에는 현대건설, 대우건설, ㈜한화 건설부문, 제일건설, 우미건설, 극동건설 등 총 6개 건설사가 참석했다. 특히 이날 현설에 시공능력 상위권 대형사들이 동시에 참여하면서 사업 규모에 걸맞은 경쟁 구도가... "
2026-04-14,네이버뉴스,"""미사일 떨어지는데, 아무 조치도 안해"" 현대건설, 중동 현장직원의 호...",https://www.greenpostkorea.co.kr/news/articleView.html?idxno=306513,중동 전쟁이 장기화되는 가운데 현대건설 중동 현장 직원이 직장인 익명 커뮤니티 블라인드를 통해 본사의 안전 대응이 미흡하다고 호소했다. 현대건설은 안전을 최우선으로 순차적 귀국 조치를 진행 중이라는 입장이다.... 
2026-04-14,네이버뉴스,"""아파트 하자 소송, 책임기간 놓치면 권리 제한···형사 책임으로 이어...",https://www.enetnews.co.kr/news/articleView.html?idxno=48890,"한편, 법무법인 KB는 前 현대건설 출신 이성기 대표변호사의 깊이 있는 실무 경험을 바탕으로, 건설 프로젝트 구조와 하도급 관계, 공사비 증액 및 분쟁 대응 등 건설·부동산 전반에 걸쳐 의뢰인에게 현실적이고 실효성 있는... "
2026-04-14,네이버뉴스,"현대건설, 압구정5구역 입찰 논란에 ""공정경쟁 훼손 행위 엄정 대응""",https://www.bizwork.co.kr/news/articleView.html?idxno=414558,현대건설이 압구정5구역 재건축 정비사업 입찰 과정에서 발생한 입찰서류 무단 촬영 논란과 관련해 공정 경쟁 원칙을 강조하며 엄정 대응 방침을 14일 밝혔다. 현대건설은 시공사 선정을 위한 입찰 마감 직후 진행된... 
2026-04-14,네이버뉴스,"대전 건설시장, 지역업체 참여 늘었지만…""주도권은 여전히 외지에""",https://www.daejonilbo.com/news/articleView.html?idxno=2269131,"주요 실적으로는 △선화3차 주상복합(코오롱글로벌) 364억 원 △KT인재개발원 공동주택(계룡건설) 172억 원 △도안2지구 2블럭 공동주택(현대건설) 186억 원 △도룡동 주상복합(GS건설) 107억 원 등이 확인됐다. 시는 ""대형... "
2026-04-14,네이버뉴스,'1.4조 대어' 상도15구역 현설...현대·대우·한화 등 6곳 참석,http://www.fnnews.com/news/202604141417099041,"서울 동작구 최대 재개발 지역인 상도15구역 현장설명회에 현대건설, 대우건설, 한화건설 등 대형 건설사들이 참석하며 본격적인 레이스를 시작했다. 신속통합기획 2차 후보지 중 가장 빠르게 속도를 내며 인근... "
2026-04-14,네이버뉴스,한강변 '스카이라인' 여의도 정비사업...대형사부터 중견사까지 활발,https://www.pointdaily.co.kr/news/articleView.html?idxno=301151,"이 아파트들은 각각 삼성물산과 현대건설을 시공사로 선정했다. 삼성물산이 수주한 대교아파트는 최고 49층 4개동 912가구로 조성되며, 현재 관리처분계획 인가 및 착공 절차를 앞두고 있다. 현대건설이 담당하는... "
2026-04-14,네이버뉴스,"[와글와글] ""몰카보다 더 황당""…DL이앤씨, 압구정5 사과문에 여론 들끓...",http://www.newsdream.kr/news/articleView.html?idxno=111300,이번 사건은 지난 10일 입찰 제안서 개봉 및 상호 날인 과정에서 현대건설이 조합에 제출한 입찰 제안서를 DL이앤씨 소속 직원이 볼펜형 카메라로 무단으로 촬영한 사실이 적발되면서 불거졌습니다. 입찰 제안서는 시공사... 
2026-04-14,네이버뉴스,"[건설플러스] 아이파크, 라이프 스타일 브랜드로 ‘체질개선’ 外",https://news.dealsitetv.com/articles/168631,"◆ 현대건설, 핀란드 열에너지 인프라 공략 현대건설이 신규 대형 원전에 이어 핀란드와의 에너지 협력을 이어간다. 현대건설은 지난 10일 서울 종로구에 위치한 계동 본사에서 빌레 타비오(Ville Tavio) 핀란드... "
2026-04-14,네이버뉴스,[도시정비시장 풍향계] 상도15구역 재개발 1차 현설에 현대ㆍ대우ㆍ한화...,https://www.dnews.co.kr/uhtml/view.jsp?idxno=202604141510475250212,"현설에는 현대건설, 대우건설, ㈜한화 건설부문, 제일건설, 우미건설, 극동건설 등 6개사가 참석했다. 이들 회사는 조합이 제시한 기한인 지난 12일 전까지 입찰참여의향서를 모두 제출했다. 정비업계에서는 공동... "
2026-04-14,네이버뉴스,"[포커스] ""美 의원들 만나보니 파병 얘기 안 해‥트럼프 옹호 분위기 없...",https://imnews.imbc.com/replay/2026/nw1400/article/6815111_36974.html,거기 대형 원전도 들어가고 태양광도 들어가고 이런 프로젝트인데 거기에 우리 현대건설이 진출을 강력히 희망하고 있어요. 이미 진행을 하고 있고. 근데 테드 크루즈 상원 의원은 자기 지역구에 그거 오는 걸 너무... 
2026-04-14,네이버뉴스,"DL이앤씨 '성남 상대원2구역 시공사 해지' 실적에 대형 변수, 박상신 버...",https://www.businesspost.co.kr/BP?command=article_view&num=435671,압구정5구역에서는 현대건설과 맞대결이 성사됐고 목동 6단지에는 단독응찰했다. DL이앤씨가 압구정 5구역에서 벌어지는 현대건설과 맞대결에서 시공권을 가져오면 분위기를 반전하는 계기를 마련할 수 있다.... 
2026-04-14,네이버뉴스,"광주광역시, 용연정수장에 태양광발전소 설치",https://www.siminilbo.co.kr/news/newsview.php?ncode=1160286348978235,"이는 지난 2025년 10월17일 상수도사업본부가 전력효율을 높이기 위해 빛고을시민햇빛발전 사회적협동조합, 현대건설과 함께 체결한 ‘용연정수장 유휴부지를 활용한 태양광 직접 PPA 발전 협약’으로 이뤄졌다.... "
2026-04-14,네이버뉴스,"건설업계, 중동전쟁 불가항력 인정에 공기 연장 길 열렸다",http://www.opinionnews.co.kr/news/articleView.html?idxno=136729,"현대건설은 지난달 31일 마천4구역 재개발조합에 도급 공사비를 기존 3834억여원에서 6733억여원으로 2899억여원 올려달라는 공문을 보냈다. 3.3㎡당 공사비는 584만원에서 959만원으로 뛰고, 공사 기간도 34개월에서 44개월로... "
2026-04-14,네이버뉴스,"건설업계, 역대급 복합불황에 구조조정 등 떠밀려",https://www.womentimes.co.kr/news/articleView.html?idxno=102185,"현대건설은 지난 3월 은평구 대조1구역 재개발과 서울 송파구 마천4구역 재개발, 강서구 등촌1구역 재건축 사업과 관련해 각 조합에 공사비 증액을 요구했다. 포스코이앤씨에서는 임원 조직의 20%이나 축소하고 사업부를... "
2026-04-14,네이버뉴스,"광주시 ""자체 발전 태양광 에너지로 수돗물 생산""",https://www.seoulfn.com/news/articleView.html?idxno=626479,"이는 지난해 10월 17일 상수도사업본부가 전력효율을 높이기 위해 빛고을시민햇빛발전 사회적협동조합, 현대건설과 함께 체결한 '용연정수장 유휴부지를 활용한 태양광 직접 PPA 발전 협약'으로 이뤄졌다. 협약에 따라... "
2026-04-14,네이버뉴스,"광주시, 전국 최초 태양광발전 에너지로 수돗물 생산",https://www.newstree.kr/newsView/ntr202604140010,"이 사업은 광주 상수도사업본부가 전력효율을 높이기 위해 지난해 10월 빛고을시민햇빛발전사회적협동조합, 현대건설 등과 체결한 '용연정수장 유휴부지를 활용한 태양광 직접 PPA 발전협약'을 체결한 결과다. 광주... "
2026-04-14,네이버뉴스,4월 재개발·재건축 시공자 선정 동향(2026.3.30.~2026.4.26.),https://www.housingherald.co.kr/news/articleView.html?idxno=61406,"그 결과 현대건설, 대우건설, GS건설, DL이앤씨, 롯데건설, 쌍용건설, 제일건설 등 7개사가 참석했다. 오는 5월 22일 입찰을 마감할 예정이며 예정총공사비는 약 3,233억1,084만원이다. 새시공자 선정에 나선 모아타운... "
2026-04-14,네이버뉴스,"광주시, 태양광 전기로 수돗물 생산…전국 최초 '직접 PPA' 도입",https://www.getnews.co.kr/news/articleView.html?idxno=867704,"이번 사업은 지난해 10월 상수도사업본부와 빛고을시민햇빛발전 사회적협동조합, 현대건설이 체결한 '용연정수장 태양광 직접 PPA 발전 협약'에 따라 추진됐다. 이에 따라 발전사업자인 협동조합은 발전소 설치와 운영... "
2026-04-14,네이버뉴스,"대전 지역업체 1분기 하도급 2조 7,120억원 수주",http://www.ccnnews.co.kr/news/articleView.html?idxno=407369,주요 실적으로는 ▲선화3차 주상복합(코오롱글로벌) 364억 원 ▲KT인재개발원 공동주택(계룡건설) 172억 원 ▲도안2지구 2블럭 공동주택(현대건설) 186억 원 ▲도룡동 주상복합(GS건설) 107억 원 등 주요 현장을 중심으로... 
2026-04-14,네이버뉴스,"광주광역시, 태양광발전소로 수돗물 생산… 전국 최초 탄소중립 모델 구...",https://www.industrynews.co.kr/news/articleView.html?idxno=79972,"이는 지난해 10월 17일 상수도사업본부가 전력효율을 높이기 위해 빛고을시민햇빛발전 사회적협동조합, 현대건설과 함께 체결한 '용연정수장 유휴부지를 활용한 태양광 직접 PPA 발전 협약'으로 이뤄졌다. 협약에 따라... "
2026-04-14,네이버뉴스,"대전시 ""1분기 지역업체 하도급 총 수주액 2조7120억 원""",http://www.chungnamilbo.co.kr/news/articleView.html?idxno=883357,"주요 실적으론 선화3차 주상복합(코오롱글로벌) 364억 원, KT인재개발원 공동주택(계룡건설) 172억 원, 도안2지구 2블럭 공동주택(현대건설) 186억 원, 도룡동 주상복합(GS건설) 107억 원 등 주요 현장을 중심으로 지역업체의... "
2026-04-14,네이버뉴스,"압구정5구역 '문건 촬영' 논란 장기화…업계 ""단순 절차 문제 넘은 전략...",http://www.newstnt.com/news/articleView.html?idxno=606669,이처럼 조합과 인허가청의 판단이 일단락됐음에도 현대건설 측의 문제 제기가 이어지는 양상을 보이자 시장에서는 그 이면에 다른 수주 전략이 깔려있다는 분석이 제기된다. 가장 먼저 거론되는 것은 제안 조건... 
2026-04-14,네이버뉴스,"두산건설, 발파작업으로 원주 300여가구 피해",https://www.dailybrief.co.kr/news/articleView.html?idxno=5611,"현재 강원도 원주시에는 노후화된 주택과 상가 부지에 총 7000여가구의 아파트가 들어서는 뉴타운 공사가 진행되고 있는데 대우건설과 두산건설, 현대건설 등 3개 건설사가 공사를 진행하고 있다. 최혁진 의원은 ""벽이... "
2026-04-14,네이버뉴스,"광주시, 자체 태양광 시설로 수돗물 생산...예산 절감 효과는 미미",http://www.yonhapnewstv.co.kr/AKR20260414135110RAX,"이 사업은 빛고을시민햇빛발전 사회적협동조합·현대건설 등과 체결한 민관 협약을 통해 추진됐으며, 발전 사업자가 생산한 전력을 한전을 거치지 않고 직접 구매하는 방식을 적용했습니다. 이에 따라 송·배전망을... "
2026-04-14,네이버뉴스,"집 짓던 건설사, AI 인프라로 확장…데이터센터 '사업모델 전환' 본격화",http://www.hansbiz.co.kr/news/articleView.html?idxno=832699,"14일 건설업계에 따르면 대우건설, GS건설, 삼성물산, 현대건설 등 주요 건설사들은 최근 데이터센터 사업 확대에 속도를 내며 각사별 전략을 구체화하고 있다. 단순 시공을 넘어 투자와 개발, 운영까지 아우르는... "
2026-04-14,네이버뉴스,"광주시, 태양광 발전 에너지로 수돗물 생산…전국 최초",https://www.kmib.co.kr/article/view.asp?arcid=0029677411&code=61121111&cp=nv,"앞서 지난해 10월 광주시 상수도사업본부는 전력효율을 높이기 위해 빛고을시민햇빛발전 사회적협동조합, 현대건설과 함께 체결한 ‘용연정수장 유휴부지를 활용한 태양광 직접 PPA 발전 협약’을 체결했다. 협약에... "
2026-04-14,네이버뉴스,1년 새 7억 쑥…대치 학원가 옆 38년 된 강남 '이 단지'서 무슨일이,https://realty.chosun.com/site/data/html_dir/2026/04/14/2026041402475.html,"최근 열린 현장설명회에는 대우건설, 현대건설, GS건설, DL이앤씨, 롯데건설, 쌍용건설, 제일건설 등 주요 건설사들이 대거 참석했다. 정비계획에는 단순한 주거시설을 넘어 교육·커뮤니티 기능 강화 방안도 포함됐다.... "
2026-04-14,네이버뉴스,"광주, 전국 최초 '태양광 수돗물' 시대 열었다… 용연정수장 탄소중립 ...",https://www.aitimes.com/news/articleView.html?idxno=209192,"사업은 지난해 10월17일 광주 상수도사업본부와 빛고을시민햇빛발전 사회적협동조합, 현대건설이 체결한 용연정수장 유휴부지를 활용한 태양광 직접 PPA 발전 협약을 바탕으로 추진됐다. 협약에 따라 세 기관은... "
2026-04-14,네이버뉴스,태양광 에너지로 수돗물 생산...전국 최초 탄소중립 모델 갖춰,https://www.ajunews.com/view/20260414114624415,빛고을시민햇빛발전 사회적협동조합과 현대건설이 참여해 민관 협약으로 이 사업을 추진했다. 발전사업자가 생산한 전력을 한국전력공사를 거치지 않고 직접 구매하는 방식을 적용해 계통 안정성과 전력 효율성을... 
2026-04-14,네이버뉴스,"희망퇴직 받고 조직 줄이고 … 건설업계, 유동성 개선 안간힘",https://biz.newdaily.co.kr/site/data/html/2026/04/14/2026041400138.html,시공능력평가 10위권 건설사인 △삼성물산 건설부문 △현대건설 △대우건설 △DL이앤씨 △GS건설 △현대엔지니어링 △포스코이앤씨 △롯데건설 △SK에코플랜트 △IPARK현대산업개발의 지난해 미청구공사비 총액은... 
2026-04-14,네이버뉴스,"“현대건설, 원전 모멘텀 타고 건설업종 주도주 될 것”",https://weekly.donga.com/3/all/11/6183322/1,신한투자증권 “복정역세권 사업으로 국내 매출도 점진적 회복 전망” 현대건설이 해외 원전 모멘텀과 국내 매출 증대 등에 힘입어 건설업종 주도주 자리를 되찾을 것이라는 전망이 나왔다. 김선미 신한투자증권... 
2026-04-14,네이버뉴스,수십조 재건 ‘큰장’선다…건설주 수혜 기대,https://biz.heraldcorp.com/article/10716701?ref=naver,"현대건설은 이라크 바스라 및 알 주바이르 인근에서 대형 플랜트를 수행 중이거나 수행한 경험이 있고, 삼성E&A 역시 UAE 루와이스 정유 프로젝트 등에서 수조원대 수주 실적을 보유하고 있다. GS건설 또한 쿠웨이트·UAE... "
2026-04-14,네이버뉴스,"광주시, 자체 태양광으로 수돗물 생산…전국 첫 사례",https://www.newspim.com/news/view/20260414000584,"이번 사업은 상수도사업본부와 빛고을시민햇빛발전 사회적협동조합, 현대건설이 지난해 10월 체결한 '용연정수장 유휴부지 태양광 직접 PPA 발전 협약'에 따라 추진됐다. 협약에 따라 세 기관은 2035년까지 10년간... "
2026-04-14,네이버뉴스,"광주시, 자체 발전 에너지로 수돗물 생산",http://www.siminsori.com/news/articleView.html?idxno=316797,"이번 사업은 지난해 10월 상수도사업본부와 빛고을시민햇빛발전 사회적협동조합, 현대건설이 체결한 '용연정수장 유휴부지 활용 태양광 직접 PPA 발전 협약'에 따라 추진됐다. 협약에 따라 세 기관은 2035년까지 10년간... "
2026-04-14,네이버뉴스,"광주시, 전국 첫 자체 태양광 활용 수돗물 생산…탄소중립 모델 구축",https://www.newsworks.co.kr/news/articleView.html?idxno=837698,"구체적으로는 지난해 10월 빛고을시민햇빛발전 사회적협동조합, 현대건설과 함께 체결한 협약을 토대로 사업이 추진됐다. 협동조합은 발전사업자로서 태양광발전소의 설치와 유지관리를 맡아 전기를 생산한다. 주목할... "
2026-04-14,네이버뉴스,"건설업종, 코스피 수익률 11%p 상회… 서울 아파트값 63주 연속 '고공행...",http://www.newstnt.com/news/articleView.html?idxno=606613,"현대건설(000720)은 4월 말 미국 페르미 마타도르 FEED 종료 후 EPC 협상을 앞두고 있으며, 미국 홀텍 SMR 수주도 가시권에 들어왔다. 대우건설(047040) 역시 체코 원전 계약 마무리를 앞두고 있고, 베트남 신규 원전... "
2026-04-14,네이버뉴스,"광주 용연정수장, 태양광 전기로 수돗물 만든다",https://www.asiatoday.co.kr/view.php?key=20260414010004134,"이번 사업은 지난해 10월17일 상수도사업본부가 전력효율을 높이기 위해 빛고을시민햇빛발전 사회적협동조합, 현대건설과 함께 체결한 '용연정수장 유휴부지를 활용한 태양광 직접 PPA 발전 협약'으로 이뤄졌다. 협약에... "
2026-04-14,네이버뉴스,"광주시, 전국 첫 자체 발전 에너지로 수돗물 생산",https://biz.heraldcorp.com/article/10716635?ref=naver,"이는 지난해 10월17일 상수도사업본부가 전력효율을 높이기 위해 빛고을시민햇빛발전 사회적협동조합, 현대건설과 함께 체결한 ‘용연정수장 유휴부지를 활용한 태양광 직접 PPA 발전 협약’으로 이뤄졌다. 협약에... "
2026-04-14,네이버뉴스,중동 리스크 없는 후분양 오피스텔 '힐스테이트 안양펠루스' 분양,http://www.ikld.kr/news/articleView.html?idxno=332818,◆ 현대건설 시공 완료된 브랜드 후분양 프리미엄 수도권에서 이미 공사가 완료된 후분양 단지가 눈길을 끌고 있다. 현대건설이 시공한 '힐스테이트 안양펠루스'가 바로 그 주인공으로 현재 성황리 분양 중이다.... 
2026-04-14,네이버뉴스,"광주시, 전국 최초 태양광에너지로 수돗물 생산 '유레카'",https://www.tournews21.com/news/articleView.html?idxno=133649,"시는 빛고을시민햇빛발전 사회적협동조합, 현대건설과 함께 동구 용연정수장에서 오는 2035년까지 10년간 '태양광 발전사업(빛고을시민 용연PPA 햇빛발전소)'을 진행하며 직접전력거래계약(직접 PPA) 방식으로 수돗물을... "
2026-04-14,네이버뉴스,"광주시, 태양광 전력으로 수돗물 생산…전국 첫 '직접 PPA' 모델",https://news.dealsitetv.com/articles/168595,"이번 사업은 지난해 10월 빛고을시민햇빛발전 사회적협동조합, 현대건설과 체결한 ‘용연정수장 유휴부지 활용 태양광 직접 PPA 발전 협약’에 따라 추진됐다. 협약에 따라 빛고을시민햇빛발전 사회적협동조합은... "
2026-04-14,네이버뉴스,"광주광역시, 전국 최초 자체 태양광 발전 에너지로 수돗물 생산",http://www.fnnews.com/news/202604141025392963,"상수도사업본부는 앞서 전력 효율을 높이고자 지난해 10월 17일 빛고을시민햇빛발전 사회적협동조합, 현대건설과 함께 '용연정수장 유휴부지를 활용한 태양광 직접 PPA 발전 협약'을 체결했다. 협약에 따라 세 기관은... "
2026-04-14,네이버뉴스,"현대건설, '더 써클' 상표권 출원… 신사업 브랜드 선점 나서",https://it.chosun.com/news/articleView.html?idxno=2023092160308,"현대건설이 최근 상표권 출원을 확대하며 브랜드 경쟁력 지위 확보에 공들이고 있다. 건설사들이 건축부터 입주민 서비스까지 신사업을 추가하는 트렌드에 발맞춰 다양한 서비스를 선보이고, 수주 등에서 브랜드... "
2026-04-14,네이버뉴스,"""전기는 직접 쓰는 시대""…광주시, 수돗물 생산에 태양광 접목",https://www.thefairnews.co.kr/news/articleView.html?idxno=74292,"이번 사업은 지난해 10월 상수도사업본부와 빛고을시민햇빛발전 사회적협동조합, 현대건설이 체결한 민관 협약을 기반으로 추진됐다. 협약에 따라 발전소 설치와 운영은 시민 참여형 협동조합이 맡고, 광주시는 부지를... "
2026-04-14,네이버뉴스,"광주시, 태양광 전력 활용 '탄소중립 수돗물' 전국 첫 도입",https://www.sidae.com/article/2026041410074170010,"이번 사업은 지난해 10월17일 상수도사업본부가 전력효율을 높이기 위해 빛고을시민햇빛발전 사회적협동조합, 현대건설과 함께 체결한 '용연정수장 유휴부지를 활용한 태양광 직접 PPA 발전 협약'으로 이뤄졌다. 협약에... "
2026-04-14,네이버뉴스,"광주시, 전국 최초 자체 발전 태양광에너지 활용 수돗물 생산 실현",https://www.joongdo.co.kr/web/view.php?key=20260415010004166,"이 결과는 2025년 10월 17일 상수도사업본부가 전력효율을 제고하기 위해 빛고을시민햇빛발전 사회적협동조합, 현대건설과 함께 체결한 '용연정수장 유휴부지를 활용한 태양광 직접 PPA 발전 협약'으로 이뤄졌다. 세... "
2026-04-14,네이버뉴스,"광주시, 전국 최초 자체 발전 에너지로 수돗물 생산",https://www.etnews.com/20260414000109,"이는 지난해 10월17일 상수도사업본부가 전력효율을 높이기 위해 빛고을시민햇빛발전 사회적협동조합, 현대건설과 함께 체결한 '용연정수장 유휴부지를 활용한 태양광 직접 PPA 발전 협약'으로 이뤄졌다. 협약에 따라... "
2026-04-14,네이버뉴스,"광주시, 태양광 전력으로 수돗물 생산…전국 첫 탄소중립 모델 구축",https://news.tvchosun.com/site/data/html_dir/2026/04/14/2026041490076.html,"이번 사업은 빛고을시민햇빛발전 사회적협동조합과 현대건설 등이 참여한 민관 협약을 통해 추진됐다. 발전사업자가 생산한 전력을 한국전력을 거치지 않고 직접 구매하는 방식이 적용됐고, 배전망을 통하지 않아 계통... "
2026-04-14,네이버뉴스,"대전시, 2026년 1분기 지역업체 하도급 2조7000억 수주…건설경기 활성화...",https://www.etnews.com/20260414000096,"주요 실적으로 선화3차 주상복합(코오롱글로벌) 364억원, KT인재개발원 공동주택(계룡건설) 172억원, 도안2지구 2블럭 공동주택(현대건설) 186억원, 도룡동 주상복합(GS건설) 107억원 등 주요 현장을 중심으로 지역업체... "
2026-04-14,네이버뉴스,"'AI·에너지·하이엔드'...건설업계, 미래 인프라 및 고부가가치 시장 공...",http://www.dailypop.kr/news/articleView.html?idxno=98012,"사진=대우건설 장성파인데이터센터 조감도 현대·삼성, 글로벌 '에너지 영토' 확장과 기술 고도화 주력 에너지 인프라 분야에서는 현대건설과 삼성물산 건설부문의 글로벌 행보가 두드러진다. 현대건설은 핀란드와... "
2026-04-14,네이버뉴스,코스피 밀릴 때 건설주 날았다...원전·중동 재건이 만든 반전,https://www.ebn.co.kr/news/articleView.html?idxno=1705338,현대건설도 9% 이상 오르며 주요 건설사들이 일제히 강세를 보였다. 연초 이후 흐름은 더 극적이다. 대우건설은 1월 3000원대 초반에서 4월 초 1만9000원대까지 약 530% 급등하며 올해 건설주 랠리를 상징하는 종목으로... 
2026-04-14,네이버뉴스,외국인 '에너지株'는 골라 담는다,http://www.smedaily.co.kr/news/articleView.html?idxno=355613,"이외에도 삼성SDI(6944억원), 효성중공업(5278억원), 산일전기(4703억원) 등 ESS(에너지저장장치)와 전력 업종 등 에너지 관련 종목들과 현대건설(4135억원) 등 원자력 테마주까지 전체적으로 에너지 관련 종목들에 많은... "
2026-04-14,네이버뉴스,"분양 '파죽지세' 롯데건설, 르엘로 쓰는 하이엔드 '성공 방정식'",https://www.mediapen.com/news/view/1093123,"또 부동산 플랫폼 다방이 전국 10~50대 남녀 1만6048명을 대상으로 실시한 '2026 하이엔드 아파트 브랜드 선호도' 조사에서 DL이앤씨 '아크로', 현대건설 '디에이치'에 이어 3위를 차지했다. 롯데건설은 이러한 브랜드... "
2026-04-14,네이버뉴스,압구정5구역 '문건 촬영 논란'…입찰 무효 사유 판단 엇갈려,https://www.safetynews.co.kr/news/articleView.html?idxno=247616,지난 10일 압구정5구역 시공자 입찰 마감 과정에서 DL이앤씨 직원이 현대건설의 제안서를 촬영했다는 의혹이 제기됐다. 이에 현대건설은 강하게 항의하며 원칙적인 책임 소재를 묻고 나섰으나 입찰 절차 중단을 요구한 것은... 
