date,source,title,link,description
2026-04-22,네이버뉴스,현대건설이 제시한 압구정3구역 미래상의 진화 : '단 하나의 대도시'에...,https://www.huffingtonpost.kr/article/256777,"현대건설이 압구정3구역 재건축정비사업 우선협상대상자로 선정된 이후 도시 청사진을 더욱 구체화했다. 압구정3구역의 예정 공사비는 5조5610억 원으로, 올해 서울 도시정비 사업 최대 규모로 알려졌다. 지난 시공사... "
2026-04-22,네이버뉴스,"현대건설, 압구정3구역에 'ONE City' 비전 제시…미래형 주거 청사진 공...",https://www.ebn.co.kr/news/articleView.html?idxno=1706223,"현대건설이 압구정3구역 정비사업 우선협상대상자로 선정된 가운데, 압구정 현대의 정체성을 잇는 미래 주거 청사진 'ONE City'를 공개했다. 압구정3구역은 현대 1~7차, 10·13·14차와 대림빌라트 등을 포함한 3934가구를... "
2026-04-22,네이버뉴스,삼성전자 최고 실적… ‘힐스테이트 고덕엘리스트’ 분양 예정,https://biz.heraldcorp.com/article/10723086?ref=naver,"현대건설은 ‘힐스테이트 고덕엘리스트’를 공급할 계획이다. 단지는 경기도 평택시 고덕국제화계획지구 A-31·34·35블록에 지상 최고 33층, 총 2,122가구 규모로 조성될 예정이다. 전용면적은 58㎡와 84㎡로 구성된다.... "
2026-04-22,네이버뉴스,"공간제작소, 美 ‘WOM 2026’ 참가… 기술 소개",https://www.etoday.co.kr/news/view/2578037,"현대건설, 삼성전자 등 국내 대기업과의 협업을 비롯해 현재는 해외 시장 진출 및 사업 확장을 위한 다양한 프로젝트를 추진하고 있다. 기업 관계자는 “국내 시장을 넘어 해외 시장까지 확장을 준비하고 있는... "
2026-04-22,네이버뉴스,"“2분기에 대물급 나온다”…10대 건설사, 2만4340가구 분양",http://www.lawissue.co.kr/view.php?ud=20260422131313842867191f6c6e_12,"현대건설은 5월 경남 양산시 물금읍 가촌리∙범어리 일원에 짓는 ‘힐스테이트 양산더스카이’를 분양할 예정이다. 2개 단지, 총 598가구 규모다. 1단지는 지하 4층~지상 20층, 4개동, 전용면적 68~159㎡ 총 299가구이며... "
2026-04-22,네이버뉴스,"현대건설, 우협 이후 제안 고도화…압구정3 ‘ONE City’ 가능성은?",https://www.tfmedia.co.kr/news/article.html?no=203947,"우선 협상자 선정 현대건설, ‘ONE City’ 미래형 주거 청사진 제시 로보틱스·대형 커뮤니티…조합 기대치 상승 변수  서울 강남 핵심 재건축 사업인 압구정3구역에서 시공사 우선협상대상자로 선정된 현대건설이 ‘도시... "
2026-04-22,네이버뉴스,"압구정 현대의 귀환...현대건설, 65층 '원 시티'로 재건축 종지부",https://www.thefairnews.co.kr/news/articleView.html?idxno=75084,"현대건설이 압구정3구역 정비사업 우선협상대상자 선정 이후 압구정 현대의 명성을 21세기형 대도시로 재해석한 'ONE City'의 청사진을 전격 공개했다. 이번 프로젝트는 현대아파트 1~7차 등 기존 3,934가구를 최고 65층, 5... "
2026-04-22,네이버뉴스,하이엔드 주거 브랜드평판 4월 1위 현대건설 디에이치…2위 롯데건설 르...,https://www.cbci.co.kr/news/articleView.html?idxno=569475,"한국기업평판연구소는 2026년 4월 하이엔드 주거 브랜드평판 빅데이터 분석 결과, 현대건설 '디에이치'가 1위를 차지했다고 22일 밝혔다. 2위는 롯데건설 '르엘', 3위는 DK아시아 '로열파크씨티'로 집계됐다.... "
2026-04-22,네이버뉴스,실적 시즌 앞둔 건설업계…IPARK현산 반등 전망,https://www.kukinews.com/article/view/kuk202604220047,"현대건설은 매출액과 영업이익이 모두 감소할 것으로 예상되는 반면, IPARK현대산업개발은 매출과 영업이익이 모두 증가할 전망이다. 22일 금융정보업체 에프앤가이드에 따르면 현대건설의 1분기 매출액은... "
2026-04-22,네이버뉴스,"현대건설, 압구정3구역 재건축 '원 시티' 청사진 공개",https://www.ezyeconomy.com/news/articleView.html?idxno=234953,"현대건설이 압구정3구역 정비사업 우선협상대상자로 선정되며 미래형 주거 비전 'ONE City'청사진을 22일 공개했다. 압구정3구역은 기존 약 3900여 가구를 최고 65층, 5175가구 규모로 탈바꿈하는 대형 재건축 사업이다.... "
2026-04-22,네이버뉴스,"DRT 셔틀·로보틱스까지…현대건설, 압구정3구역 'ONE City' 구현",https://www.newsis.com/view/NISX20260422_0003601598,"서울 강남 핵심 재건축 사업인 압구정3구역 우선협상대상자로 선정된 현대건설이 'ONE City'를 공개하며 미래 청사진을 제시했다. 압구정3구역은 현대 1~7차, 10·13·14차, 대림빌라트 등 3934가구를 최고 65층, 5175가구... "
2026-04-22,네이버뉴스,"현대건설, 압구정3구역 승부수…65층·5175가구 '원시티' 청사진 공개",https://www.fetv.co.kr/news/articleView.html?idxno=300918,"현대건설이 서울 강남권 최대 재건축 사업지로 꼽히는 압구정3구역에 '원시티(ONE City)' 구상을 내놓으며 수주전에 본격 나섰다. 글로벌 설계사 협업, 한강 조망 특화 설계, 무인셔틀과 로보틱스 기술 등을 앞세워 미래형... "
2026-04-22,네이버뉴스,"현대건설, 압구정3구역 ‘원 시티’ 랜드마크 청사진 공개",https://www.viva100.com/article/20260422500579,"현대건설이 압구정아파트지구 특별계획구역3 재건축정비사업 우선협상대상자로 선정된 가운데, 압구정 현대의 가치를 계승하는 도시 청사진 ‘ONE City’를 22일 공개했다. 현대건설은 ‘OWN THE ONE’ 비전 아래 기존... "
2026-04-22,네이버뉴스,"현대건설, 압구정3구역에 'One City' 미래 랜드마크 제시",https://www.womentimes.co.kr/news/articleView.html?idxno=102449,"우먼타임스 = 송현섭 기자 현대건설은 압구정3구역 정비사업 우선협상대상자로 선정된 가운데 미래 주거 기준을 제시하고 새로운 도시 청사진인 'ONE City'를 22일 공개했다. 압구정3구역은 현대 1~7차, 10·13·14차... "
2026-04-22,네이버뉴스,"현대건설, 압구정3구역에 'One City' 청사진 제시",https://news.bbsi.co.kr/news/articleView.html?idxno=4079810,"현대건설이 압구정3구역 정비사업 우선협상대상자에 선정된 가운데 압구정 현대의 가치를 계승하는 도시 청사진 'ONE City'를 공개했습니다. 압구정3구역은 현대 1~7차, 10·13·14차, 대림빌라트 등 3천 934가구를 최고... "
2026-04-22,네이버뉴스,"현대건설, 압구정3구역 '단 하나의 도시(ONE City)'로 구현",https://www.discoverynews.kr/news/articleView.html?idxno=1089580,"'OWN THE ONE' 비전[이미지=현대건설] 현대건설이 압구정3구역 정비사업 우선협상대상자로 선정되며, 압구정 현대의 가치를 계승한 도시 청사진 'ONE City'를 공개했다고 22일 밝혔다. 이번 구상은 'OWN THE ONE' 비전 아래... "
2026-04-22,네이버뉴스,"자재값 폭탄에 놀란 건설사들, 공사비 2조 늘렸지만 … '역마진' 공포 또...",https://biz.newdaily.co.kr/site/data/html/2026/04/22/2026042200102.html,"현대건설은 대장~홍대 광역철도 민간투자시설사업 건설공사에서 2409억원, 사우디아라비아 자프라 유틸리티공사에서 923억원, 반포주공1단지 1·2·4주 주택재건축정비사업에서 1129억원 등 총 4461억원 규모 증액 계약을... "
2026-04-22,네이버뉴스,[건설업계 동향] GS건설ㆍ현대건설ㆍ현대엔지니어링ㆍ삼성물산(4.22),http://www.weeklytoday.com/news/articleView.html?idxno=772215,"■ 현대건설, 압구정3구역 'ONE City' 청사진 공개...미래 주거 기준 제시 - 5175가구 규모 랜드마크 조성...글로벌 설계사 람사·모르포시스 협업 - 현대차그룹 연계 로보틱스 및 DRT 무인셔틀 도입으로 미래형 주거 구현... "
2026-04-22,네이버뉴스,압구정 3구역 어떻게 바뀔까…현대건설 청사진 '원 시티' 공개,https://www.hankyung.com/article/2026042283356,"서울 강남구 압구정3구역 재건축 우선협상대상자에 선정된 현대건설이 청사진 '원 시티'(ONE City)를 22일 공개했다. 압구정3구역은 현대 1~7차, 10·13·14차, 대림빌라트 등 3934가구를 최고 65층, 5175가구 규모로 다시... "
2026-04-22,네이버뉴스,"현대건설, 압구정3구역에 '원 시티' 청사진 제시",http://www.metroseoul.co.kr/article/20260422500153,"/현대건설 현대건설은 압구정3구역 정비사업 우선협상대상자에 선정된 가운데 압구정 현대의 가치를 계승하는 도시 청사진 '원 시티(ONE City)'를 공개했다고 22일 밝혔다. 압구정3구역은 현대 1~7차, 10·13·14차... "
2026-04-22,네이버뉴스,"현대건설, 압구정3구역 ‘ONE City’ 미래 주거 제시",https://www.inthenews.co.kr/news/article.html?no=85907,5175가구 대규모 재건축 청사진 로보틱스·생태숲 결합 주거 혁신 인더뉴스 제해영 기자ㅣ현대건설은 압구정3구역 정비사업에 미래 주거 비전 ‘ONE City’를 제시했다고 21일 밝혔습니다. 압구정3구역은 현대 1~7차와 10... 
2026-04-22,네이버뉴스,목동 재건축 '분수령'…6단지 수의계약 '초읽기' 속 5만가구 미니신도시...,https://www.pinpointnews.co.kr/news/articleView.html?idxno=447573,"현대건설, 포스코이앤씨, DL이앤씨 등 대형 건설사들이 관심을 보이며 향후 치열한 수주 경쟁이 예상된다. 해당 단지는 2436가구 규모의 대단지로 계획돼 있다. 이처럼 목동 일대 14개 단지는 향후 약 5만 가구 규모... "
2026-04-22,네이버뉴스,"현대건설, 압구정3구역 재건축 청사진 '원 시티' 공개",http://www.edaily.co.kr/news/newspath.asp?newsid=03565366645418744,"서울 강남구 압구정3구역 재건축 우선협상대상자에 선정된 현대건설이 압구정 현대의 가치 계승을 내세우며 도시 청사진 ‘원 시티’(ONE City)를 22일 공개했다. 압구정3구역 재건축은 현대 1∼7차, 10·13·14차... "
2026-04-22,네이버뉴스,"현대건설, 압구정3구역 청사진 'One City' 공개",https://news.tf.co.kr/read/economy/2315873.htm,'OWN THE ONE' 비전 아래 5대 핵심 가치 공개 현대건설이 압구정3구역 정비사업 우선협상대상자에 선정된 가운데 압구정 현대의 가치를 계승하는 도시 청사진 '원 시티(ONE City)'를 공개했다. 현대건설은 22일 'OWN THE... 
2026-04-22,네이버뉴스,"‘성난사람들 2’ 속 저 건물, 어디서 봤더라?···용산·강남 ‘이곳’...",https://www.khan.co.kr/article/202604221052001,아모레퍼시픽 사옥은 영국 건축가 데이비드 치퍼필드가 설계하고 현대건설이 시공했다. 치퍼필드는 2023년 ‘건축 노벨상’으로 불리는 프리츠커상을 수상한 저명한 건축가다. 치퍼필드는 2023년 수상 기념으로... 
2026-04-22,네이버뉴스,"사단법인 휴먼아시아·대한변호사협회, 기업 인권실사 평가 발표 및 과...",http://www.segyebiz.com/newsView/20260422506401?OutUrl=naver,"평가 결과 상위권에는 현대건설, LG전자, 네이버, 삼성전자, 카카오 등이 포함됐다. 이번 평가는 World Benchmarking Alliance (WBA)의 ‘기업 인권 벤치마크 핵심 UNGP 지표’를 기반으로 진행됐다. 특히 국내 기업의 정책 수립 수준... "
2026-04-22,네이버뉴스,"“세계적 랜드마크 만든다”…현대건설, 압구정3구역 ‘ONE City’ 청사진...",https://www.ddaily.co.kr/page/view/2026042210471121679,"현대건설이 압구정3구역 재건축 사업에 미래형 하이엔드 주거 청사진 ‘ONE City’를 제시했다. 압구정 현대의 상징성을 계승하면서 설계와 기술, 라이프스타일까지 아우르는 복합 주거 모델로 차별화에 나섰다.... "
2026-04-22,네이버뉴스,"현대건설, 압구정3구역 ‘ONE City’ 공개…65층·5175가구 청사진",https://www.sedaily.com/article/20035587?ref=naver,"압구정3구역 정비사업 우선협상대상자로 선정된 현대건설(000720)이 22일 기존 압구정 현대아파트의 가치를 계승하는 도시 청사진 ‘원 시티(ONE City)’를 공개했다. 압구정3구역은 현대 1~7차, 10·13·14차, 대림빌라트... "
2026-04-22,네이버뉴스,"입찰 무효 피했지만 신뢰 흠집... DL이앤씨, 압구정5구역 민심 잡을까",https://www.insight.co.kr/news/551095,이번 입찰에는 DL이앤씨와 현대건설이 참여해 경쟁구도가 형성됐다.논란은 양사가 입찰제안서를 개봉하고 내용을 확인하는 과정에서 불거졌다. 이 과정에서 DL이앤씨 측 담당 직원이 펜 카메라로 경쟁사 제안서를 촬영한... 
2026-04-22,네이버뉴스,"국토장관 ""한-베트남 국토교통 분야 협력이 관계 단단히 뒷받침""",https://www.newsis.com/view/NISX20260422_0003601026,"한국토지주택공사(LH)가 추진하고 현대건설과 포스코이앤씨, 오메가건설, 제이알투자운용, 제일건설, 한국해외인프라도시개발지원공사(KIND) 등이 참여한다. 양국 간 인프라 협력에 기여하는 유공자에게 장관 표창도... "
2026-04-22,네이버뉴스,"현대건설 “압구정3구역, ‘단 하나의 대도시’ 완성”",https://biz.heraldcorp.com/article/10722865?ref=naver,"미래 주거 기준 담은 ‘One City’ 청사진 제시 해외 설계 거장 협업, 테마파크형 커뮤니티 도입 DRT 무인셔틀·첨단 로보틱스 적용 눈길 현대건설이 압구정3구역에 제시한 랜드마크설계 [현대건설 제공] [헤럴드경제... "
2026-04-22,네이버뉴스,아파트야? 테마파크야? 돌출테라스에 무인셔틀까지…'공사비 5.5조' 압구...,https://view.asiae.co.kr/article/2026042210391387827,"현대건설은 재건축 사업을 추진 중인 압구정3구역 조합에 제안한 대안설계를 22일 대외적으로 공개했다. 이 사업은 현대1~7차, 10·13·14차, 대림빌라트 등 3934가구를 최고 65층 5175가구 규모로 다시 짓는 대형 정비사업이다.... "
2026-04-22,네이버뉴스,"‘하이앤드 브랜드’, 일반 아파트보다 청약 경쟁률 5배 높았다",https://www.mk.co.kr/article/12023779,"현대건설 ‘디에이치’, 롯데건설 ‘르엘’, DL이앤씨 ‘아크로’, 대우건설 ‘푸르지오 써밋’, 두산건설 ‘위브더제니스’, 포스코이앤씨 ‘오티에르’, SK에코플랜트 ‘드파인’ 등이 포함됐다. 더불어 하이엔드... "
2026-04-22,네이버뉴스,"""들어오지 말란 얘기""…조합 과도한 입찰지침에 건설사 '발끈'",https://news.tf.co.kr/read/economy/2315851.htm,"앞서 성수1지구에서도 조합의 입찰지침이 까다로워 수주를 노리던 현대건설, IPARK현대산업개발이 포기했다. 성수1지구에서는 조합장을 둘러싼 업무상 배임 의혹과 시공사 유착 가능성 논란이 불거지며 경찰이 조합... "
2026-04-22,네이버뉴스,"하이엔드 설계·무인셔틀…현대건설, 압구정3구역 청사진 공개",https://www.dailian.co.kr/news/view/1636403/?sc=Naver,서울 강남구 압구정3구역 정비사업 우선협상대상자에 선정된 현대건설이 22일 사업 청사진 ‘원 시티(ONE City)’를 공개했다. ‘원 시티’는 ▲랜드마크 설계(ONE Scene) ▲초대형 ‘클럽 압구정’ 커뮤니티(ONE Circle) ▲DRT... 
2026-04-22,네이버뉴스,"현대건설, 압구정3구역 '원 시티(ONE City)' 공개…랜드마크·로보틱스·...",http://www.opinionnews.co.kr/news/articleView.html?idxno=137169,"사진제공=현대건설  현대건설이 압구정3구역 정비사업 우선협상대상자로 선정된 가운데, 압구정 현대의 가치를 계승하는 도시 청사진 'ONE City'를 22일 공개했다. 압구정3구역은 현대 1~7차와 10·13·14차, 대림빌라트... "
2026-04-22,네이버뉴스,"지역 시세 이끄는 하이엔드 단지, 입주 전부터 '대장 아파트'로 시장 장...",http://www.ikld.kr/news/articleView.html?idxno=333326,"무엇보다 이 단지는 현대건설의 하이엔드 브랜드 '디에이치'가 적용된 점에서 시장의 인식 자체가 다르다. '디에이치'는 선별된 핵심 입지에만 적용되는 최상위 브랜드로, 설계와 마감, 커뮤니티 구성 등에서 일반 아파트와... "
2026-04-22,네이버뉴스,"""'뷰'가 곧 프리미엄""… 지역 대장주로 떠오른 조망권 아파트",https://www.pinpointnews.co.kr/news/articleView.html?idxno=447566,현대건설 제공 주택시장에서 조망과 쾌적성이 핵심 주거 기준으로 떠오르면서 공원이나 수변을 내려다볼 수 있는 이른바 '조망권 아파트'가 지역 시세를 이끄는 대장주 단지로 주목받고 있다. 22일 업계에 따르면 공원... 
2026-04-22,네이버뉴스,"현대건설, 압구정3구역에 미래 주거 기준 'One City' 청사진 제시",https://www.newspim.com/news/view/20260422000250,"현대건설이 압구정3구역 정비사업 우선협상대상자로 선정된 가운데, 압구정 현대의 가치를 계승하는 도시 청사진 'ONE City'를 22일 공개했다. 압구정3구역 정비사업은 기존 아파트 단지(현대 1~7차, 10·13·14차... "
2026-04-22,네이버뉴스,‘하나뿐인 도시’ 짓겠다… 현대건설 압구정3구역 청사진 공개,https://www.donga.com/news/Economy/article/all/20260422/133788333/1,"현대건설이 압구정3구역 정비사업 우선협상대상자로 선정된 가운데 ‘오운 더 원 (OWN THE ONE)’ 비전과 ‘원 시티(ONE City)’ 개념을 앞세운 미래 주거 청사진을 공개했다. 압구정3구역은 현대 1~7차, 10·13·14차... "
2026-04-22,네이버뉴스,"여의도 광장(38-1)아파트, 용적률 597% 52층으로 재건축 본격화",https://realty.chosun.com/site/data/html_dir/2026/04/22/2026042201474.html,"현재 현대건설을 비롯해 대우건설, 롯데건설에서 관심을 보이는 것으로 나타났다. 1978년 준공한 광장아파트는 여의나루로를 경계로 38-1번지(1·2동)와 28번지(3~11동)가 분리 재건축을 추진하고 있다. 신림선·9호선... "
2026-04-22,네이버뉴스,"[아침저널] 이훈기 ""장동혁 美 정부 관계자 비공개 이해 안돼...준비 하...",https://news.bbsi.co.kr/news/articleView.html?idxno=4079745,"자기 주에 이제 그런 큰 프로젝트가 진행이 되는데 현대건설이 대형 원전 되게 관심을 갖고 지금 여러 가지 일을 하고 있어요. 벌써. 그래서 그 얘기를 했더니, 너무나 좋아하면서 뭘 도와줄 게 뭐가 있겠냐, 그러니까 저희... "
2026-04-22,네이버뉴스,"현대건설, 압구정3구역 제안 ‘OWN THE ONE’ 5대 비전 공개",http://www.lawissue.co.kr/view.php?ud=20260422101604315767191f6c6e_12,"현대건설이 압구정3구역 정비사업 우선협상대상자에 선정된 가운데 압구정 현대의 가치를 계승하는 도시 청사진 ‘ONE City’를 공개했다. 압구정3구역은 현대 1~7차, 10·13·14차, 대림빌라트 등 3,934가구를 최고 65층, 5... "
2026-04-22,네이버뉴스,"""글로벌 기업 참전·단지 무인셔틀""…현대건설, 압구정3구역 청사진 공...",https://www.mt.co.kr/estate/2026/04/23/2026042210003696326,"현대건설이 최근 우선협상대상자로 선정된 압구정3구역 정비사업에 압구정 현대의 헤리티지를 계승하는 '단 하나의 대도시(ONE City)' 청사진을 공개했다고 22일 밝혔다. 압구정3구역은 현대 1~7차, 10·13·14차... "
2026-04-22,네이버뉴스,"현대건설, 압구정3구역에 미래 주거의 기준 'ONE City' 청사진 공개",https://www.betanews.net/article/view/beta202604220012,"현대건설은 시공사 우선협상대상자로 선정된 압구정3구역에 'ONE City'라는 청사진을 적용한다고 22일 밝혔다. 압구정3구역은 현대 1~7차, 10·13·14차, 대림빌라트 등 3,934가구를 최고 65층, 5175가구 규모로 다시... "
2026-04-22,네이버뉴스,"현대건설, 5.5조 '압구정3' 우협⋯'원시티' 청사진 공개",http://www.inews24.com/view/1962348,현대건설이 서울 강남권 핵심 재건축 사업인 압구정3구역에서 정비사업 우선협상대상자로 선정된 가운데 '도시형 단지 원시티(ONE City)' 개념을 전면에 내세우며 사업 청사진을 공개했다고 22일 밝혔다. 압구정3구역은... 
2026-04-22,네이버뉴스,"현대건설, 압구정3구역에 미래 주거 기준 'ONE City' 청사진 제시",https://www.ajunews.com/view/20260422094330197,아주경제=백소희 기자 shinebaek@ajunews.com 현대건설이 압구정3구역에 제시한 랜드마크 설계. [사진=현대건설] 현대건설이 압구정3구역 정비사업 우선협상대상자로 선정된 가운데 ‘ONE City’ 청사진을 22일 공개했다.... 
2026-04-22,네이버뉴스,[기자수첩] '갤러리아 커넥트'는 누구의 것인가,https://www.meconomynews.com/news/articleView.html?idxno=130262,"압구정5구역 수주전, '갤러리아 커넥트' 변수 부상 '단지-백화점-지하철 연결 통로 개설' 여부 관심 한화, ""갤러리아 커넥트, 현대건설과만 협업"" 일부 주민 ""다른 건설사 수주하면 통로 개설 안되나"" ""특정 건설사 선택... "
2026-04-22,네이버뉴스,"현대건설, 압구정3구역 '원 시티' 청사진 공개",https://www.youthdaily.co.kr/news/article.html?no=217843,글로벌 설계사 협업 65층 랜드마크 조성 무인셔틀·로보틱스 등 미래 기술 집약  현대건설이 서울 압구정3구역 재건축 사업의 우선협상대상자로 선정되면서 압구정 현대의 상징성을 계승한 미래형 도시 모델 원 시티... 
2026-04-22,네이버뉴스,조망 가치 부상에 주택시장 기준 변화…공원·수변 조망 단지 강세,https://www.businessplus.kr/news/articleView.html?idxno=110922,힐스테이트 더 운정 전경 이미지./ 사진=현대건설 주택 시장에서 주거 선택 기준이 변화하고 있다. 과거 교통과 가격 중심에서 벗어나 최근에는 조망과 쾌적성이 핵심 요소로 부상하는 흐름이다. 단순한 거주 기능을... 
2026-04-22,네이버뉴스,"쿠팡, 변협 인권평가 '최하위'에 ""명백한 허위 사실"" 반발...변협 ""객관...",http://www.newsian.co.kr/news/articleView.html?idxno=88815,"평가 결과, 현대건설이 1위를 차지했고 LG전자와 네이버, 삼성전자·카카오 등이 상위권에 이름을 올렸다. 반면 쿠팡은 사기업 중 최하위인 40위에 머물렀으며, '거버넌스 및 정책 약속', '기업문화 내재화', '인권 실사' 등... "
2026-04-22,네이버뉴스,평택지제역 복합환승센터 구축 '속도'…현대건설 등과 협력,https://www.sidae.com/article/2026042209370246577,경기 평택시가 현대건설 등 국내 주요 건설사 및 관련 기업 10개사와 평택지제역 복합환승센터 구축을 위한 실무 논의에 들어갔다고 22일 밝혔다. 이번 간담회는 GTX-A·C 노선 연장과 수원발 KTX 개통이 예정된 평택지제역을... 
2026-04-22,네이버뉴스,[빅데이터투데이] 하이엔드 주거 2026년 4월 브랜드평판 랭킹... 1위 현대...,https://www.fntoday.co.kr/news/articleView.html?idxno=382794,"하이엔드 주거 브랜드평판 2026년 4월 빅데이터 분석결과, 1위 현대건설 디에이치 브랜드로 분석됐다. 한국기업평판연구소는 10개 하이엔드 주거 브랜드에 대해서 빅데이터 분석을 활용한 브랜드 평판조사를... "
2026-04-22,네이버뉴스,"현대건설, 압구정3구역에 미래형 도시 'ONE City'",https://www.newsclaim.co.kr/news/articleView.html?idxno=3061489,"현대건설,이한우 현대건설(대표 이한우)이 압구정3구역 정비사업 우선협상대상자로 선정됨에 따라 압구정 현대의 가치를 계승한 미래 주거 청사진 'ONE City'를 공개했다. 현대건설 제공 현대건설(대표 이한우)이... "
2026-04-22,네이버뉴스,"현대건설, 압구정3구역 청사진 공개…'ONE City' 재탄생",https://www.news1.kr/realestate/general/6144804,"현대건설(000720)은 시공사 우선협상대상자로 선정된 압구정3구역에 'ONE City'라는 청사진을 적용한다고 22일 밝혔다. 압구정3구역은 현대 1~7차, 10·13·14차, 대림빌라트 등 3,934가구를 최고 65층, 5175가구... "
2026-04-22,네이버뉴스,"압구정3구역 '단 하나의 도시'로···현대건설, ONE City 비전 공개",http://www.finomy.com/news/articleView.html?idxno=253481,"현대경제신문 임이랑 기자 | 현대건설이 서울 강남구 압구정3구역 재건축 사업의 우선협상대상자로 선정되면서, 압구정 현대의 헤리티지를 계승하는 도시 청사진 'ONE City'를 공개했다. 22일 현대건설에 따르면... "
