date,source,title,link,description
2026-04-26,네이버뉴스,[HMM50년 돌아보기-24] ‘꿈’을 ‘현실’로 만든 금강산관광 사업,http://www.thebigdata.co.kr/view.php?ud=202604261044019361570d99e4c8_23,"결국 현대건설이 장비와 인력을 북한으로 보내 장전항 접안시설 공사를 벌였다. 접안시설이 완공된 1999년 10월까지는 외항에 임시 정박시설을 만들고, 거기서부터는 별도의 부속선으로 승객을 실어 나르는 번거로움을... "
2026-04-26,네이버뉴스,‘압여목성’ 건설사 브랜드 전쟁 이어진다…“첫 깃발 꽂아야”,http://www.edaily.co.kr/news/newspath.asp?newsid=01433366645420056,압구정5구역에서는 DL이앤씨의 ‘아크로 압구정’과 현대건설의 ‘압구정 현대 갤러리아’가 맞붙었다. DL이앤씨는 아크로를 적용했지만 현대건설은 하이앤드 브랜드인 디에이치 대신 ‘압구정 현대’를 선택했다.... 
2026-04-26,네이버뉴스,베트남서 '팀코리아' 깃발은 들었지만…시공사 선정은 안갯속,https://news.einfomax.co.kr/news/articleView.html?idxno=4411692,다만 삼성물산과 바라카 원전 사업에서 호흡을 맞췄던 현대건설[000720]은 상대적으로 미온적인 입장을 보이고 있다. 현대건설 측은 현재 베트남 원전 사업보다는 미국과 유럽 등지에서 단독 수주를 목표로 하고 있다는... 
2026-04-26,네이버뉴스,생산적금융 트렌드 된 기업-은행 간 '절친 인증'…MOU로 딜 선점,https://news.einfomax.co.kr/news/articleView.html?idxno=4411691,"신한은행은 지난 2월에도 현대건설과 생산적 금융 협력을 위한 MOU를 체결했다. 양사는 이를 통해 데이터센터, 신재생에너지, 환경·인프라, 전력 중개 등 현대건설의 미래 전략 산업에서 협력하기로 했다. 생산적 금융을... "
2026-04-26,네이버뉴스,"""가장 위험한 발전원?"" ""폐쇄는 엄청난 실수였다""…전쟁이 드러낸 '원전...",https://view.asiae.co.kr/article/2026042318244316505,"특히 현대건설(목표주가 30만원)에 대해 원전 시공 경험과 중동 재건 물량을 바탕으로 실적 정상화가 기대된다고 평가했다. 데이터센터가 부른 선박 엔진의 화려한 외출 전쟁이 에너지 전환의 속도를 높였다면, 인공지능... "
2026-04-26,네이버뉴스,美·이란 2차 협상 무산…밸류에이션 부담·실적 기대 '교차' [주간전망...,https://www.hankyung.com/article/2026042444996,"오는 28일 삼성SDI·현대건설·HD현대일렉트릭, 29일 삼성전기·LG에너지솔루션·한화에어로스페이스 실적이 발표된다. 강 연구원은 ""이번주 실적 발표를 통해 조선·방산·전력기기 업황 호조가 지속될지 판단할 수 있을 것... "
2026-04-26,네이버뉴스,[한강벨트 잡아라④] 서울 핵심 재건축 삼각축 들썩···여의도·목동·...,https://www.seoulfn.com/news/articleView.html?idxno=627395,"정비업계에 따르면 삼성물산, 현대건설, 대우건설 등 시공능력평가 상위 3사가 물밑 경쟁을 벌이고 있으며, 오는 6월 시공사 선정이 예정돼 있다. 대교아파트는 여의도 내 가장 먼저 시공사 선정을 마쳤다. 지하 5층... "
2026-04-26,네이버뉴스,한강변 정비사업 수주전 이상 과열 [데스크칼럼],https://www.sisaon.co.kr/news/articleView.html?idxno=200355,지난 10일 입찰장에서 현대건설과 DL이앤씨 관계자들이 밀봉된 서류를 확인하고 입찰참여견적서 등 입찰서류를 상호 날인하는 과정에서  DL이앤씨 측 직원이 펜카메라를 이용해 현장을 몰래 촬영하다 적발됐다. 강남구청은... 
2026-04-26,네이버뉴스,"HD건설기계, 인도 고객 한국 초청 'VIP 투어' 진행…핵심 시장 파트너십...",https://www.theguru.co.kr/news/article.html?no=100973,"(8~50t) 굴착기 시장 점유율 22%를 기록, 일본 히타치를 제치고 1위를 탈환했다. HD현대건설기계는 최근 인도 내 주요 고객과 귀빈들을 대상으로 'VIP 투어 2026, 대한민국' 프로그램을 진행했다. (사진=HD현대건설기계 인도법인)"
2026-04-26,네이버뉴스,"수도권 청약 흥행 키워드, 여전히 '역세권'",https://www.newsway.co.kr/news/view?ud=2026042411294331885,"현대건설이 서울 동작구 사당동에 선보인 '힐스테이트 이수역센트럴'은 326.74대 1, 포스코이앤씨가 경기 성남시 분당구 정자동에 공급한 '더샵 분당티에르원'도 237.53대 1의 경쟁률로 청약 상위권에 이름을 올렸다. 두... "
