date,source,title,link,description
2026-04-09,네이버뉴스,3.4조 '신안우이 해상풍력' 금융단 구성 완료…자금 투입 시작,https://view.asiae.co.kr/article/2026040914191366695,"이날 행사에는 권대영 금융위 부위원장을 비롯해 관계부처와 산은 등 주요 금융기관, 한화오션·한국중부발전·SK이터닉스·현대건설 등 사업 참여 기업 관계자들이 참석했다. 이번 약정식은 지난 1월... "
2026-04-09,네이버뉴스,‘신안우이 해상풍력’ 사업 금융단 구성…자금 본격 투입,https://zdnet.co.kr/view/?no=20260409141045,한화오션·한국중부발전·SK이터닉스·현대건설 등 출자자 관계자가 참석했다. 이날 약정식은 지난 1월 첨단전략산업 기금운용심의회에서 처음으로 자금 지원을 승인한 ‘신안우이 해상풍력 발전사업’을 위한 금융단... 
2026-04-09,네이버뉴스,"현대건설, 건설안전 혁신기업 7곳 선정...오픈이노베이션 확대",https://www.joongangenews.com/news/articleView.html?idxno=510260,|중앙이코노미뉴스 송태원 기자|현대건설 계동 사옥.[사진=현대건설] 현대건설이 건설 현장 안전 혁신 기술 도입을 위한 오픈이노베이션 프로그램을 통해 협력 생태계 확대에 나섰다. 현대건설은 '2026 H-Safe Open... 
2026-04-09,네이버뉴스,"금융사 모은 현대건설, 압구정 3·5구역서 프라이빗 자산관리 센터 만든...",https://www.mediapen.com/news/view/1092305,현대건설이 서울 압구정 3·5구역에 금융권 자산관리 거점을 한데 모아 입주민 전용 서비스로 제공하는 새로운 주거 모델을 선보인다. 압구정 3·5구역 자산관리 특화 점포 이미지./사진=현대건설 현대건설은 신한은행... 
2026-04-09,네이버뉴스,"신한은행, '압구정 현대' 재건축 단지에 '자산관리 특화거점' 구축",https://www.joongangenews.com/news/articleView.html?idxno=510338,|중앙이코노미뉴스 문혜원 기자|신한은행은 현대건설과 전략적 업무협약을 체결하고 압구정 재건축 단지를 중심으로 주거와 금융을 결합한 새로운 자산관리 모델을 도입한다. [사진=신한은행]  신한은행은 현대건설과... 
2026-04-09,네이버뉴스,'국민성장펀드 1호' 신안우이 해상풍력 본궤도…PF 2.9조 순차 집행,https://www.etoday.co.kr/news/view/2574309,"약정식에는 권대영 금융위 부위원장과 심진수 기후에너지환경부 재생에너지정책관을 비롯해 박상진 산업은행 회장, 이환주 KB국민은행장 등 대주단 기관장과 한화오션·한국중부발전·SK이터닉스·현대건설 등... "
2026-04-09,네이버뉴스,"'국내 최대' 신안우이 해상풍력 PF 체결…중부발전, 2029년 상업운전",https://www.ajunews.com/view/20260409104151501,"중부발전과 한화오션, SK이터닉스, 현대건설 등이 참여해 하부 구조물 등 주요 기자재 공급 전반을 국내 기업이 담당한다. 특히 이번 사업을 위해 국내 최초로 건조되는 15㎿급 해상풍력터빈 설치선(WTIV)은 향후 국내... "
2026-04-09,네이버뉴스,신안우이 해상풍력 PF 약정 체결…국민성장펀드 1호 사업 가동,http://www.metroseoul.co.kr/article/20260409500153,"이날 행사에는 권대영 금융위 부위원장, 심진수 기후에너지환경부 재생에너지정책관을 비롯해 산업은행, KB국민은행 등 대주단과 한화오션, 한국중부발전, SK이터닉스, 현대건설 등 사업 참여기관 관계자들이... "
2026-04-09,네이버뉴스,대규모 해상풍력 발전사업 본격화…금융단 구성 완료,https://www.mediapen.com/news/view/1092321,"SK이터닉스, 현대건설 등 관계자가 참석했다. 이번 약정식은 지난 1월 첨단전략산업기금운용심의회에서 처음으로 자금 지원을 승인한 ‘신안우이 해상풍력 발전사업’을 위한 금융단 구성이 완료됨으로써 산업현장에... "
2026-04-09,네이버뉴스,"""뭐? 야당이 반대한다고 못해?"" 불같이 화낸 박정희…경부고속도로의 탄...",https://www.hankookilbo.com/news/article/A2026040911540005635?did=NA,"박정희는 비공개로 경제기획원, 건설부, 재무부, 서울시청, 현대건설, 육군 공병감실에 430㎞ 경부고속도로 구간의 건설비용을 계산해 보고하라고 지시했는데 180억 원에서 490억 원 범위의 보고가 올라왔다.... "
2026-04-09,네이버뉴스,첨단전략산업기금·5대 금융지주 뭉쳤다…신안우이 해상풍력 PF 금융단...,http://www.edaily.co.kr/news/newspath.asp?newsid=03880246645414480,"SK이터닉스, 현대건설 등 사업수행기관 대표 등이 참석했다. 이번 약정식은 지난 1월 첨단전략산업기금운용심의회에서 처음으로 자금 지원을 승인한 신안우이 해상풍력 발전사업을 위한 금융단 구성이 완료되며... "
2026-04-09,네이버뉴스,국민성장펀드 1호 '신안우이 해상풍력' 금융약정…2분기 자금집행 돌입,https://www.newsis.com/view/NISX20260409_0003584430,"또 한화오션, 한국중부발전, SK이터닉스, 현대건설 등 사업 수행기관 대표도 모였다. 신안우이 해상풍력 발전사업은 전라남도 신안군 우이도 남측 해상에 390㎿급 대규모 해상풍력 발전소를 건설·운영하는 사업이다.... "
2026-04-09,네이버뉴스,"신한은행, 현대건설과 손잡고 압구정 재건축 단지 내 특화 거점 구축",https://biz.sbs.co.kr/article_hub/20000303211?division=NAVER,신한은행이 현대건설과 손잡고 서울 압구정 재건축 단지를 중심으로 주거와 금융을 결합한 새로운 자산관리 모델을 도입한다고 오늘(9일) 밝혔습니다. 신한은행은 현대건설과 협력해 압구정 재건축 단지 내 입주민을... 
2026-04-09,네이버뉴스,"""압구정 잡아라""…신한銀, 현대건설 손잡고 '주거+금융' 선점 승부수",https://www.newsworks.co.kr/news/articleView.html?idxno=837246,9일 금융권에 따르면 신한은행은 현대건설과 전략적 업무협약을 체결하고 압구정 재건축 단지를 중심으로 주거와 금융을 결합한 자산관리(WM) 모델을 도입한다. 압구정 3·5구역 재건축은 강남권 최대 정비사업으로... 
2026-04-09,네이버뉴스,'국민성장펀드 1호' 신안우이 해상풍력 2.89조 자금 지원한다,https://www.news1.kr/finance/general-finance/6130687,"SK이터닉스, 현대건설 등 사업수행기관 대표 등이 참석했다. 이번 약정식은 지난 1월 첨단전략산업기금운용심의회에서 처음으로 자금 지원을 승인한 '신안우이 해상풍력 발전사업'을 위해, 금융단 구성을 완료함으로써... "
2026-04-09,네이버뉴스,"현대건설, 압구정 3·5구역에 자산관리센터 유치",https://it.chosun.com/news/articleView.html?idxno=2023092160095,"현대건설은 압구정 3·5구역에 8개 주요 금융사의 자산관리 특화 점포를 유치해 입주민 전용 '원스톱 자산관리 서비스'를 제공할 계획이라고 9일 밝혔다. 참여 금융사는 신한은행, 하나은행, 우리은행, SC제일은행 등 은행... "
2026-04-09,네이버뉴스,상한가 쏘아올린 건설주 “더 간다”…목표가 2배 상향 릴레이,https://www.mk.co.kr/article/12012466,"대우건설, 삼성E&A는 상승세를 이어가는 반면 GS건설, 현대건설 등은 5%대 하락세를 보이며 숨 고르기에 들어간 모습이다. 다만 증권가에서는 15년 만에 건설업 주가순자산비율(PBR)이 코스피를 추월하는 등 ‘구조적... "
2026-04-09,네이버뉴스,[특징주] 중동 재건 수혜주는?…삼성E&A·현대건설·대우건설·GS건설·D...,http://www.newstnt.com/news/articleView.html?idxno=605984,"기업별로는 현대건설, 대우건설, GS건설, 삼성E&A, DL이앤씨 순으로 리스크 관리가 필요한 상황으로 평가됐다. 보고서에 따르면 전쟁으로 인해 훼손된 중동 내 주요 시설물은 약 27개로 추정된다. 재건 수주가... "
2026-04-09,네이버뉴스,"압구정4 '무혈입성' 눈앞… 삼성물산, 아낀 화력으로 '10조 수주' 도전",https://www.mediapen.com/news/view/1092308,여의도 시범 재건축(예상공사비 1조 원)에서는 현대건설 대우건설을 상대할 것으로 보인다. 이들을 확보한다면 삼성물산의 올해 정비사업 목표액인 7조7000억 원을 넘어 10조 원 달성까지 조심스레 점쳐지고 있다.... 
2026-04-09,네이버뉴스,"정원주 대우건설 회장, 건축 거장 도미니크 페로와 협력 논의 [건설·분...",https://www.sisaon.co.kr/news/articleView.html?idxno=200072,"현대건설, 압구정3·5구역 상업시설에 금융사 자산관리 센터 결집 현대건설은 압구정3구역과 5구역에 신한은행과 신한투자증권을 포함한 8개 주요 금융사의 자산관리 특화 점포를 유치해 입주민 전용 자산관리 서비스를... "
2026-04-09,네이버뉴스,"“안전문화 확산”…현대건설, 건설안전 문화 주도할 혁신기업 7곳 선정",https://www.mk.co.kr/article/12012458,현대건설이 건설 현장 안전문화 확산 및 안전사고 예방을 위해 ‘2026 H-Safe Open Innovation Challenge’ 공모전에서 건설안전 혁신기업 7개사를 최종 선정했다고 9일 밝혔다. 올해 처음으로 개최된 본 공모전은 정부와 지자체... 
2026-04-09,네이버뉴스,"현대건설, 압구정 3·5구역에 주요 금융사 자산관리센터 유치",https://www.viva100.com/article/20260409500816,"현대건설은 신한은행, 신한투자증권을 포함한 8개 주요 금융사의 자산관리 특화 점포를 압구정 3·5구역에 유치하고 입주민 전용 ‘원스톱 자산관리 서비스’를 제공할 계획이라고 9일 밝혔다. 자산관리센터는 고액 자산가... "
2026-04-09,네이버뉴스,"신한은행·현대건설, 재건축 단지 내 입주민 특화 자산관리 제공",https://www.g-enews.com/view.php?ud=202604091331491219bb91c46fcd_1,신한은행이 현대건설과 함께 주거와 금융이 결합된 새로운 자산관리 모델을 선보인다. 9일 금융권에 따르면 신한은행이 현대건설과 전략적 업무협약을 맺고 압구정 재건축 단지를 중심으로 주거와 금융을 결합한... 
2026-04-09,네이버뉴스,"현대건설, 건설안전 혁신기업 7개사 선정…안전기술 실증 공동 추진",https://www.mt.co.kr/estate/2026/04/09/2026040910002179226,현대건설이 건설안전 혁신기업 7곳과의 협업에 나선다. 현대건설은 '2026 H-Safe 오픈 이노베이션 챌린지'(Open Innovation Challenge) 공모전을 통해 건설안전 혁신기업 7개사를 최종 선정했다고 9일 밝혔다. 이번 공모전은 정부... 
2026-04-09,네이버뉴스,"신한은행·현대건설, 압구정 재건축 중심 '주거 결합형 자산관리' 모델...",https://www.public25.com/news/articleView.html?idxno=43726,퍼블릭타임스=신한은행이 현대건설과 손잡고 고급 주거단지 입주민을 위한 '주거 결합형 자산관리' 모델을 선보인다. 서울 압구정 재건축 단지를 중심으로 자산관리 특화 거점을 구축하고 금융·부동산·세무 등을... 
2026-04-09,네이버뉴스,"현대건설, 건설안전 혁신기업 7개사 선발…기술 및 서비스 실증 공동 추...",https://www.100ssd.co.kr/news/articleView.html?idxno=208007,현대건설이 건설 현장 안전문화 확산을 위해 마련한 '2026 H-Safe Open Innovation Challenge' 공모전에서 혁신기업 최종 7개사를 선발했다. 현대건설은 선발된 기업들과 이달부터 6월까지 약 3개월간 현대건설 안전품질본부와... 
2026-04-09,네이버뉴스,대우건설 상승 반해 DL이앤씨·현대건설 하락에 급락,http://www.econonews.co.kr/news/articleView.html?idxno=434891,"대우건설 주가흐름 (그래픽=네이버페이 증권 캡처) 현대건설, DL이앤씨, 대우건설 등 건설주의 희비가 엇갈리고 있다. 대우건설은 9일 코스피 시장에서 오후 1시34분 현재 전 거래일보다 3.33%(750원) 상승한... "
2026-04-09,네이버뉴스,"신한은행-현대건설, 압구정 재건축에 '주거·금융 결합' 자산관리 모델...",https://www.pointe.co.kr/news/articleView.html?idxno=78168,"신한은행은 현대건설과 전략적 업무협약을 체결하고, 현대건설의 하이엔드 주거 브랜드 '디에이치(THE H)'가 적용되는 단지를 중심으로 주거와 금융을 결합한 차세대 자산관리 모델을 전격 도입한다고 9일 밝혔다.... "
2026-04-09,네이버뉴스,"신한은행, 현대건설과 MOU...자산관리 특화 거점 구축",https://thetracker.co.kr/View.aspx?No=4035881,더트래커 박민정 기­자 mjp@thetracker.co.kr 더트래커 = 박민정 기자신한은행이 현대건설과 손잡고 주거와 금융을 결합한 새로운 자산관리 모델을 도입한다. 신한은행은 현대건설과 전략적 업무협약을 체결했다고 9일 밝혔다.... 
2026-04-09,네이버뉴스,"현대건설, 건설안전 문화 주도할 혁신기업 7곳 선정",https://www.getnews.co.kr/news/articleView.html?idxno=867358,"현대건설이 건설 현장 안전문화 확산 및 안전사고 예방을 위해 '2026 H-Safe Open Innovation Challenge' 공모전에서 건설안전 혁신기업 7개사를 최종 선정했다고 9일 밝혔다. 올해 첫 개최된 이번 공모전은 정부와 지자체, 민간... "
2026-04-09,네이버뉴스,"[건설 Pick] 삼성물산·포스코이앤씨·현대건설, 기술력·품격·안전으로...",https://www.lcnews.co.kr/news/articleView.html?idxno=200481,"◆ 현대건설, 안전 혁신 기업 7개사 선정해 '스마트 안전' 생태계 구축 현대건설은 '2026 H-Safe Open Innovation Challenge'를 통해 건설 안전 혁신 기술을 보유한 기업 7곳을 최종 선발했다. AI CCTV, 건설 로봇, 안전 교육 플랫폼 등... "
2026-04-09,네이버뉴스,"신한은행, 압구정 재건축에 '주거 결합형 자산관리' 도입",https://www.sentv.co.kr/article/view/sentv202604090104,서울경제티브이 이정민 기자 신한은행은 현대건설과 압구정 재건축 단지를 중심으로 주거와 금융을 결합한 새로운 자산관리 모델을 도입한다고 9일 밝혔다. 이번 협약은 압구정 현대를 비롯해 현대건설의 하이엔드 주거... 
2026-04-09,네이버뉴스,"신한은행, 현대건설과 '맞손'...주거 결합형 자산관리 모델 도입",http://www.choicenews.co.kr/news/articleView.html?idxno=163574,"신한은행(은행장 정상혁)은 ""현대건설(대표이사 이한우)과 전략적 업무협약(MOU)을 체결하고, 압구정 재건축 단지를 중심으로 주거와 금융을 결합한 새로운 자산관리 모델을 도입한다""고 9일 밝혔다. 신한은행에 따르면... "
2026-04-09,네이버뉴스,"압구정 '디에이치', 자산관리 오피스가 커뮤니티 안으로",https://www.smarttoday.co.kr/ko-kr/articles/106338,신한은행은 현대건설과 전략적 업무협약을 체결하고 압구정 재건축 단지를 중심으로 주거와 금융을 결합한 새로운 자산관리 모델을 도입한다고 9일 밝혔다. 압구정 현대를 비롯해 현대건설의 하이엔드 주거 브랜드... 
2026-04-09,네이버뉴스,"주거와 금융의 결합…현대건설, 압구정 3·5구역 '자산관리 서비스' 차별...",http://www.newslock.co.kr/news/articleView.html?idxno=128361,현대건설이 압구정 3·5구역 수주를 위해 '주거와 금융'의 결합이라는 초강수를 뒀다. 단순 시공을 넘어 단지 내 자산관리센터(WM) 입점이라는 파격적인 제안을 통해 고액 자산가 표심 공략과 단지 럭셔리화라는 두 마리... 
2026-04-09,네이버뉴스,"현대건설, ‘안전 스타트업 7곳’ 선발…현장 실증·도입 본격화",https://www.fetv.co.kr/news/article.html?no=216641,"110개사 경쟁 뚫고 선정, AI CCTV·로봇·교육 플랫폼 등 기술 검증 3개월 실증 후 현장 적용·투자 연계, 오픈이노베이션 확대  현대건설이 건설현장 안전 기술 도입을 위한 오픈이노베이션 프로그램을 통해 유망 스타트업... "
2026-04-09,네이버뉴스,"현대건설, 압구정 3·5구역에 '단지내 금융 허브' 구축…공동주택 첫 시...",https://www.thefairnews.co.kr/news/articleView.html?idxno=73929,현대건설이 서울 압구정 재건축 사업지에서 주거 서비스의 패러다임을 바꿀 파격적인 제안을 내놨다. 단지 외부 상업지구에 흩어져 있던 프리미엄 자산관리(WM) 센터를 단지 안으로 끌어들여 입주민들이 집 앞에서 전문... 
2026-04-09,네이버뉴스,중동전쟁發 건설현장 자재수급난 파장은?,http://www.kmecnews.co.kr/news/articleView.html?idxno=46477,"그나마 현대건설 등 일부 대형 건설사가 정비사업 조합을 대상으로 공사비 증액과 공기 연장을 요청하고 있다. 그러나 발주처가 이를 불가항력 사유로 인정하는 데는 신중한 분위기여서, 자재비 상승분 반영과 공기... "
2026-04-09,네이버뉴스,중동 재건 18조 수주 가능… 삼성E&A·현대건설 등 채비,https://www.ilovepc.co.kr/news/articleView.html?idxno=58917,전쟁 피해 복구비 최소 250억달러 원시공 이력·PM 역량 앞서 … 韓 수주 경쟁 우위 현대건설 804억달러 등 누적 수주도 어필 에너지 인프라 우선 … 삼성E&A 1순위 수혜 삼성E&A가 진행하고 있는 바레인 국영석유회사... 
2026-04-09,네이버뉴스,"현대건설, 압구정 3·5구역 PB 자산관리센터 집중 유치",https://www.womentimes.co.kr/news/articleView.html?idxno=102049,우먼타임스 = 송현섭 기자 현대건설은 압구정 3·5구역에 국내 공동주택으로는 최초로 금융권 프라이빗 자산관리 센터를 집중 유치해 원스톱 자산관리 서비스를 제공한다고 9일 밝혔다. 이를 위해 현대건설은 이날... 
2026-04-09,네이버뉴스,"'삼전 다음 타자를 찾아라!' 대우건설 29% 급등 ""건설주 지금 사도 돼?""",https://radio.ytn.co.kr/program/?f=2&id=108240&s_mcd=0206&s_hcd=15,"그리고 우리가 대우건설 같은 경우, 현대건설에 뒤이어서 대표적인 원전 관련주들. 그리고 이런 것들이 나타나면서 대우건설이 다른 건설사보다 가장 먼저 주가가 움직인 현대건설 다음으로 주가가 움직이기 시작했고... "
2026-04-09,네이버뉴스,[건설업계 동향] 현대건설ㆍIPARK현대산업개발ㆍ포스코이앤씨ㆍGS건설(...,http://www.weeklytoday.com/news/articleView.html?idxno=770152,"■ 현대건설, '2026 H-Safe' 건설안전 혁신기업 7개사 최종 선정 - 110개사 지원, 4개 부문 선발...AI CCTV·건설 로봇 등 혁신 기술 검증 - 6월까지 3개월간 기술 실증(PoC) 진행 후 현장 도입 및 투자 검토 - 국토부·서울시... "
2026-04-09,네이버뉴스,"양산 황전·덕산아파트 주민, 코윈 시행 아파트 공사 반발 집회",https://www.newspim.com/news/view/20260409000708,㈜코윈이 시행하고 현대건설이 시공하는 경남 양산시 물금읍 가촌리와 범어리 일원의 아파트 건립공사가 인근 아파트 거주 주민들과 통행로 폐쇄에 대한 마찰로 논란이 일고 있다. 황전아파트과 덕산아파트 주민 30여... 
2026-04-09,네이버뉴스,"기술 역량 '향상' 위한 노력 지속 …건설업계, 녹색기술인증 취득 등 행...",https://www.cstimes.com/news/articleView.html?idxno=701409,현대건설은 건설 현장 안전문화 확산 및 안전사고 예방을 위해 '2026 H-Safe Open Innovation Challenge' 공모전에서 건설안전 혁신기업 7개사를 최종 선정했다. 이번 공모전은 올해 처음으로 진행됐다. 오픈이노베이션... 
2026-04-09,네이버뉴스,"현대건설 ""안전기술 선도""...혁신기업 7곳 선정",https://www.hankyung.com/article/202604099507i,"현대건설은 ‘2026 H-Safe Open Innovation Challenge’ 공모전을 열고 건설안전 혁신기업 7개 사를 최종 선정했다고 9일 밝혔다. 공모전은 정부와 지자체, 민간 건설사가 협력해 건설 현장 내 안전사고를 예방하기 위해... "
2026-04-09,네이버뉴스,하청 교섭요구 1000곳 육박…‘교섭 쪼개기’로 더 늘듯 [노란봉투법 시...,https://biz.heraldcorp.com/article/10713522?ref=naver,현대차를 비롯해 현대모비스·한화오션·HD현대중공업·현대건설·한국타이어·한국GM 등 자동차·조선·건설 업종에서 두드러졌다. 한국노총 산하 노동자 단체들 역시 포스코·쿠팡CLS·서울교통공사·한국철도공사... 
2026-04-09,네이버뉴스,"현대건설, 압구정 3·5구역에 '자산관리센터' 들인다…차별화 전략",https://www.newsis.com/view/NISX20260409_0003584377,"현대건설이 압구정 재건축 사업에 금융권 자산관리 서비스를 결합한 차별화 전략을 내세운다. 현대건설은 9일 신한은행, 신한투자증권을 포함한 8개 주요 금융사의 자산관리 특화 점포를 압구정 3·5구역에 유치하고... "
2026-04-09,네이버뉴스,"현대건설, 협업기회 제공 건설안전 혁신기업 7곳 최종 선정",https://www.womentimes.co.kr/news/articleView.html?idxno=102048,"우먼타임스 = 송현섭 기자 현대건설은 건설 현장의 안전문화 확산, 안전사고 예방을 위해 '2026 H-Safe Open Innovation Challenge' 공모전에서 건설안전 혁신기업 7개사를 최종 선정했다고 9일 밝혔다. 올해 첫 공모전은 정부와... "
2026-04-09,네이버뉴스,"[TOP's Pick] [건설] 정원주 대우건설 회장, 프랑스 건축 거장 페로와 면...",https://www.topdaily.kr/articles/109613,"한 줄 코멘트 => 지구 살리는 친환경 경쟁력 ◆ 현대건설 , 건설안전 문화 주도할 혁신기업 7곳 선정 현대건설이 건설 현장 안전문화 확산 및 안전사고 예방을 위해 ‘2026 H-Safe Open Innovation Challenge(H-세이프 오픈... "
2026-04-09,네이버뉴스,압구정 3·4·5구역 시공사 내달 윤곽…대형사들 '쩐의 전쟁',https://www.newsis.com/view/NISX20260409_0003584177,"업계에서는 현대건설의 단독입찰을 예상하고 있다. 다만 현행법상 시공사 입찰에 2곳 미만의 업체가 참여하면 유찰되며, 2회 이상 유찰될 경우 조합이 단독 응찰 업체와 수의계약을 맺을 수 있다. 압구정 3구역은... "
2026-04-09,네이버뉴스,"현대건설, 압구정3·5구역에 금융사 자산관리센터…주거 서비스 확장",https://www.news1.kr/realestate/general/6130831,현대건설(000720)은 8개 주요 금융사의 자산관리 특화 점포인 금융권 프라이빗 자산관리 센터를 압구정 3·5구역에 유치한다고 9일 밝혔다. 금융권 프라이빗 자산관리 센터는 입주민 전용 '원스톱 자산관리 서비스'를... 
2026-04-09,네이버뉴스,"압구정 3·5구역 '프라이빗 자산관리 센터' 결집···현대건설, 공동주...",http://www.enewstoday.co.kr/news/articleView.html?idxno=2416820,"현대건설이 압구정 3·5구역에 공동주택 최초로 금융권 프라이빗 자산관리 센터를 결집한다. 현대건설은 9일 신한은행, 신한투자증권을 포함한 8개 주요 금융사의 자산관리 특화 점포를 압구정 3·5구역에 유치하고 입주민... "
2026-04-09,네이버뉴스,"현대건설, 건설안전 문화 주도 혁신기업 7곳 선정…PoC 공동 추진",https://www.newsis.com/view/NISX20260409_0003584299,"현대건설이 건설 현장 안전문화 확산 및 안전사고 예방을 위한 ‘2026 H-Safe Open Innovation Challenge’ 공모전에서 건설안전 혁신기업 7개사를 최종 선정했다고 9일 밝혔다. 올해 첫 개최된 본 공모전은 정부와 지자체, 민간... "
2026-04-09,네이버뉴스,"국민연금, 엔터 대신 증권주 눈길...5% 이상 비중 보유 종목도 ↑",https://www.financialpost.co.kr/news/articleView.html?idxno=254865,"참고로 이 회사는 현대건설기계로 연초 통합된 바 있다. 종목 구성과는 달리, 기존 두산인프라코어 시절부터 쌓아와 HD현대인프라코어에서 강화돼 온 브랜드효과가 있기 때문에, 시장에서는 투 브랜드 병행을 한다.... "
2026-04-09,네이버뉴스,태영건설우 주가 폭등랠리...자산 매각 가시화 부각,https://www.pinpointnews.co.kr/news/articleView.html?idxno=444142,"현대건설은 3.97% 하락한 18만 1200원에 거래 중이다. 현대건설우 역시 동반 하락 중이다. 한미글로벌과 동부건설우는 낙폭을 키우며 거래 중이다. 증시 전문가들은 건설 업종에 대해 내수보다는 해외, 주택보다는... "
2026-04-09,네이버뉴스,"현대건설, 압구정 3·5구역 '자산관리 특화 단지'로",https://www.bizwork.co.kr/news/articleView.html?idxno=414370,현대건설이 압구정 3·5구역에 금융권 자산관리센터를 도입해 입주민 전용 프리미엄 금융 서비스를 제공할 계획이다. 현대건설은 신한은행과 신한투자증권을 포함한 8개 주요 금융사의 자산관리 특화 점포를 단지 내... 
