date,source,title,link,description
2026-04-22,네이버뉴스,"현대건설, 압구정3구역 '원시티' 공개···미래 주거 새 기준 제시",https://www.greened.kr/news/articleView.html?idxno=339657,"현대건설이 압구정3구역 정비사업의 우선협상대상자로 선정된 가운데, 압구정 현대의 전통을 이어가면서도 미래 지향적인 주거 모델을 담은 'ONE City' 청사진을 공개했다. 압구정3구역은 기존 현대 1~7차, 10·13·14차... "
2026-04-22,네이버뉴스,"현대건설, 압구정3구역 우선협상대상자 선정···'ONE City' 청사진 공개",https://www.smartbizn.com/news/articleView.html?idxno=142435,| 스마트비즈 = 최형호 기자 | 현대건설이 서울 강남구 압구정3구역 재건축 사업 우선협상대상자로 선정되며 압구정 일대 재편 구상에 속도를 내고 있다. 해당 사업은 압구정 현대아파트를 포함한 노후 단지를 최고... 
2026-04-22,네이버뉴스,"현대건설, 'ONE City' 공개...압구정3구역 미래형 주거 청사진 제시",https://www.joongangenews.com/news/articleView.html?idxno=513959,|중앙이코노미뉴스 송태원 기자|압구정 정비사업에 제시하는 'OWN THE ONE' 비전.[사진=현대건설]  현대건설이 22일 미래형 주거 청사진 'ONE City'를 공개했다. 압구정3구역 정비사업 우선협상대상자로 선정된 가운데... 
2026-04-22,네이버뉴스,"한국부동산마케팅협회, 10대 건설사 실무진과 '2026년 정책간담회' 개최",https://www.newspim.com/news/view/20260422001057,"간담회에는 현대건설, DL이앤씨 등 10개 주요 건설사 마케팅 담당자가 참석했다. 한국부동산마케팅협회가 22일 서울 강남구 건설회관에서 2026년 정책간담회를 진행하고 있다. [사진=한국부동산마케팅협회] 첫 번째... "
2026-04-22,네이버뉴스,"현대건설, 압구정3구역 'ONE City' 공개…5.6조 초대형 재건축 승부수",http://www.4th.kr/news/articleView.html?idxno=2110817,포쓰저널 이현민 기자 이미지=현대건설 현대건설이 서울 강남 압구정3구역 재건축 사업 우선협상대상자 선정 직후 'ONE City' 청사진을 공개하며 조합원 표심 잡기에 나섰다. 단순한 고급 설계 제안을 넘어 커뮤니티... 
2026-04-22,네이버뉴스,"현대건설, 압구정3구역 청사진 '원 시티' 공개…""대한민국 주거의 새 기...",https://www.socialvalue.kr/news/view/1065594812734576,▲ 현대건설이 압구정3구역에 제시한 랜드마크 설계. /사진=현대건설 제공 현대건설이 압구정3구역을 대한민국 주거의 새로운 기준으로 만들겠다는 의지를 드러냈다. 22일 현대건설은 서울 강남구 압구정3구역... 
2026-04-22,네이버뉴스,"현대건설 시공 아모레퍼시픽 신사옥·디에이치 갤러리, 넷플릭스 ‘성난...",http://www.lawissue.co.kr/view.php?ud=202604221627083047204ead0791_12,"현대건설이 시공한 아모레퍼시픽 신사옥과 강남구 디에이치 갤러리가 넷플릭스 오리지널 시리즈 ‘성난 사람들 시즌2’의 주요 배경으로 사용됐다. 아모레퍼시픽 신사옥은 극 중 글로벌 기업 사옥으로, 정육면체 형태에... "
2026-04-22,네이버뉴스,"[단독] 현대건설, 압구정3·5구역 ‘디에이치’ 대신 ‘압구정 현대’ ...",https://www.dt.co.kr/article/12058929?ref=naver,현대건설이 압구정3구역과 5구역 재건축 단지명으로 하이엔드 브랜드 ‘디에이치’ 대신 ‘압구정 현대’를 사용한다. 압구정 현대아파트가 50년간 지켜온 국내 최고 부촌 상징성과 역사를 계승한다는 차원에서다.... 
2026-04-22,네이버뉴스,[오늘의 건설] 현대건설·GS건설,http://www.financialreview.co.kr/news/articleView.html?idxno=41844,현대건설이 압구정3구역 정비사업 우선협상대상자에 선정된 가운데 압구정 현대의 가치를 계승하는 도시 청사진 '원씨티(ONE City)'를 공개했다. GS건설의 자이 브랜드 굿즈 조명 제품들이 '레드닷어워드(Red Dot Award)... 
2026-04-22,네이버뉴스,"코스피 '또 최고치', 6400 돌파..LG계열 · 효성중공업 '활짝'",http://www.choicenews.co.kr/news/articleView.html?idxno=164270,"건설주 중 현대건설(-3.49%), GS건설(-3.25%), DL이앤씨(-2.58%) 등이 하락했다. 지주사 중 두산(2.06%), HS효성(1.26%) 등이 올랐고 코오롱(-1.84%), 한화(-1.84%) 등은 하락했다. 코스피 지수는 전일 대비 29.46포인트(0.46... "
2026-04-22,네이버뉴스,[거래소 외국인] 이수페타시스·현대로템 집중 매수... SK하이닉스·삼성...,https://www.pinpointnews.co.kr/news/articleView.html?idxno=447701,"현대건설, 대우건설, GS건설이 모두 순매도에 포함되며 부동산 경기 둔화 우려가 지속 반영됐다. 바이오 업종에서는 삼성바이오로직스가 순매도 상위에 포함되며 고밸류 부담이 재차 부각됐다. 소재 업종에서는... "
2026-04-22,네이버뉴스,"[기획] 韓 건설사들, '중동 재건' 수혜 누릴까…기대감 고조",http://www.newswatch.kr/news/articleView.html?idxno=79341,사진 = 현대건설 | 뉴스워치= 최수아 기자 | 최근 주식시장에서 건설주들이 '중동 재건'과 '원전 수출'이라는 쌍두마차를 타고 가파른 상승 곡선을 그리고 있다. 전후 복구 사업이 국내 건설사들에 '수주 잭팟'을 안겨줄... 
2026-04-22,네이버뉴스,[거래소 기관] 삼성전자·SK하이닉스 폭풍매도… 조선·방산·에너지는...,https://www.pinpointnews.co.kr/news/articleView.html?idxno=447700,건설 업종에서는 현대건설이 기관 순매도에 포함되며 해외 수주 기대에도 불구하고 단기 조정 흐름을 보였다. 또한 삼성물산 역시 매도 우위에 자리하며 그룹 지주 성격 종목에 대한 비중 조정이 나타났다. 에너지 및... 
2026-04-22,네이버뉴스,"부동산마케팅협회-SL포럼, 근로자추정제·미분양 해소 등 현안 논의",https://www.rcast.co.kr/news/articleView.html?idxno=30588,포럼에서는 현대건설·DL이앤씨·포스코이앤씨·현대엔지니어링·롯데건설·SK에코플랜트·삼성물산·GS건설·대우건설 등 10대 건설사 마케팅 실무 담당자들이 참석했다. 구체적으로 이날 자리에서는 ▲근로자추정제 등... 
2026-04-22,네이버뉴스,"코스피, 종전 협상 불발에도 또 최고치 경신…6410선 마감 [종합]",https://www.hankyung.com/article/2026042292086,반면 현대건설(-3.49%) GS건설(-3.25%) DL이앤씨(-2.58%) 삼성E&A(-2.13%) 등 건설주는 동반 하락했다. 미국·이란 종전 협상이 지연되자 중동 재건 수혜 기대가 약화한 탓으로 풀이된다. 코스닥지수는 전장 대비 2.09포인트... 
2026-04-22,네이버뉴스,"한국부동산마케팅협회, SL 포럼과 2026년 정책간담회 개최",https://www.pinpointnews.co.kr/news/articleView.html?idxno=447694,"이날 행사에는 협회 주요 임원진과 함께 현대건설, DL이앤씨, 포스코이앤씨, GS건설 등 주요 건설사 마케팅 담당자들이 참석해 실무 관점의 의견을 공유했다. 첫 번째 세션에서는 최근 노동법 개정 흐름과 관련해... "
2026-04-22,네이버뉴스,"세계가 다시 주목하는 '원전'…K건설, 에너지 영토 확장",https://www.sidae.com/article/2026042213554361473,현대건설은 2024년 불가리아 코즐로두이 원전 7·8호기 설계계약을 체결한 데 이어 EPC(설계·조달·시공) 수주를 추진하고 있다. 지난달 만료된 설계계약을 연장하며 발주처인 불가리아 정부와 사업비 확정을 위한 세부... 
2026-04-22,네이버뉴스,"""절실함이 독 됐나""…DL이앤씨, 핵심지 수주전 잇단 고난",https://www.newspim.com/news/view/20260422001003,압구정5구역 시공사 선정 입찰 마감 당일 현장에 있던 DL이앤씨 직원이 소형 카메라가 장착된 볼펜을 이용해 경쟁사인 현대건설 측의 입찰 참여 서류를 몰래 촬영하다가 적발된 것이다. 이후 현대건설은 지난 14일... 
2026-04-22,네이버뉴스,"[사사건건] 더불어민주당 부산시장 후보 전재수, 각오는?",https://news.kbs.co.kr/news/pc/view/view.do?ncd=8542783&ref=A,"유찰 네 번 되고 난 뒤에 사업자를 선정했는데, 이게 현대건설컨소시엄이거든요? ◎박에스더: 알겠습니다. 조금 정리를 해야 되는데... ▼전재수: 그런데 윤석열 정부 때 현대건설컨소시엄이 또 두 손, 두 발 다... "
2026-04-22,네이버뉴스,수정중[리포트] 강원 17개 시·군 대진표 완성.. 누가 뛰나,https://chmbc.co.kr/article/d8wftxc1megvmym,"철원은 더불어민주당 한금석, 국민의힘 김동일 등두 강원도의장 출신 후보와무소속 고기영 전 현대건설 상무의 대진표가완성됐습니다. 동해는 더불어민주당 이정학 전 동해시의원,국민의힘 김기하 강원도의원,개혁신당... "
2026-04-22,네이버뉴스,[빌드업 AI] 드론·영상에 머문 건설 AI…해외는 공정 전반으로,https://www.ajunews.com/view/20260422145830769,"현대건설은 드론 기반 시설 안전점검과 4족 보행 로봇, 영상분석 시스템을 활용하고 있다. 특히 굴착기 등 건설장비에 AI 기반 스마트 어라운드뷰 모니터(SAVM)와 인양 과부하 경고장치(OWD)를 적용해 작업자 접근 감지와... "
2026-04-22,네이버뉴스,"현대건설, 5.5조 규모 압구정3구역 우협대상자로 선정",http://www.koreastocknews.com/news/articleView.html?idxno=118083,"현대건설(000720, 대표 이한우)이 압구정 재건축 '최대어'인 압구정3구역 우선협상대상자로 선정됐다. 지난 21일 전자공시에 따르면 현대건설은 서울 강남구 압구정3구역 재건축 사업의 우선협상대상자로 지정됐다. 앞서... "
2026-04-22,네이버뉴스,"사업 GO, 처벌은 별개... 압구정5구역, 입찰·고소 동시에 간다",https://www.meconomynews.com/news/articleView.html?idxno=130437,"DL이앤씨, 입찰 마감일 현대건설 입찰제안서 몰카 촬영 몰카 논란으로 시공사 선정은 중단 조합, 강남구 유권해석 통해 시공사 선정 재개 현대, ""입찰 재개 상관없이 고소는 그대로 진행"" 고소 내용은 현대·DL 모두 ""확인... "
2026-04-22,네이버뉴스,"현대건설 시공 '아모레 신사옥', 넷플릭스 '성난 사람들 2' 무대로 낙점",http://www.paxetv.com/news/articleView.html?idxno=270331,[사진=현대건설] 현대건설이 넷플릭스 드라마 '성난 사람들 시즌 2'에 자사가 시공한 서울의 건축물들이 주요 배경으로 활용됐다고 22일 밝혔습니다. 드라마 속 글로벌 기업 사옥과 최고급 성형외과 빌딩 등이 실제... 
2026-04-22,네이버뉴스,"현대건설, 압구정3구역 주거 청사진 'ONE City' 공개",http://www.newsdream.kr/news/articleView.html?idxno=111574,현대건설이 22일 압구정3구역 정비사업 우선협상대상자로 선정된 가운데 압구정 현대의 가치를 잇는 도시 청사진 '원 시티(ONE City)'를 공개했다고 밝혔다. 압구정3구역은 기존 3934가구를 최고 65층 5175가구 규모로 다시 짓는... 
2026-04-22,네이버뉴스,"중동발 원자재 쇼크, 건설업계 '공사비 폭탄' 비상… 분양가 추가 상승...",https://www.sjsori.com/news/articleView.html?idxno=85342,현대건설 등 대형사 중심으로 수천억 증액 요청 원가 부담을 견디지 못한 대형 건설사들은 발주처와 재개발 조합을 대상으로 대규모 공사비 인상을 요구하고 나섰다. 현대건설은 서울 마천4구역 재개발 조합에 기존 대비... 
2026-04-22,네이버뉴스,"사단법인 휴먼아시아 기업과 인권센터–대한변호사협회, 기업 인권실사...",https://www.fntoday.co.kr/news/articleView.html?idxno=382881,"평가 결과 상위권에는 현대건설, LG전자, 네이버, 삼성전자, 카카오 등이 포함됐다. 이번 평가는 World Benchmarking Alliance (WBA)의 '기업 인권 벤치마크 핵심 UNGP 지표'를 기반으로 진행됐다. 특히 국내 기업의 정책 수립 수준... "
2026-04-22,네이버뉴스,"10대 건설사, 2분기 2.4만가구 '분양 대전' … 수도권에 66% 집중 공급",https://biz.newdaily.co.kr/site/data/html/2026/04/22/2026042200191.html,주요 분양 예정 단지는 △현대건설 '힐스테이트 양산더스카이' △대우건설 '써밋 클라비온' △DL이앤씨 'e편한세상 부천 어반스퀘어'  △현대엔지니어링 '힐스테이트 시흥더클래스' 등이다. 10대 건설사 분양단지는... 
2026-04-22,네이버뉴스,압구정3·목동6 우협 윤곽…현대건설 '웃고'·DL이앤씨 '논란 부담',https://www.asiatime.co.kr/article/20260422500247,"5.5조 사업지, 현대건설 수의계약 수순 DL이앤씨, 몰카 적발…공정성 공방 이어져 ""결과보다 과정 중요…현장 신뢰 관리 과제"" [아시아타임즈=김미나 기자] 현대건설과 DL이앤씨가 각각 '압구정아파트지구 특별계획구역3... "
2026-04-22,네이버뉴스,"“단지 아닌 도시로”…현대건설, 압구정3구역 미래 주거 청사진 공개",https://www.smarttoday.co.kr/ko-kr/articles/106814,압구정3구역 정비사업 우선협상대상자로 선정된 현대건설은 22일 ‘OWN THE ONE’ 비전 아래 기존 압구정 현대의 헤리티지를 도시 개념으로 확장한 ‘단 하나의 대도시(ONE City)’ 구상을 공개했다. 랜드마크 설계부터... 
2026-04-22,네이버뉴스,"층간소음 잡는 신소재, 2026 초격차 프로젝트로 선정",http://www.newsprime.co.kr/news/article.html?no=731121,이에 △현대건설(00070) △DL이앤씨(375500) △대우건설(047740) 등 대형 건설사들도 고성능 완충재와 특화 몰탈을 결합한 바닥구조 기술 고도화에 나선 상태다. 이러한 시장 상황 속에서 리젠티앤아이가 선보인 친환경... 
2026-04-22,네이버뉴스,"현대건설, 압구정3구역에 ‘원 시티’ 제안…미래형 주거 청사진 공개",https://www.thepowernews.co.kr/view.php?ud=202604221448455550de3f0aa1be_7,"압구정3구역 재건축 수주전이 본격화되는 가운데 현대건설이 단지 설계와 커뮤니티, 미래 기술을 아우르는 주거 구상을 내놨다. 현대건설은 22일 압구정3구역 정비사업 우선협상대상자 선정 이후 ‘원 시티(ONE City)... "
2026-04-22,네이버뉴스,"현대건설, 압구정3구역 재건축 우협 선정…'ONE City' 제시",https://www.newsway.co.kr/news/view?ud=2026042214425690479,현대건설이 공사비만 5조원을 웃도는 압구정3구역 재건축 사업의 우선협상대상자로 선정됐다. 현대건설은 압구정3구역에 'ONE City'를 제시하며 조합원들 표심잡기에 나섰다. 22일 업계에 따르면 현대건설은 지난 20일... 
2026-04-22,네이버뉴스,"10대 건설사, 2분기 2.4만가구 일반 공급...전년 比 164%↑",http://www.fnnews.com/news/202604221422366073,"대표적으로 DL이앤씨, 현대건설, 현대엔지니어링, 대우건설 등이 공급을 앞두고 있다. DL이앤씨는 4월 부천시 원미구 소사동 일원에서 소사3구역 주택재개발사업을 통해 'e편한세상 부천 어반스퀘어'를... "
2026-04-22,네이버뉴스,"울트라캐패시터 기술력 앞세워...LS머트리얼즈, 글로벌 전력 시장 공략...",https://www.pinpointnews.co.kr/news/articleView.html?idxno=447648,"현대건설 역시 프로젝트 수익성 우려와 함께 조정을 받는다. 이처럼 풍력에너지 테마는 업종 전반으로 보면 상승 흐름을 유지하고 있지만, 종목별로는 수급과 기대감에 따라 차별화가 뚜렷하게 나타난다. 특히 실제... "
2026-04-22,네이버뉴스,"현대건설, 압구정3구역에 'ONE City' 제시...DRT 무인셔틀 등 미래 주거지...",https://hbnpress.com/news/view/1065591407131839,"현대건설은 압구정3구역 정비사업 우선협상대상자에 선정된 가운데 압구정 현대의 가치를 계승하는 도시 청사진 ‘ONE City’를 공개했다고 22일 밝혔다. 압구정3구역은 현대 1~7차, 10·13·14차, 대림빌라트 등... "
2026-04-22,네이버뉴스,"대우건설, 원전 수주 기대 속 실적 턴어라운드 본격화 - NH투자증권",http://www.biztribune.co.kr/news/articleView.html?idxno=352835,"현대건설과 삼성물산의 사업 우선순위를 고려할 때 대우건설이 실제 시공을 담당할 확률이 크다는 설명이다. 특히, 미국과 베트남 등 추가 원전 프로젝트 협력 가능성까지 감안하면 체코 원전 사업에서의 공사비 협상... "
2026-04-22,네이버뉴스,"[TOP's Pick] [건설] GS건설, '자이 브랜드 굿즈' 디자인 어워드 수상 外",https://www.topdaily.kr/articles/109792,"한 줄 코멘트 => 일상을 바꾸는 디테일의 차이 ◆  현대건설, 압구정3구역 미래 주거 청사진 제시 현대건설이 압구정3구역 정비사업 우선협상대상자에 선정된 가운데 압구정 현대의 가치를 계승하는 도시 청사진... "
2026-04-22,네이버뉴스,美·이란 협상 안갯속…건설주 동반 하락[핫종목],https://www.news1.kr/finance/general-stock/6145276,"한국거래소에 따르면 현대건설(000720)은 이날 오후 2시 26분 전일 대비 6700원(3.83%) 하락한 16만 8200원에 거래 중이다. 이 외에도 GS건설(006360)(-3.13%), 한미글로벌(053690)(-4.12%), DL이앤씨(375500)(-2.68%), 삼성E&A(028050)(-2.... "
2026-04-22,네이버뉴스,"돌출 테라스에 무인셔틀…현대건설, 압구정3구역 재건축 '원 시티' 공개",http://www.yonhapnewstv.co.kr/AKR20260422142419Rmo,"서울 강남구 압구정3구역 재건축 우선협상대상자에 선정된 현대건설이 도시 청사진 '원 시티'(ONE City)를 오늘(22일) 공개했습니다. 압구정3구역 재건축은 현대 1∼7차, 10·13·14차, 대림빌라트 등 3,934가구를 최고 65층에 5... "
2026-04-22,네이버뉴스,[기획]'파업 공화국' 전락 우려…산업계 춘·하투 현실화,https://www.m-i.kr/news/articleView.html?idxno=1366704,"HD현대중공업, 한화오션, 현대건설, 포스코 등도 하청 노조의 원청 교섭 요구에 직면한 상황이다. 조선업계의 경우 곳간을 두둑히 쌓아둔 상황에서 파업이 현실화하면 납기 지연에 따른 대규모 손실과 수주 경쟁력 약화가... "
2026-04-22,네이버뉴스,"DRT 셔틀·로보틱스…현대건설, 압구정3 'ONE City' 청사진 공개",https://www.hankyung.com/article/202604228900i,"서울 강남구 압구정3구역 재건축 우선협상대상자에 선정된 현대건설이 압구정 현대의 가치 계승을 내세우며 도시 청사진 ‘원 시티’(ONE City)를 22일 공개했다. 현대건설은 원 시티에 랜드마크 설계(ONE Scene), 초대형... "
2026-04-22,네이버뉴스,"""한강·로봇·커뮤니티까지""…현대건설, 압구정에 '미래형 라이프 도시...",https://www.e-science.co.kr/news/articleView.html?idxno=129420,"현대건설이 압구정3구역 정비사업 우선협상대상자로 선정된 가운데, 단순 주거단지를 넘어 일상 전반을 아우르는 미래형 생활문화 공간 'ONE City' 청사진을 공개했다. 압구정3구역은 기존 현대아파트와 일대 빌라를... "
2026-04-22,네이버뉴스,"무인셔틀에 돌출 테라스, 생태숲까지 … 현대건설, 압구정3에 '원시티' ...",https://biz.newdaily.co.kr/site/data/html/2026/04/22/2026042200161.html,"뉴데일리 박정환 기자 = 현대건설이 우선협상대상자로 선정된 서울 강남구 압구정3구역 주택정비사업에 '원 시티(ONE City)' 청사진을 제시했다. 개방감을 높인 특화 설계와 초대형 커뮤니티시설, DRT 무인셔틀 등... "
2026-04-22,네이버뉴스,"중동 현장 불안 고조…삼성물산 노조 ""위험수당 지급"" 요구",http://www.opinionnews.co.kr/news/articleView.html?idxno=137190,"GS건설과 삼성E&A는 수당 인상에 나섰고, 현대건설은 귀국 지원과 현지 모니터링에 무게를 두고 있다. 삼성물산에서는 노조가 대표이사에게 위험수당 지급을 요구했다. 22일 건설업계에 따르면 삼성물산 건설부문 노조는... "
2026-04-22,네이버뉴스,"'빅5' 건설사, 주택 중심에서 에너지 인프라로 이동 중...[인도 진출 사...",https://www.ekoreanews.co.kr/news/articleView.html?idxno=85709,"박 대표는 ""최근 이른바 '빅5' 건설사들이 주택 중심에서 에너지 인프라로 사업 축을 빠르게 옮기고 있다""며 ""장기화된 주택 경기 침체 속에서 현대건설이 원전 플랜트, GS건설은 에너지 플랜트 쪽으로 해외 수주를... "
2026-04-22,네이버뉴스,대서양~태평양 잇는 950m ‘물류 혈맥’ 뚫린다… 2030년 완공,https://www.g-enews.com/view.php?ud=2026042214004348592bd56fbc3c_1,"이미 현대건설이 칠레에서 남미 최대 규모의 현수교인 ‘차카오 교량’ 프로젝트를 주도하고 있고, 동부건설이 엘살바도르 대형 교량 사업을 수주하는 등 중남미 시장 내 ‘K-건설’의 위상은 갈수록 높아지는 추세다.... "
2026-04-22,네이버뉴스,2분기 분양시장 '10대 건설사' 집중…브랜드 아파트 선호 뚜렷,http://www.biztribune.co.kr/news/articleView.html?idxno=352831,"현대건설은 5월 경남 양산시 물금읍 가촌리∙범어리 일원에 짓는 '힐스테이트 양산더스카이'를 분양할 예정이다. 2개 단지, 총 598가구 규모다. 1단지는 지하 4층~지상 20층, 4개 동, 전용면적 68~159㎡ 총 299가구이며... "
2026-04-22,네이버뉴스,넷플릭스 성난 사람들 시즌2 속 랜드마크 '현대건설' 작품,http://www.ikld.kr/news/articleView.html?idxno=333330,극의 몰입도를 높이는 서울의 화려한 주요 배경들이 알고 보니 현대건설의 손끝에서 탄생한 건축물로 밝혀졌기 때문이다. 넷플릭스 '성난 사람들 시즌 2'는 시즌 1의 명성을 이어 할리우드 최고의 제작진이 참여한... 
2026-04-22,네이버뉴스,"‘지구의 날’ 맞은 업계 리딩 브랜드들, 일회성 이벤트 아닌 ‘친환경...",https://www.sedaily.com/article/20035671?ref=naver,현대건설은 이렇게 수거된 아모레퍼시픽의 공병 분쇄물을 건설 자재와 결합했다. 수거된 공병을 친환경 ‘테라조 타일’로 제작해 아파트 단지 내 조경 및 인테리어에 적용한 것이다. 화장품 공병이 누군가의 보금자리를... 
2026-04-22,네이버뉴스,"10대 건설사, 2분기 2만5000가구 분양…'공급 경쟁' 본격화",https://www.newsis.com/view/NISX20260422_0003601313,"현대건설, DL이앤씨 등 시공능력평가 상위 10대 건설사는 올해 2분기(4~6월) 전국에서 2만4340가구의 아파트를 분양할 예정이다. 22일 부동산 리서치업체 리얼투데이에 따르면 올해 2분기 시공능력평가 상위 10대... "
2026-04-22,네이버뉴스,"경남진주 '힐스테이트 평거', 1순위 청약서 20 대 1 '선방'",https://www.straightnews.co.kr/news/articleView.html?idxno=300791,현대건설이 경남 진주시 평거동에 선보인 '힐스테이트 평거 센트럴' 모델하우스. 청약홈은 이 단지가 1순위 청약에서 최고 129.33 대 1에 힘입어 평균 20.40 대 1의 경쟁률을 기록했다고 밝혔다. 현대건설이 경남... 
2026-04-22,네이버뉴스,"한수원, 인권실사 평가 공기업 1위…'인권경영' 대외 검증 받았다",https://www.asiatime.co.kr/article/20260422500135,지난 21일 서울 대한상공회의소서 컨퍼런스 행사·발표 50개 기업 대상…사기업 현대건설·공기업 한수원 '1위' 인권경영 정책 수립·인권영향평가 등 '책임 경영' 인증 [아시아타임즈=옥한빈 기자] 한국수력원자력(이하... 
2026-04-22,네이버뉴스,넷플릭스 ‘성난 사람들 시즌 2’ 속 랜드마크 누가 지었을까,https://www.hankyung.com/article/202604228757i,극의 몰입도를 높이는 서울의 화려한 주요 배경이 알고 보니 현대건설의 손끝에서 탄생한 건축물로 밝혀졌기 때문이다. 넷플릭스 ‘성난 사람들 시즌 2’는 시즌 1의 명성을 이어 할리우드 최고의 제작진이 참여한... 
2026-04-22,네이버뉴스,"'AAA급 재무·레드닷 디자인·압구정 수주'… 건설업계, 시장 지배력 확...",https://www.cstimes.com/news/articleView.html?idxno=702910,현대건설은 압구정3구역에 미래형 주거 비전인 '원 시티(ONE City)'를 선보이며 차세대 주거 패러다임 선점에 속도를 내고 있다. 글로벌세아그룹 쌍용건설이 2026년 주택도시보증공사(HUG) 신용평가에서 종전 A+보다 두... 
2026-04-22,네이버뉴스,"[건설 Pick] GS건설·현대건설·삼성물산, 공간에 브랜드를 입히다",https://www.lcnews.co.kr/news/articleView.html?idxno=201130,"◆ 현대건설, 압구정 3구역에 그리는 미래 도시 'One City' 현대건설은 압구정 3구역 정비사업에 압구정 현대의 유산을 계승하는 'ONE City' 청사진을 공개했다. 'OWN THE ONE'이라는 비전 아래 랜드마크 설계와 미래형 기술을... "
