date,source,title,link,description
2026-04-23,네이버뉴스,"삼성E&A, 1Q 영업익 1882억원…전년比 19.6% 상승 [건설·분양오늘]",https://www.sisaon.co.kr/news/articleView.html?idxno=200525,"현대건설, 압구정5구역에 100% 한강 조망 제안…갤러리아 연계 내세워 현대건설은 압구정5구역 재건축 수주를 위해 단지명으로 '압구정 현대 갤러리아'를 제안했다고 23일 밝혔다. 현대건설은 이번 제안서에 하이퍼... "
2026-04-23,네이버뉴스,"현대건설, 압구정5구역 '압구정 현대 갤러리아' 제안",http://www.fnnews.com/news/202604231438431241,현대건설이 서울 강남구 압구정5구역 재건축 사업에 미래형 주거 모델을 앞세운 설계안을 제시했다. 23일 현대건설은 압구정5구역 재건축 정비사업 입찰에 참여하며 단지명으로 '압구정 현대 갤러리아'를 제안했다고... 
2026-04-23,네이버뉴스,"건설업계, 주거만족 제고 위한 층간소음 차단기술 경쟁 후끈",https://www.womentimes.co.kr/news/articleView.html?idxno=102504,"23일 건설업계에 따르면 현대건설과 삼성물산을 비롯한 상위사는 물론 DL이앤씨, 롯데건설 등 중형사들까지 바닥 진동을 차단해 층간소음을 줄이는 신기술 개발에 박차를 가하고 있다. 현재까지 각 사에서 선보인 핵심... "
2026-04-23,네이버뉴스,"현대건설, 압구정5구역 단지명 '압구정 현대 갤러리아' 제안",https://www.news1.kr/realestate/general/6146787,현대건설(000720)은 압구정 5구역 단지명으로 '압구정 현대 갤러리아'를 제안했다고 23일 밝혔다. 이달 현대건설은 압구정 5구역 재건축 시공사 수주에 출사표를 던졌다. 'OWN THE NEW'란 비전으로 △새로운 도시(New... 
2026-04-23,네이버뉴스,압구정 5구역에 ‘갤러리아’ 내건 현대건설…초프리미엄 승부수,https://www.ddaily.co.kr/page/view/2026042314563712316,현대건설이 압구정 5구역 재건축 사업에서 ‘압구정 현대’ 브랜드를 앞세운 하이엔드 주거 전략을 제시했다. 미래형 이동·로보틱스 기술과 초고급 커뮤니티를 결합해 기존 압구정의 상징성을 한 단계 끌어올리겠다는... 
2026-04-23,네이버뉴스,"금호건설 올해 아테라 첫 분양 돌입, 조완석 유상증자 이후 LH 시장서 재...",https://www.businesspost.co.kr/BP?command=article_view&num=436371,최근 본공모가 진행된 2-2차 5908억 원 규모 서울 도봉 1블록 사업에 현대건설 컨소시엄이 입찰한 것이 대표적이다. 서울 도봉 1블록은 지난해 정부의 주택공급대책에도 포함된 성균관대학교 야구장 부지다. 조완석... 
2026-04-23,네이버뉴스,"현대건설, 압구정5구역 재건축 입찰 참여… ‘압구정 현대 갤러리아’ ...",https://biz.chosun.com/real_estate/real_estate_general/2026/04/23/LGSY2NCBQBB7BNBYQ5XU2QP67E/?utm_source=naver&utm_medium=original&utm_campaign=biz,현대건설이 압구정5구역 재건축 정비사업 입찰에 참여하며 단지명과 주거 콘셉트를 제안했다고 23일 밝혔다. 현대건설은 이번 입찰에서 단지명으로 ‘압구정 현대 갤러리아’를 제시했다. 압구정 현대와 갤러리아를... 
2026-04-23,네이버뉴스,중동전쟁 장기화에…국토부 “내달 공사 전체 중단 현장 현실화 우려”,https://www.sedaily.com/article/20036247?ref=naver,"현대건설도 은평구 대조1구역 재개발 조합에 추가 공사비 반영을 요청했다. 국토부는 시급하지 않은 공사의 발주 시기를 조정하고, 시급한 공사에 자재를 우선 납품하는 등 적극적인 수요 관리를 통해 공급 불안 요인을... "
2026-04-23,네이버뉴스,현대건설 앞에 펄럭이는 전국건설노동조합 깃발,https://www.newspim.com/news/view/20260423000945,김예원 인턴기자 = 23일 오후 서울 종로구 현대건설 본사 앞에서 전국건설 노동조합원들의 깃발이 펄럭이고 있다. 2026.04.23 yeawon2@newspim.com
2026-04-23,네이버뉴스,"현대건설, 압구정 5구역에 '새로움, 그 이상의 NEW' 선사",http://www.enewstoday.co.kr/news/articleView.html?idxno=2422462,"현대건설이 압구정 5구역에 'OWN THE NEW'라는 비전 아래, '새로움, 그 이상의 NEW'를 선사한다. 23일 현대건설에 따르면  압구정 5구역 재건축 정비사업 입찰에 참여하며, 단지명으로 '압구정 현대 갤러리아'를... "
2026-04-23,네이버뉴스,"현대건설, 압구정 5구역 재건축에 ‘압구정 현대 갤러리아’ 제안",https://www.betanews.net/article/view/beta202604230072,현대건설이 서울 강남구 압구정 5구역 재건축 정비사업에 참여하며 단지명으로 ‘압구정 현대 갤러리아’를 제안했다. 현대건설은 이번 제안에 설계사 RSHP와의 협업 및 현대자동차그룹의 첨단 기술 적용 계획을... 
2026-04-23,네이버뉴스,압구정5구역 입찰 재개…시공사 선정 총회 예정대로,https://www.newsway.co.kr/news/view?ud=2026042314281477690,"23일 정비업계에 따르면 압구정5구역 재건축조합과 입찰에 참여한 현대건설, DL이앤씨는 지난 20일 중단됐던 시공자 입찰 서류 확인 및 양사 상호 날인 절차를 마쳤다. 이어 22일에는 두 건설사의 시공 조건 비교표를... "
2026-04-23,네이버뉴스,중동발 자재 쇼크에 건설 현장 비상...내달 공사 중단 현실화 우려,https://www.youthdaily.co.kr/news/article.html?no=217979,"현대건설 역시 은평구 대조1구역 조합에 추가 공사비 반영을 요청했으며, 포스코이앤씨도 시행사 등에 원가 상승 리스크를 보고하며 대응에 나섰다. 김 차관은 ""건설 자재의 수급 애로와 가격 상승은 주택 공급과 부동산... "
2026-04-23,네이버뉴스,K-원전 베트남 진출…대장주 두산에너빌리티 5%대 상승세,https://www.mk.co.kr/article/12025218,"한-베트남 정상회담을 계기로 한국수력원자력, 두산에너빌리티, 현대건설, 삼성물산, LS, 효성 등 주요 기업들의 베트남 진출이 예상된다. 이번 정상회담이 동남아시아 원전 시장 진출의 교두보가 될 것이라는 전망도... "
2026-04-23,네이버뉴스,건설 현장에 드리운 중동 사태 먹구름… 내달 공사 중단 위기 올 수도,http://www.kookje.co.kr/news2011/asp/newsbody.asp?code=0200&key=20260423.99099006714,"이런 이유로 롯데건설, 현대건설, 포스코이앤씨 등은 자사가 시공 중인 일부 사업에 차질이 생길 수 있다며 시행사와 발주자 측에 상황을 설명하는 공문을 보내기도 했다. 국토부는 이에 따라 도로 복구, 장마철 대비 유지... "
2026-04-23,네이버뉴스,"건설노조, '추모 헬멧' 쓰고 산재 위령제…""원청교섭 나서야""",https://www.yna.co.kr/view/AKR20260423110500004?input=1195m,현대건설 앞 집회…민노총은 2시부터 원청교섭 쟁취대회 민주노총 건설노조는 현대건설의 현장에서 사망 사고가 이어지고 있다며 사측의 책임 있는 자세와 원청 교섭 등을 주장했다. 건설노조는 23일 서울 종로구 계동... 
2026-04-23,네이버뉴스,산재사망 건설노동자를 위한 진혼무,https://www.yna.co.kr/view/PYH20260423132400013?input=1196m,"23일 서울 현대건설 본사 앞에서 민주노총 전국건설노조, 산재사망 건설노동자 위령제가 열리고 있다. 2026.4.23"
2026-04-23,네이버뉴스,"""베트남 파병 반대해달라"" 박정희 부탁 받은 차지철...진짜 반대론자 된...",https://www.hankookilbo.com/news/article/A2026042312080003382?did=NA,"현대건설, 대림산업, 효성, 쌍용, 대우, 동아건설, 신동아, 삼환기업 등이 대표적이다. 이때 축적한 해외사업 경험은 베트남전 종전 후 중동 특수로 이어지는 중요한 발판이 되었다. 추가 파병에 따른 미국의... "
2026-04-23,네이버뉴스,"현대건설, 압구정3구역 청사진 'ONE City' 공개 [건설·분양오늘]",https://www.sisaon.co.kr/news/articleView.html?idxno=200493,"현대건설, 압구정3구역 우협 선정…""'압구정 현대' 가치 극대화"" 현대건설은 압구정3구역 재개발 사업의 우선협상대상자로 선정된 가운데 '압구정 현대'의 가치를 계승하는 도시 청사진 'ONE City'를 공개했다고 22일... "
2026-04-23,네이버뉴스,산재사망 건설노동자 위령제,https://www.yna.co.kr/view/PYH20260423127000013?input=1196m,"23일 서울 현대건설 본사 앞에서 민주노총 전국건설노조, 산재사망 건설노동자 위령제가 열리고 있다. 2026.4.23"
2026-04-23,네이버뉴스,"[기획] 같은 입지, 비슷한 브랜드…""결국 설계가 조합 표심 가른다""",https://www.m-i.kr/news/articleView.html?idxno=1367127,압구정5구역에서는 현대건설과 DL이앤씨가 입지 특성을 살린 설계를 강조하고 있어 기대감이 높아지고 있다. 현대건설은 하이테크 건축의 RSHP와 협업해 글로벌 수준의 주거단지를 구현하겠다는 비전을 제시했으며... 
2026-04-23,네이버뉴스,압구정5구역 시공사 선정 입찰 재개⋯총회 변동 없을 듯,http://www.inews24.com/view/1962583,"23일 정비업계에 따르면 압구정5구역 재건축조합과 입찰에 참여한 현대건설, DL이앤씨는 지난 20일 중단됐던 시공자 입찰 서류 확인 및 양사 상호 날인 절차를 마쳤다. 이어 22일에는 두 건설사의 시공 조건 비교표를... "
2026-04-23,네이버뉴스,"효성중공업, 중공업·건설 양대 사업축으로 글로벌 경쟁력 강화",https://www.pinpointnews.co.kr/news/articleView.html?idxno=447945,"현대건설, 한전기술, LS에코에너지는 해상풍력 프로젝트 확대 기대와 맞물리며 동반 상승 흐름을 보인다. 중소형 부품·소재 기업군은 상대적으로 완만한 흐름이다. 케이피에프, 대창솔루션, 효성, 동국산업, 금양그린파워... "
2026-04-23,네이버뉴스,"중동 전쟁 여파… 국내 건설현장, 아스콘 가격 급등 및 자재난 비상",https://www.gokorea.kr/news/articleView.html?idxno=864476,롯데건설과 현대건설은 각각 경기도와 서울의 재개발 조합에 공사비 상승에 관해 사전 안내문을 발송해 상황 변화를 알렸다. 국토교통부는 사전 관리 체계를 강화하고 시급하지 않은 공사는 발주 시기를 조정하면서... 
2026-04-23,네이버뉴스,[KMEC 증권 레이더 ⑤] 원전 르네상스 개막…건설사 '황금 사이클' 진입,http://www.kmecnews.co.kr/news/articleView.html?idxno=46719,"국내에서는 대형 원전 시공 레퍼런스를 기반으로 미국·유럽 프로젝트 참여 가능성이 부각되는 현대건설을 비롯해, 체코 두코바니 원전 등 해외 수주 파이프라인을 구체화하며 원전 중심 포트폴리오를 강화하고 있는... "
2026-04-23,네이버뉴스,"기업 인권경영 성적표 첫 공개...""정책·선언만 늘고 실행은 부족""",https://www.esgeconomy.com/news/articleView.html?idxno=15327,"사기업 순위를 보면 현대건설이 12점으로 1위였고, LG전자 11.07점, 네이버 11.00점이 그 뒤를 이었다. 삼성전자와 카카오는 각각 10.16점으로 공동 4위였다. 반면 하위권에는 쿠팡 1.25점, NH농협금융지주 1.75점, 하이브 2.25점... "
2026-04-23,네이버뉴스,"중동전쟁 장기화에…""공사 전체 중단 현장 나올 수도""",https://news.tvchosun.com/site/data/html_dir/2026/04/23/2026042390126.html,앞서 현대건설도 지난달 서울 은평구 대조1구역 재개발 조합에 중동 전쟁 영향으로 원자재 가격 상승과 자재 공급 차질이 현실화하고 있다며 추가 공사비 반영을 요청했다. 또 포스코이앤씨는 최근 자사가 시공을 맡은... 
2026-04-23,네이버뉴스,"중동전쟁 장기화에 ""내달 공사 전체 중단 현장 나올 수도""(종합)",https://www.yna.co.kr/view/AKR20260422157351003?input=1195m,앞서 현대건설도 지난달 서울 은평구 대조1구역 재개발 조합에 보낸 공문에서 중동 전쟁 영향으로 원자재 가격 상승과 자재 공급 차질이 현실화하고 있다며 추가 공사비 반영을 요청했다. 또 포스코이앤씨는 최근 자사가... 
2026-04-23,네이버뉴스,[단독] 압구정5구역 입찰 재개…'압구정 현대' vs '아크로 압구정',https://www.bizhankook.com/bk/article/32107,"조합이 현대건설과 DL이앤씨의 입찰 제안서 비교표 작성 절차를 마무리하면서, 한 차례 파행 위기를 맞았던 압구정5구역 수주전도 다시 본궤도에 올랐다. 양 사는 사업 추진 일정과 사전 홍보 제한 방침을 담은... "
2026-04-23,네이버뉴스,"“압구정도 불확실하면 포기” 건설사, 공사 따낼 곳만 간다",https://biz.heraldcorp.com/article/10723885?ref=naver,현대건설도 공사비만 5조5610억원에 달하는 강남구 압구정3구역 재건축 사업의 우선협상대상자로 선정됐다. 지난 2월 열린 현장설명회에서는 10곳 가까이 건설사들이 참여했지만 실제 입찰에는 뛰어들지 않았다.... 
2026-04-23,네이버뉴스,한·베트남 원전 협력 가시화…자금·운영주 일제히 급등[특징주],https://www.newsway.co.kr/news/view?ud=2026042310580911128,"대우건설(2.92%), 현대건설(4.62%) 등 대형 건설사들도 원전 사업 확대 기대감에 상승세를 보이고 있다. 중소형 원전 기자재 및 검사 관련 종목들의 상승폭은 더 크다. 같은 시각 코스닥 시장에서 오르비텍(18.72%)은 18... "
2026-04-23,네이버뉴스,건설업 ‘5월 위기설’ 현실화 가능성에 ‘촉각’… ”지금도 어렵다”,https://www.smarttoday.co.kr/ko-kr/articles/106857,현대건설 관계자는 “전쟁 상황이 급변하고 있어서 내일도 예측이 안 가는 상황”이라고 했다. 중견건설사 관계자는 “일부 자재 단가인상에 대한 협상 요청이 접수됐다”고 설명했다. GS건설 관계자는 “상황을... 
2026-04-23,네이버뉴스,"일진파워, 화력·원자력 넘어 친환경 에너지로 체질 개선",https://www.pinpointnews.co.kr/news/articleView.html?idxno=447921,"현대건설은 4.62% 상승한 17만 6600원에 거래중이다. 중동과 해외 원전·플랜트 수주 기대가 반영되며 기관 매수세가 유입되고 있다. 금호건설, HJ중공업, 대우건설 역시 동반 상승하며 업종 전반의 방향성을 견인하고 있다.... "
2026-04-23,네이버뉴스,"[르포] 타타대우, 도심형 중형트럭 ‘하이쎈’ 공개…중형 시장 ‘틈새...",https://www.g-enews.com/view.php?ud=20260422233626145195c8fcfb13_1,"HD현대건설기계 240마력급 엔진과 커민스 235마력 엔진을 적용하고, ZF 8단 및 앨리슨 9단 전자동 변속기를 탑재해 다양한 운송 환경에서 효율적인 주행이 가능하도록 했다. 차체 구조는 효율 중심으로 설계됐다. 신규... "
2026-04-23,네이버뉴스,[원자력연차대회] 홀텍·ARC·솔트포스 등 글로벌 소형모듈원전 총출동,https://daily.hankooki.com/news/articleView.html?idxno=1360853,현대건설·프리마톰·미쓰비시 전기와 파트너십을 맺고 있다. 2025년 12월까지 미국 원자력규제위원회(NRC)에 건설허가(CPA Part Ⅰ)를 제출할 계획이다. 이미 수종의 인허가 기술보고서(LTR)를 승인받았고 일부는... 
2026-04-23,네이버뉴스,"[특징주] 원전주, 한·베 협력 이슈에 동반 강세 흐름",http://www.issuenbiz.com/news/articleView.html?idxno=75987,"대우건설(3.69%), 현대건설(4.15%) 등 원전 테마주로 분류되는 건설 종목들도 함께 오르고 있다. 전날 산업통상부는 양국 정상 임석 하에 열린 양해각서(MOU) 교환식에서 한국전력공사와 베트남 산업에너지공사(PVN) 간... "
2026-04-23,네이버뉴스,[서울아파트거래] '현대건설 DL이앤씨 격돌' 압구정 한양1차 전용 91.21㎡...,https://www.businesspost.co.kr/BP?command=article_view&num=436343,지난 10일 마감된 시공사 선정 입찰에는 현대건설과 DL이앤씨가 응찰해 경쟁입찰이 성사됐다. 선정 절차는 한때 DL이앤씨 관계자의 서류 무단촬영 논란으로 멈춰섰다. 다만 명확한 관련 기준이 없다는 강남구청의... 
2026-04-23,네이버뉴스,목동 첫 수주부터 '단독 낙찰'...도시정비 판 바뀌나,https://www.asiaa.co.kr/news/articleView.html?idxno=247388,"두 달 전 1차 현설 당시 삼성물산, 현대건설, 대우건설 등 주요 건설사가 대거 모습을 드러냈던 것과는 결이 완전히 달라졌다. 관심은 있었지만 실제 경쟁으로 이어지지 않았다는 의미다. 입찰 흐름도 같은 방향으로... "
2026-04-23,네이버뉴스,"삼성물산, 홈 플랫폼 '홈닉' 확장…서해종건과 업무 협약",https://www.asiatime.co.kr/article/20260423500058,"지난 22일 서울 서초 서해종합건설 본사서 업무 계약식 홈닉, SK·한화·두산 등 확대 적용…6만가구 이상 사용중 현대건설 '마이 힐스'·GS건설 '자이홈' 등 주거서비스 운영 [아시아타임즈=옥한빈 기자] 삼성물산 건설부문... "
2026-04-23,네이버뉴스,“일자리가 곧 주거 가치”…‘워크시티(Work City)’ 부동산 시장 주목,http://www.lawissue.co.kr/view.php?ud=20260423102033769267191f6c6e_12,경기 안양시 만안구에서는 현대건설이 시공한 ‘힐스테이트 안양펠루스’가 총 198세대를 성황리 분양 중이다. 안양시청을 비롯한 다양한 공공기관이 들어설 예정인 행정업무복합타운이 가까운 것이 특징이다.... 
2026-04-23,네이버뉴스,"[특징주] 원전주, 한·베트남 원전협력에 동반 강세",https://www.yna.co.kr/view/AKR20260423060100008?input=1195m,"대우건설(3.69%), 현대건설(4.15%) 등 원전 테마주로 분류되는 건설 종목들도 함께 오르고 있다. 전날 산업통상부는 양국 정상 임석 하에 열린 양해각서(MOU) 교환식에서 한국전력공사와 베트남 산업에너지공사(PVN) 간... "
2026-04-23,네이버뉴스,"한신기계, 공기압축기 기술 국산화 앞장… 시장 지배력 강화",https://www.pinpointnews.co.kr/news/articleView.html?idxno=447883,"현대건설과 대우건설은 해외 원전 수주 경험을 기반으로 추가 프로젝트 기대감이 반영되고 있으며, GS건설과 DL이앤씨 역시 플랜트 및 인프라 사업 연계 기대가 작용한다. 한미글로벌은 프로젝트 관리(PM) 역량이... "
2026-04-23,네이버뉴스,"[한강벨트 잡아라 ①] 60조 도시정비 시장 열렸다···건설사, 랜드마크...",https://www.seoulfn.com/news/articleView.html?idxno=627156,"현대건설은 올해 도시정비 수주 목표를 12조원 이상으로 설정하며, 8년 연속 수주 1위를 노리고 있다. 현재 금정2구역(4300억원), 신길1구역(6600억원) 등 총 1조1000억원의 수주액을 기록 중이다. 특히 다음 달 시공사를... "
2026-04-23,네이버뉴스,"""'워크 시티' 아파트 단지가 인기라는데""…인근 일자리 많고 수요까지 ...",https://www.econovill.com/news/articleView.html?idxno=738399,경기 안양시 만안구에서는 현대건설이 시공한 '힐스테이트 안양펠루스'가 총 198세대를 분양중이다. 안양시청 등이 들어설 예정인 행정업무복합타운과도 가깝다. 공공용지에는 안양시청과 만안구청사... 
2026-04-23,네이버뉴스,"현대건설, 압구정 '브랜드 타운' 완성 성큼…5구역 '반사이익' 기대감도...",https://www.mediapen.com/news/view/1095106,"현대건설이 서울 강남권 재건축 최대어인 압구정 일대 '헤리티지 계승' 전략 완성에 속도를 높이고 있다. 압구정3구역 재건축 사업 우선협상대상자로 선정되며 수주 가능성을 높인 가운데, 5구역 수주전에서도 경쟁사... "
2026-04-23,네이버뉴스,"오르비텍, KF-21 부품 공급·원전 해체 선점… '미래 먹거리' 확보",https://www.pinpointnews.co.kr/news/articleView.html?idxno=447868,현대건설 역시 원전 시공 및 해체 프로젝트 참여 기대감으로 상승세를 이어간다. 비에이치아이 또한 발전설비와 연계된 해체 수요 증가 기대가 반영되는 모습이다. 반면 일부 종목에서는 단기 차익실현 매물이... 
2026-04-23,네이버뉴스,'워크시티' 직장인 주거 선호도↑···직주근접 집값 '견인',http://www.enewstoday.co.kr/news/articleView.html?idxno=2422247,"경기 안양시 만안구에서는 현대건설이 시공한 '힐스테이트 안양펠루스'가 총 198세대를 성황리 분양 중이다. '힐스테이트 안양펠루스'는 오피스텔 전용 54~82㎡ 143실과 아파트 전용 40~68㎡ 55세대로, 이미 공사가... "
2026-04-23,네이버뉴스,"[르포] 현대건설, ‘압구정 A.PT 서비스’로 수주 후 입주까지 챙긴다 [...",https://biz.heraldcorp.com/article/10723648?ref=naver,"압구정2구역 조합원에 ‘A.PT 라운지’ 운영 대출·세금·분담금 등 맞춤형 상담 ‘인기’ ‘압구정 현대’ 플랫폼 연계, 입주까지 챙긴다 현대건설이 운영하는 ‘A.PT 라운지’에서 압구정2구역 조합원을 대상으로 한... "
2026-04-23,네이버뉴스,“남는 게 없어” 성수·목동·압구정도 따져보고 수주 [부동산360],https://biz.heraldcorp.com/article/10723633?ref=naver,현대건설도 공사비만 5조5610억원에 달하는 강남구 압구정3구역 재건축 사업의 우선협상대상자로 선정됐다. 지난 2월 열린 현장설명회에서는 10곳 가까이 건설사들이 참여했지만 실제 입찰에는 뛰어들지 않았다.... 
2026-04-23,네이버뉴스,"[현장] ""좁은 골목도 거침없이""...타타대우, 도심형 트럭 '하이쎈' 승부...",https://www.ebn.co.kr/news/articleView.html?idxno=1706288,먼저 엔진 라인업을 보면 현대건설기계와 커민스의 '듀얼 엔진' 체제를 구축했다. 2025년 올해의 디젤 엔진상을 수상하며 기술력을 인정받은 현대건설기계의 DX05 엔진과 상용차 엔진의 전통 강자인 커민스 F4.5 엔진을... 
2026-04-23,네이버뉴스,‘하면 된다’는 죽음의 구호 ·시민 삶 무관한 ‘국가적’이란 말···...,https://www.khan.co.kr/article/202604230854001,"더구나 이명박은 상고, 상대를 나와 현대건설에서 한 5년 정도 일했는데 도대체 뭘 알았겠어요? 그 건설 팀 가운데 기계를 다룬 사람들이 배를 건조하는 일을 관리했지만 한 번도 해보지 않은 일이었어요. 그들의 무모한... "
2026-04-23,네이버뉴스,같은 코스피 다른 1년...수출·배당 웃고 내수·바이오 울었다,http://www.edaily.co.kr/news/newspath.asp?newsid=03083206645419072,"건설 업종 역시 평균 수익률 85%로 강세를 보였는데, 대우건설(047040)(897%)은 코스피 상장사 전체 최고 수익률을 기록했고, 현대건설(000720)(344%), GS건설(006360)(159%), DL이앤씨(375500)(145%)도 고공행진했다.... "
2026-04-23,네이버뉴스,'워크시티(Work City)'가 뭐길래...부동산 시장 '블루칩' 불리나,https://www.bizwork.co.kr/news/articleView.html?idxno=414919,경기 안양시 만안구에서는 현대건설이 시공한 '힐스테이트 안양펠루스'가 총 198가구를 분양하고 있다. 안양시청을 비롯한 다양한 공공기관이 들어설 예정인 행정업무복합타운이 가까운 것이 특징이다.... 
2026-04-23,네이버뉴스,"현대건설 美 원전 파트너 페르미, CEO 사임 이후 주가 ‘롤러코스터’",https://www.theguru.co.kr/news/article.html?no=100914,"현대건설, 두산에너빌리티, 삼성물산 등 다수의 국내 기업이 참여할 예정이다. IBT는 ""이 회사는 AI 학습과 추론 작업으로 인해 급증하는 전력 수요와 기존 전력망 연계의 만성적인 지연이라는 두 가지 추세가 교차하는... "
2026-04-23,네이버뉴스,일자리가 주거가치… '워크시티(Work City)' 부동산 시장 두각,http://www.ikld.kr/news/articleView.html?idxno=333356,◆ 수도권 '워크시티' 분양단지 주목 경기 안양시 만안구에서는 현대건설이 시공한 '힐스테이트 안양펠루스'가 총 198세대를 성황리 분양 중이다. 안양시청을 비롯한 다양한 공공기관이 들어설 예정인... 
2026-04-23,네이버뉴스,서울 소형 아파트 올해 3.55% 상승…규모별 상승률 1위,https://www.sedaily.com/article/20035987?ref=naver,"현대건설(000720), 압구정3구역 ‘ONE City’ 공개…65층·5175가구 청사진 - 핵심 요약: 현대건설이 압구정3구역 재건축 우선협상대상자로서 기존 현대아파트 3934가구를 최고 65층·5175가구로 탈바꿈하는 ‘ONE City’... "
2026-04-23,네이버뉴스,"강원 시장군수 대진표, 7곳 추가 확정",https://news.kbs.co.kr/news/pc/view/view.do?ncd=8543463&ref=A,여기에 무소속 고기영 전 현대건설 상무가 선거전에 뛰어들었습니다. 횡성입니다. 민주당에선 장신상 전 군수가 군정 탈환을 목표로 하고 있습니다. 국민의힘에선 임광식 전 횡성군 경제산업국장이 군수 자리에... 
