date,source,title,link,description
2026-04-09,네이버뉴스,"현대건설, 건설안전 혁신기업 7곳 선정...스마트 안전문화 확산 박차",https://www.news2day.co.kr/article/20260409500293,안전 혁신 7개사 선발 통해 기술 실증 추진 AI·로봇 기술 선제 도입으로 사고 예방 주력 민관 협력 오픈이노베이션…생태계 활성화 현대건설 계동 사옥 [사진=현대건설] [뉴스투데이=김성현 기자] 현대건설이 건설... 
2026-04-09,네이버뉴스,"중부발전, 신안우이 해상풍력 PF 금융약정 체결",http://www.epj.co.kr/news/articleView.html?idxno=38343,"전략적 투자자로서 발전공기업인 중부발전과 함께 한화오션, SK이터닉스, 현대건설이 참여하며, 하부 구조물 등 주요 기자재 공급 전반을 국내 기업이 담당한다. 특히 이번 사업을 위해 국내 최초로 건조되는 국산... "
2026-04-09,네이버뉴스,"신한은행, 현대건설과 MOU 체결…""압구정 3·5구역 중심 WM 특화 거점 추...",http://www.dailysmart.co.kr/news/articleView.html?idxno=122423,신한은행이 9일 현대건설과 전략적 업무협약을 체결하고 압구정 재건축 단지를 중심으로 주거와 금융을 결합한 새로운 자산관리 모델을 도입한다. 이번 협약은 압구정 현대를 비롯해 현대건설의 하이엔드 주거 브랜드... 
2026-04-09,네이버뉴스,"한국중부발전, 신안우이 해상풍력 PF 금융약정 체결",https://www.mk.co.kr/article/12012833,"전략적 투자자로서 발전공기업인 중부발전과 함께 한화오션, SK이터닉스, 현대건설이 참여한다. 하부 구조물 등 주요 기자재 공급의 전반을 국내 기업이 담당한다. 국내 최초로 건조되는 국산 15MW급 해상풍력터빈... "
2026-04-09,네이버뉴스,"중부발전, 신안우이 해상풍력 PF 체결…2.89조 조달·4월 착공",http://www.ikld.kr/news/articleView.html?idxno=332585,"또한 이번 사업에는 발전공기업인 중부발전을 비롯해 한화오션, SK이터닉스, 현대건설이 전략적 투자자로 참여하며, 하부 구조물 등 주요 기자재 공급을 국내 기업이 담당한다. 특히 국내 최초로 건조되는 15MW급... "
2026-04-09,네이버뉴스,"현대건설, 압구정 3·5구역에 '자산관리센터' 결집 추진",https://www.betanews.net/article/view/beta202604090068,"현대건설이 압구정 재건축 사업에 금융권 자산관리 서비스를 결합한 차별화 전략을 내세운다. 현대건설은 9일 신한은행, 신한투자증권을 포함한 8개 주요 금융사의 자산관리 특화 점포를 압구정 3·5구역에 유치하고... "
2026-04-09,네이버뉴스,"신한은행-현대건설, 압구정 재건축 단지에 주거 결합형 자산관리 모델 ...",https://www.newscammp.co.kr/news/articleView.html?idxno=6015,신한은행이 현대건설과 전략적 업무협약을 체결하고 압구정 재건축 단지를 중심으로 주거와 금융을 결합한 새로운 자산관리 모델을 도입한다. 이번 협약은 현대건설의 하이엔드 주거 브랜드인 '디에이치(THE H)'와... 
2026-04-09,네이버뉴스,"현대건설, 첨단기술로 건설 안전 선도 혁신기업 7곳 선정",https://www.betanews.net/article/view/beta202604090067,"현대건설은 '2026 H-Safe Open Innovation Challenge' 공모전에서 건설안전 혁신기업 7개 사를 최종 선정했다고 9일 밝혔다. 공모전은 정부와 지자체, 민간 건설사가 협력해 건설 현장 내 안전사고를 예방하기 위해 마련됐다.... "
2026-04-09,네이버뉴스,양효진 은퇴로 실탄 장전한 현대건설… FA 큰손 나서나,https://www.hankookilbo.com/news/article/A2026040915170001005?did=NA,특히 양효진(37)의 은퇴로 ‘공백 해소’와 ‘집 토끼 단속’이란 과제를 안은 현대건설이 FA시장 큰손으로 떠오를 기세다. 양효진의 연봉으로 투입됐던 8억 원이 빠지면서 ‘샐러리캡(팀 연봉 총액)’에도 여유가... 
2026-04-09,네이버뉴스,"신한은행, 압구정 재건축에 WM 거점 구축",https://www.econovill.com/news/articleView.html?idxno=736724,"신한은행이 현대건설과 손잡고 압구정 재건축 단지를 중심으로 주거와 금융을 결합한 자산관리 서비스를 선보인다. 신한은행은 현대건설과 전략적 업무협약(MOU)을 체결하고, 압구정 재건축 단지 내 자산관리 특화... "
2026-04-09,네이버뉴스,"중부발전, 신안우이 해상풍력 ‘3조 원 PF 금융약정’ 체결",http://mcnews.co.kr/86027,"전략적 투자자로서 발전공기업인 중부발전과 함께 한화오션, SK이터닉스, 현대건설이 참여한다. 하부 구조물 등 주요 기자재 공급의 전반을 국내 기업이 담당한다. 특히 이번 사업을 위해 국내 최초로 건조되는 국산... "
2026-04-09,네이버뉴스,"현대건설, 건설안전 혁신기업 7곳 선정… 현장 실증 본격화",https://www.pointdaily.co.kr/news/articleView.html?idxno=300573,사진=현대건설  현대건설이 2026 H-Safe 오픈 이노베이션 챌린지에서 스타트업 및 중소기업 7개사를 최종 선발했다고 9일 밝혔다. AI CCTV와 건설 로봇 등 안전 기술을 발굴하기 위함이다. 올해 처음 실시된 이번 공모에는 총... 
2026-04-09,네이버뉴스,"중부발전, 3.4조 규모 '신안우이 해상풍력' 금융약정 체결",https://www.straightnews.co.kr/news/articleView.html?idxno=299825,"발전공기업인 한국중부발전과 더불어 한화오션, SK이터닉스, 현대건설 등 국내 유수의 기업들이 전략적 투자자로 참여하며, 주요 기자재 공급 역시 국내 기업들이 담당한다. 특히 이번 사업에 투입되는 국산 15MW급... "
2026-04-09,네이버뉴스,"현대건설, 압구정3·5구역에 자산관리센터 도입…8곳 금융사 결집",https://www.mt.co.kr/estate/2026/04/09/2026040915474646808,"현대건설이 압구정 3·5구역에 공동주택 최초로 주요 금융사 점포를 결집한 금융권 프라이빗 자산관리센터를 도입한다. 현대건설은 신한은행, 신한투자증권을 포함한 8개 주요 금융사의 자산관리 특화 점포를 압구정 3... "
2026-04-09,네이버뉴스,"""안전기술 선도기업 육성""…현대건설 7곳 선정해 협업",https://www.mk.co.kr/article/12012768,"공모전 통해 우수기업 뽑아 현대건설이 '2026 H-Safe 오픈이노베이션 챌린지(Open Innovation Challenge)' 공모전을 열고 건설 안전 혁신 기업 7곳을 최종 선정했다고 9일 밝혔다. 이번 공모전은 정부와 지방자치단체, 민간... "
2026-04-09,네이버뉴스,"현대건설, 건설안전 혁신기업 7곳 선정",https://www.ezyeconomy.com/news/articleView.html?idxno=234595,현대건설이 건설 현장 안전문화 확산과 안전사고 예방을 위한 오픈이노베이션('2026 H-Safe Open Innovation Challenge') 공모전을 통해 혁신기업을 선정했다. 현대건설은 올해 처음으로 개최된 본 공모전에서 건설안전... 
2026-04-09,네이버뉴스,"신한은행, 압구정 재건축 단지 입주민 위한 자산관리 특화 거점 구축",https://www.megaeconomy.co.kr/news/newsview.php?ncode=1065600632567443,신한은행은 현대건설과 전략적 업무협약을 체결하고 압구정 3·5구역 등 재건축 단지를 중심으로 주거와 금융을 결합한 새로운 자산관리 모델을 도입한다고 9일 밝혔다. 이번 협약은 압구정 현대를 비롯해 현대건설의... 
2026-04-09,네이버뉴스,"현대건설, 압구정 3·5구역서 공동주택 최초 프라이빗 자산관리 센터 결...",https://news.bbsi.co.kr/news/articleView.html?idxno=4077458,현대건설이 압구정 3·5구역에 공동주택 최초로 금융권 프라이빗 자산관리 센터를 결집합니다. 현대건설은 오늘신한은행과 신한투자증권을 포함한 8개 주요 금융사의 자산관리 특화 점포를 압구정 3·5구역에 유치하고... 
2026-04-09,네이버뉴스,"현대건설, 압구정 3·5구역 단지 내 자산관리 센터 결집",https://www.polinews.co.kr/news/articleView.html?idxno=728018,현대건설이 서울 강남권 정비사업의 최대어로 꼽히는 압구정 3·5구역에 공동주택 최초로 '프라이빗 자산관리(WM) 거점'을 조성한다. 입주민의 자산 가치까지 관리하는 차별화된 주거 서비스를 선보이겠다는  것이다. 8개... 
2026-04-09,네이버뉴스,[ND 은행] 카카오뱅크·NH농협은행·신한은행 外,http://www.newsdream.kr/news/articleView.html?idxno=111224,"신한은행, 현대건설과 '주거 결합형 자산관리 모델 도입' MOU 신한은행이 현대건설과 전략적 업무협약을 체결하고 주거와 금융을 결합한 새로운 자산관리 모델을 도입한다. 양사는 압구정 재건축 단지 내 입주민을 위한... "
2026-04-09,네이버뉴스,"건설업계, 모듈러 엘리베이터 도입 확대",http://www.wsobi.com/news/articleView.html?idxno=309715,현대건설과 GS건설이 '모듈러 엘리베이터(Modular Elevator)' 기술 도입에 나서며 '탈현장건설(OSC)'ㆍ'프리패브(Prefabe)' 건축에 박차를 가하고 있다. 탈현장건설과 프리패브 건축은 최근 건설업계에서 주목받고 있는 차세대... 
2026-04-09,네이버뉴스,"신한은행, 현대건설과 주거 결합형 자산관리 모델 도입 위한 MOU 체결",http://www.thefirstmedia.net/news/articleView.html?idxno=197561,사진=신한은행 신한은행은 현대건설과 전략적 업무협약을 체결하고 압구정 재건축 단지를 중심으로 주거와 금융을 결합한 새로운 자산관리 모델을 도입한다고 9일 밝혔다. 이번 협약은 압구정 현대를 비롯해... 
2026-04-09,네이버뉴스,"[건설플러스] 현대건설, 건설안전 혁신기업 7개사 선정 外",https://news.dealsitetv.com/articles/168420,"현대건설이 건설 현장 안전사고 예방과 혁신 기술 도입을 위해 ‘2026 H-Safe 오픈이노베이션 챌린지’에서 최종 7개 혁신기업을 선정했다고 9일 밝혔다. 이번 공모전은 AI CCTV, 건설 로봇 등 혁신 기술을 현장에 선제적으로... "
2026-04-09,네이버뉴스,[건설업계 브리핑] 현대건설·대방건설·동화기업·LH·삼표시멘트·LX하...,https://daily.hankooki.com/news/articleView.html?idxno=1356626,"사진=챗GPT 생성 이미지 ◇ 현대건설, 압구정 3·5구역에 자산관리 특화 점포 유치 압구정 3,5구역 자산관리 특화 점포 결집 이미지. 사진=현대건설 제공 압구정 3·5구역 재건축 수주전에 참여한 현대건설이 단지 내... "
2026-04-09,네이버뉴스,"'현장형' 박상신 DL이앤씨 대표, 압구정·성수에 '아크로타운' 짓는다",https://www.insightkorea.co.kr/news/articleView.html?idxno=244392,현재 현대건설과 DL이앤씨가 입찰 참여를 공식적으로 밝혔다. 양사 모두 인근에 라운지 등 오프라인 거점을 마련하고 금융사들과 업무 협약을 체결하는 등 수주전에 공을 들이고 있다. 목동 일대에서도 존재감을... 
2026-04-09,네이버뉴스,"현대건설, 건설안전 공모전서 혁신기업 7곳 선정",http://www.seoulwire.com/news/articleView.html?idxno=716009,"현대건설이 건설 현장 안전문화 확산 및 안전사고 예방을 위해 '2026 H-Safe Open Innovation Challenge' 공모전에서 건설안전 혁신기업 7개사를 최종 선정했다고 9일 밝혔다. 해당 공모전은 정부와 지자체, 민간 건설사가 협력해... "
2026-04-09,네이버뉴스,"현대건설, 압구정 3·5구역에 '프라이빗 자산관리 센터' 유치… 공동주...",http://www.financialreview.co.kr/news/articleView.html?idxno=41547,"압구정 3·5구역 자산관리 특화 점포 결집 이미지 / 사진=현대건 현대건설이 서울 압구정 3·5구역에 국내 공동주택 최초로 주요 금융사들의 프라이빗 자산관리 센터를 유치하며, 주거 서비스의 영역을 금융 자산관리까지... "
2026-04-09,네이버뉴스,"신한은행, '압구정 재건축 단지'에 자산관리 거점 만든다",https://www.newsis.com/view/NISX20260409_0003585075,신한은행은 현대건설과 전략적 업무협약을 체결하고 압구정 3·5구역 등 재건축 단지를 중심으로 주거와 금융을 결합한 새로운 자산관리 모델을 도입한다고 9일 밝혔다. 이번 협약은 압구정 현대를 비롯해 현대건설의... 
2026-04-09,네이버뉴스,'신안우이 해상풍력' 금융단 구성 완료...사업현장 자금 본격 투입된다,https://www.todayenergy.kr/news/articleView.html?idxno=296408,"이번 약정식은 국민성장펀드 1호 메가프로젝트로 선정된 해당 사업의 금융단 구성이 완료됐음을 알리는 자리로, 정부와 산업은행, KB국민은행 등 18개 금융기관과 한화오션, 한국중부발전, SK이터닉스, 현대건설 등... "
2026-04-09,네이버뉴스,[Today 클리핑 - 금융] 신한금융ㆍ신한은행,https://www.datasom.co.kr/news/articleView.html?idxno=208314,"◆ 신한은행, 현대건설과 주거 결합형 자산관리 모델 선보인다 신한은행(은행장 정상혁)은 현대건설(대표이사 이한우)과 전략적 업무협약을 체결하고 압구정 재건축 단지를 중심으로 주거와 금융을 결합한 새로운... "
2026-04-09,네이버뉴스,"현대건설, 건설안전 오픈이노베이션 공모전 첫 개최…7개 혁신기업 선정",https://www.nextdaily.co.kr/news/articleView.html?idxno=248347,110개사 지원 중 AI CCTV·건설 로봇·안전교육 플랫폼 등 4개 부문 선발…3개월 현장 실증 현대건설이 올해 처음 개최한 '2026 H-Safe Open Innovation Challenge' 공모전에서 건설안전 혁신기업 7개사를 최종 선정했다고 9일... 
2026-04-09,네이버뉴스,"모듈러 경쟁, 이제 승강기까지…GS건설·현대엘리베이터 '맞손'",http://www.4th.kr/news/articleView.html?idxno=2110236,현대건설은 지난해 10월 현대엘리베이터와 공동주택 부문 모듈러 E/V 도입 협약을 체결한 뒤 올해 3월 인천 '힐스테이트 송도 센터파크' 현장에 국내 최초로 공동주택용 모듈러 엘리베이터를 적용했다. 현대건설에... 
2026-04-09,네이버뉴스,"신한은행, 압구정 재건축 단지에 '주거 결합형 자산관리' 도입",https://www.job-post.co.kr/news/articleView.html?idxno=213180,신한은행은 현대건설과 전략적 업무협약을 체결하고 압구정 재건축 단지를 중심으로 주거와 금융을 결합한 새로운 자산관리 모델을 도입한다고 9일 밝혔다. 이번 협약은 압구정 현대를 비롯해 현대건설의 '디에이치(THE... 
2026-04-09,네이버뉴스,[금융 브리프] KB금융 신한은행 NH농협은행 카카오뱅크 빗썸 코빗 KB금융,https://www.s-journal.co.kr/news/articleView.html?idxno=40354,"■ 신한은행, 현대건설과 주거 결합형 자산관리 모델 선보인다 신한은행(은행장 정상혁)은 현대건설(대표이사 이한우)과 전략적 업무협약을 체결하고 압구정 재건축 단지를 중심으로 주거와 금융을 결합한 새로운... "
2026-04-09,네이버뉴스,설계·시공서 주거서비스까지 AI기술 접목 확산,https://www.koscaj.com/news/articleView.html?idxno=323515,"대표적으로 현대건설은 인간 중심의 작업 방식에서 벗어나 AI 기술을 활용해 설계 정확성과 시공 안전성을 높이고 있다. 근로자 맞춤형 교육을 제공하는 안전관리 시스템을 비롯해 지하 저류시설 상태 진단, 침수 대응... "
2026-04-09,네이버뉴스,[거래소 외국인] 삼정전자우 왜 쓸어 담았나?...배당 메리트 부각,https://www.pinpointnews.co.kr/news/articleView.html?idxno=444258,"셀트리온과 현대건설, 미래에셋증권, 산일전기 등도 외국인 순매도 명단에 이름을 올리며 거래를 마감했다. 증시 전문가들은 ""외국인이 삼성전자와 하이닉스를 매도한 것은 업황에 대한 부정적 견해라기보다 단기... "
2026-04-09,네이버뉴스,"중동 '어설픈 휴전' 속, 코스피 '뚝'...반도체·車 주가 '급락'",http://www.choicenews.co.kr/news/articleView.html?idxno=163590,"GS건설(-4.95%), 현대건설(-2.81%), DL이앤씨(-0.95%) 등은 차익매물 속에 하락했다. 방산주 중 LIG넥스원(6.48%), 한화시스템(4.98%) 등이 껑충 뛰었고 한화에어로스페이스는 2.22% 하락했다. 조선주 중 한화오션(-3.29... "
2026-04-09,네이버뉴스,"삼성E&A에 중동 재건 수혜 기대감 높아져, 남궁홍 주무대서 보폭 다시 넓...",https://www.businesspost.co.kr/BP?command=article_view&num=435329,"다른 주요 건설사의 수주 규모를 보면 현대건설은 224억 달러(약 33조1900억 원), 현대엔지니어링 92억 달러(약 13조6300억 원), 대우건설 66억 달러(약 9조7800억 원), GS건설 59억 달러(약 8조7400억 원) 등이다. 삼성E&A는... "
2026-04-09,네이버뉴스,"신한은행·현대건설, 압구정 재건축에 자산관리 서비스 도입",https://www.ziksir.com/news/articleView.html?idxno=130296,신한은행이 현대건설과 주거 결합형 자산관리 모델을 선보인다. [신한은행]  신한은행이 현대건설과 주거와 금융을 결합한 새로운 자산관리 서비스를 선보인다. 신한은행은 9일 현대건설과 전략적 업무협약을 체결하고... 
2026-04-09,네이버뉴스,"[은행 뉴스브리핑] 진옥동 회장 ""지속가능 서사 만들 것""",https://www.asiatime.co.kr/article/20260409500352,□ 신한은행-현대건설 주거 결합형 자산관리 모델 선봬 신한은행은 현대건설과 전략적 업무협약을 체결하고 압구정 재건축 단지를 중심으로 주거와 금융을 결합한 새로운 자산관리 모델을 도입한다. 이번 협약은... 
2026-04-09,네이버뉴스,[금융단신] 국민은행·신한은행·하나은행·기업은행,https://daily.hankooki.com/news/articleView.html?idxno=1356747,"◇ 신한은행, 현대건설과 주거 결합형 자산관리 모델 선봬 신한은행은 현대건설과 업무협약을 체결하고 압구정 재건축 단지를 중심으로 주거와 금융을 결합한 새로운 자산관리 모델을 도입한다. 신한은행은 현대건설과... "
2026-04-09,네이버뉴스,"현대건설, 이란 '사우스파' 가스전 복구 참여하나...재건 물량 중 약 20%...",http://www.lkp.news/news/articleView.html?idxno=78975,현대건설이 중동 에너지 인프라 재건 사업에 참여할 것으로 예상된다. 증권업계에서는 현대건설이 약 37억~50억 달러 규모의 수주를 맡을 것으로 예상한다. 현대건설은 이란을 비롯한 중동 지역 내 플랜트 시공... 
2026-04-09,네이버뉴스,"현대건설, 압구정 3·5구역에 금융사 8곳 자산관리센터 집결",https://www.inthenews.co.kr/news/article.html?no=85418,공동주택 최초 프라이빗 자산관리 8개 금융사 원스톱 서비스 구축 인더뉴스 제해영 기자ㅣ현대건설은 압구정 3·5구역에 공동주택 최초로 금융권 프라이빗 자산관리 센터를 결집하고 입주민 전용 ‘원스톱 자산관리... 
2026-04-09,네이버뉴스,"신한은행, 현대건설 손잡고 주거 결합형 자산관리 모델 도입",http://www.whitepaper.co.kr/news/articleView.html?idxno=260820,"화이트페이퍼, WHITEPAPER(자료=신한은행)  신한은행(은행장 정상혁)은 현대건설(대표이사 이한우)과 전략적 업무협약을 체결하고 압구정 재건축 단지를 중심으로 주거와 금융을 결합한 새로운 자산관리 모델을... "
2026-04-09,네이버뉴스,"현대건설, 건설안전 혁신기업 7곳 선정…기술 검증 확대",https://www.inthenews.co.kr/news/article.html?no=85416,110개사 경쟁 통한 7개 기업 선발 안전기술 실증 및 협업 기회 확대 인더뉴스 제해영 기자ㅣ현대건설은 9일 건설 현장 안전문화 확산과 안전사고 예방을 위해 ‘2026 H-Safe Open Innovation Challenge’ 공모전에서 건설안전... 
2026-04-09,네이버뉴스,"""현대건설, 예상대로 무난할 1분기, 개선되는 센티""",https://www.newsquest.co.kr/news/articleView.html?idxno=264496,"현대건설의 1분기 추정 매출액과 영업이익은 시장 기대치에 부합할 것으로 보인다. 하나증권은 9일 현대건설에 대해 투자의견 'BUY'를 유지하고, 목표주가를 기존 13만원에서 24만원으로 상향했다. 목표주가는... "
2026-04-09,네이버뉴스,압구정·목동·신반포 재건축 '1라운드' 매치… 10일 시공사 입찰 마감,https://www.pointdaily.co.kr/news/articleView.html?idxno=300542,"◇ 압구정 3구역, 현대건설 단독 입찰 될까 사업 규모가 가장 큰 곳은 압구정 3구역이다. 강남구 압구정동 393-1번지 일대에 5175가구 규모의 아파트를 조성하는 프로젝트로, 예상 사업비는 5조5000억원이다. 3구역에... "
2026-04-09,네이버뉴스,"은행 PB, 아파트 안으로…주거 결합형 WM 경쟁 본격",http://www.4th.kr/news/articleView.html?idxno=2110228,신한은행은 현대건설과 압구정 3·5구역 재건축 단지를 중심으로 주거와 금융을 결합한 자산관리 모델을 도입한다고 9일 밝혔다. 양사는 현대건설의 하이엔드 주거 브랜드 '디에이치(THE H)'가 적용되는 단지 내 커뮤니티... 
2026-04-09,네이버뉴스,30대 건설사 벌점 '양호'…제도 보완 지적,https://www.goodkyung.com/news/articleView.html?idxno=285646,"30대 건설사 중 삼성물산 건설부문, 현대건설, 대우건설, DL이앤씨, 포스코이앤씨, 롯데건설, SK에코플랜트, DL건설, 두산에너빌리티, 서희건설, 제일건설, KCC건설, 우미건설, 대방건설, 금호건설, 두산건설, 한신공영... "
2026-04-09,네이버뉴스,"[A 금융가 소식] 신한은행·현대건설, 주거 결합형 자산관리 협력 본격...",https://www.asiaa.co.kr/news/articleView.html?idxno=246027,신한은행은 현대건설과 주거 결합형 자산관리 모델 협력을 본격화했다. KB금융그룹은 로보컵 2026 인천 메인 후원을 맡았다. KB국민은행은 경찰청 외국환평형기금 해외송금 업무를 수행한다. 우리금융캐피탈은 전사... 
2026-04-09,네이버뉴스,"현대건설, 자사 공모전에서 건설안전 혁신기업사 7곳 선정",https://www.seoulfn.com/news/articleView.html?idxno=626071,"현대건설은 '2026 H-Safe Open Innovation Challenge' 공모전에서 건설안전 혁신기업 7개사를 최종 선정했다고 9일 밝혔다. 올해 처음으로 개최된 본 공모전은 안전 관련 혁신 기술·서비스를 선제적으로 도입, 검증된 혁신... "
2026-04-09,네이버뉴스,압구정 3·4·5구역 수주전 본격화 … 내달 시공사 판도 가른다,https://biz.newdaily.co.kr/site/data/html/2026/04/09/2026040900245.html,업계 안팎에서는 현대건설의 단독 입찰 가능성에 무게를 두고 있다. 현행 규정상 입찰 참여 업체가 2곳에 미치지 못하면 유찰되며 같은 상황이 두 차례 반복될 경우 조합은 단독 응찰 업체와 수의계약을 체결할 수... 
2026-04-09,네이버뉴스,"신한은행, 압구정에 WM 거점 만든다…현대건설과 협력",https://www.ajunews.com/view/20260409154649891,입주민 대상 자산관리 금융 서비스 제공 아주경제=김윤섭 기자 angks678@ajunews.com 신한은행은 현대건설과 전략적 업무협약을 체결하고 압구정 재건축 단지를 중심으로 주거와 금융을 결합한 새로운 자산관리 모델을... 
2026-04-09,네이버뉴스,"현대건설, 압구정에 금융사 8곳 집결…단지 내 자산관리 서비스 도입",https://www.ziksir.com/news/articleView.html?idxno=130283,"현대건설이 압구정 3,5구역서 공동주택 최초 프라이빗 자산관리 센터를 결집시킨다. [현대건설]  현대건설이 압구정 3·5구역에 금융권 프라이빗 자산관리(WM) 서비스를 도입하며 고급 주거 서비스 경쟁력 강화에 나섰다.... "
2026-04-09,네이버뉴스,아파트도 ‘플랫폼’ 시대…진화하는 아파트 전용 앱 ‘주목’,http://www.lawissue.co.kr/view.php?ud=20260409155143352767191f6c6e_12,"대표 사례로는 현대건설의 ‘마이 힐스(my HILLS)’가 꼽힌다. 현대건설에 따르면 마이 힐스는 분양 및 청약 정보 조회부터 입주자 사전방문 예약, A/S 신청, 입주 후 홈 IoT 제어, 방문차량 등록, 공지사항 확인, 관리비 및... "
2026-04-09,네이버뉴스,"신한은행·현대건설, 압구정 디에이치에 '주거 결합 자산관리'",https://www.newsclaim.co.kr/news/articleView.html?idxno=3060251,"신한은행,정상혁 신한은행(은행장 정상혁)이 현대건설과 손잡고 압구정 재건축 단지에 특화 모델을 공개한다. 신한은행 제공 고급 주거 단지 안에 전용 자산관리 공간을 두는 '주거 결합형 WM'이 국내 금융·부동산... "
